id,username,date,time,tweet,user_id,timezone,mentions,hashtags,replies_count,likes_count,retweets_count,replies_count.1,cleaned_review,sentiment_polarity,sentiment,sentiment_int
1332082346489614336,melissamcoletti,2020-11-27,03:32:34,"#Technology companies are currently focused on #digital transformation, #ESG, #supplychain, and talent risk. See other priorities and risks for tech companies in the new #KPMG report #technology Industry CEO Outlook:   https://t.co/L3vANFsfn9",924266695,530,[],"['Technology', 'digital', 'ESG', 'supplychain', 'KPMG', 'technology']",0,0,0,0,technology companies are currently focused on digital transformation esg supplychain and talent risk see other priorities and risks for tech companies in the new kpmg report technology industry ceo outlook,0.0028409090909090884,Neutral,0
1331876506184900611,sscmtor,2020-11-26,13:54:38,#sustainability #gpp #procurement #supplychain #logistics #logisticsmanagement #disruption #supply #businessadministration #procurementmanagement #masterofscience #bestcoursever #mscba #business #lecture #zoom #virtualclassroom #value #inspiring #guestlecture #KPMG #consultants,1252200606749556742,530,[],"['sustainability', 'gpp', 'procurement', 'supplychain', 'logistics', 'logisticsmanagement', 'disruption', 'supply', 'businessadministration', 'procurementmanagement', 'masterofscience', 'bestcoursever', 'mscba', 'business', 'lecture', 'zoom', 'virtualclassroom', 'value', 'inspiring', 'guestlecture', 'KPMG', 'consultants']",0,1,0,0,sustainability gpp procurement supplychain logistics logisticsmanagement disruption supply businessadministration procurementmanagement masterofscience bestcoursever mscba business lecture zoom virtualclassroom value inspiring guestlecture kpmg consultants,0.5,Positive,1
1323309587726938113,liezelpistorius,2020-11-02,22:32:46,"#Technology companies are currently focused on #digital transformation, #ESG, #supplychain, and talent risk. See other priorities and risks for tech companies in the new #KPMG report #technology Industry CEO Outlook:   https://t.co/ayEuBeA7Hg",1098448242105245697,530,[],"['Technology', 'digital', 'ESG', 'supplychain', 'KPMG', 'technology']",0,0,0,0,technology companies are currently focused on digital transformation esg supplychain and talent risk see other priorities and risks for tech companies in the new kpmg report technology industry ceo outlook,0.0028409090909090884,Neutral,0
1322207448506146816,yaudette,2020-10-30,21:33:15,"#Technology companies are currently focused on #digital transformation, #ESG, #supplychain, and talent risk. See other priorities and risks for tech companies in the new #KPMG report #technology Industry CEO Outlook:  https://t.co/pIEP12ADRV",16412833,530,[],"['Technology', 'digital', 'ESG', 'supplychain', 'KPMG', 'technology']",0,0,1,0,technology companies are currently focused on digital transformation esg supplychain and talent risk see other priorities and risks for tech companies in the new kpmg report technology industry ceo outlook,0.0028409090909090884,Neutral,0
1322132213853384704,chriswtaxtech,2020-10-30,16:34:18,"#Technology companies are currently focused on #digital transformation, #ESG, #supplychain, and talent risk. See other priorities and risks for tech companies in the new #KPMG report #technology Industry CEO Outlook:  https://t.co/ioeYoSjOsv",832265180,530,[],"['Technology', 'digital', 'ESG', 'supplychain', 'KPMG', 'technology']",0,0,0,0,technology companies are currently focused on digital transformation esg supplychain and talent risk see other priorities and risks for tech companies in the new kpmg report technology industry ceo outlook,0.0028409090909090884,Neutral,0
1321524122271256580,jussipaski,2020-10-29,00:17:58,"#Technology companies are currently focused on #digital transformation, #ESG, #supplychain, and talent risk. See other priorities and risks for tech companies in the new #KPMG report   https://t.co/6ic88um60Y",570080747,530,[],"['Technology', 'digital', 'ESG', 'supplychain', 'KPMG']",0,2,0,0,technology companies are currently focused on digital transformation esg supplychain and talent risk see other priorities and risks for tech companies in the new kpmg report,0.0028409090909090884,Neutral,0
1321089983189602304,navinvagrawal,2020-10-27,19:32:51,"Despite causing global #supplychain disruption, the pandemic has given businesses a rare chance to reset. Find out how with #KPMG Powered Enterprise Supply Chain:  https://t.co/nTlajcWl9E",102112147,530,[],"['supplychain', 'KPMG']",0,0,0,0,despite causing global supplychain disruption the pandemic has given businesses a rare chance to reset find out how with kpmg powered enterprise supply chain,0.15,Positive,1
1316640206070702082,dz_nrw86,2020-10-15,12:51:01,Join for free on 15 October at 9am (CET): KPMG's Webcast on latest strategic thinking around aligning production and supply chain networks with a particular focus on India.   #KPMG; #supplychain; #India; #Germany  https://t.co/1QsDsAVvZZ,1095702177555927042,530,[],"['KPMG', 'supplychain', 'India', 'Germany']",0,0,0,0,join for free on 15 october at 9am cet kpmgs webcast on latest strategic thinking around aligning production and supply chain networks with a particular focus on india kpmg supplychain india germany,0.35555555555555557,Positive,1
1316067207537922052,mikemadura,2020-10-13,22:54:08,"KPMG: Despite causing global #supplychain disruption, the pandemic has given businesses a rare chance to reset. Find out how with #KPMG Powered Enterprise Supply Chain:  https://t.co/8YOCHQUmrZ  https://t.co/8EGTFohIp8",17157043,530,[],"['supplychain', 'KPMG']",0,0,0,0,kpmg despite causing global supplychain disruption the pandemic has given businesses a rare chance to reset find out how with kpmg powered enterprise supply chain,0.15,Positive,1
1316061293628063744,kpmg,2020-10-13,22:30:38,"Despite causing global #supplychain disruption, the pandemic has given businesses a rare chance to reset. Find out how with #KPMG Powered Enterprise Supply Chain:  https://t.co/mLfrfSOB0c  https://t.co/40NLbTH8K9",267939430,530,[],"['supplychain', 'KPMG']",1,12,8,1,despite causing global supplychain disruption the pandemic has given businesses a rare chance to reset find out how with kpmg powered enterprise supply chain,0.15,Positive,1
1315967026289049602,docpeterandrews,2020-10-13,16:16:03,Join for free on 15 October at 9am (CET): KPMG's Webcast on latest strategic thinking around aligning production and supply chain networks with a particular focus on India.   #KPMG; #supplychain; #India; #Germany  https://t.co/QKt3VdXxEq,20679623,530,[],"['KPMG', 'supplychain', 'India', 'Germany']",0,0,0,0,join for free on 15 october at 9am cet kpmgs webcast on latest strategic thinking around aligning production and supply chain networks with a particular focus on india kpmg supplychain india germany,0.35555555555555557,Positive,1
1315966307771318272,torhaupt,2020-10-13,16:13:11,Join for free on 15 October at 9am (CET): KPMG's Webcast on latest strategic thinking around aligning production and supply chain networks with a particular focus on India.   #KPMG; #supplychain; #India; #Germany  https://t.co/dpSPp0CzTj,760145396098269184,530,[],"['KPMG', 'supplychain', 'India', 'Germany']",0,0,0,0,join for free on 15 october at 9am cet kpmgs webcast on latest strategic thinking around aligning production and supply chain networks with a particular focus on india kpmg supplychain india germany,0.35555555555555557,Positive,1
1315928232047378435,kay_klopping,2020-10-13,13:41:53,Join for free on 15 October at 9am (CET): KPMG's Webcast on latest strategic thinking around aligning production and supply chain networks with a particular focus on India.   #KPMG; #supplychain; #India; #Germany  https://t.co/0hR6IXOT1e,822174919140245504,530,[],"['KPMG', 'supplychain', 'India', 'Germany']",0,0,0,0,join for free on 15 october at 9am cet kpmgs webcast on latest strategic thinking around aligning production and supply chain networks with a particular focus on india kpmg supplychain india germany,0.35555555555555557,Positive,1
1315926567218970624,michael74916004,2020-10-13,13:35:17,Join for free on 15 October at 9am (CET): KPMG's Webcast on latest strategic thinking around aligning production and supply chain networks with a particular focus on India.   #KPMG; #supplychain; #India; #Germany  https://t.co/v7oNDldTid,1179365034763403264,530,[],"['KPMG', 'supplychain', 'India', 'Germany']",0,0,0,0,join for free on 15 october at 9am cet kpmgs webcast on latest strategic thinking around aligning production and supply chain networks with a particular focus on india kpmg supplychain india germany,0.35555555555555557,Positive,1
1315917038389428224,lulijia,2020-10-13,12:57:25,Join for free on 15 October at 9am (CET): KPMG's Webcast on latest strategic thinking around aligning production and supply chain networks with a particular focus on India.   #KPMG; #supplychain; #India; #Germany  https://t.co/6eSPx0EPun,253051473,530,[],"['KPMG', 'supplychain', 'India', 'Germany']",0,0,0,0,join for free on 15 october at 9am cet kpmgs webcast on latest strategic thinking around aligning production and supply chain networks with a particular focus on india kpmg supplychain india germany,0.35555555555555557,Positive,1
1313479801089536001,gdoelmarketing,2020-10-06,19:32:42,"With over 90% of global supply chains impacted by Covid-19, building a more resilient #supplychain for the future is essential. Find out how with #KPMG Powered Enterprise Supply Chain.  https://t.co/k4zJLFPlfT",4204588092,530,[],"['supplychain', 'KPMG']",0,1,0,0,with over 90 of global supply chains impacted by covid19 building a more resilient supplychain for the future is essential find out how with kpmg powered enterprise supply chain,0.125,Positive,1
1310597747192586241,kpmg_ng,2020-09-28,20:40:27,"@lordgoodie, @KPMG_NG's Partner and Head of Consumer Industrial Markets, Audit Services, will be discussing ""Supply Chain and Finance in the FMCG sector"" at the Lagos Business School FMCG Online Interactive Session.  #staysafe #KPMG #FMCG #IndustrialMarkets #supplychain #finance  https://t.co/x2hHzYnOTd",259715661,530,"['lordgoodie', 'KPMG_NG']","['staysafe', 'KPMG', 'FMCG', 'IndustrialMarkets', 'supplychain', 'finance']",0,5,4,0,lordgoodie kpmgngs partner and head of consumer industrial markets audit services will be discussing supply chain and finance in the fmcg sector at the lagos business school fmcg online interactive session staysafe kpmg fmcg industrialmarkets supplychain finance,0.0,Neutral,0
1290143590098690050,akihabaranews,2020-08-03,10:02:56,"KPMG Origins, a joint Japan, China, and Australia project, is a blockchain-based track and trace platform, and its creators hope that it will revolutionize the management of supply chains. #KPMG #KPMGOrigins #Blockchain #SupplyChain #Japan #China  https://t.co/8URbJXrRl4",16960526,530,[],"['KPMG', 'KPMGOrigins', 'Blockchain', 'SupplyChain', 'Japan', 'China']",1,3,1,1,kpmg origins a joint japan china and australia project is a blockchainbased track and trace platform and its creators hope that it will revolutionize the management of supply chains kpmg kpmgorigins blockchain supplychain japan china,0.0,Neutral,0
1257684418975719427,bitcoinsguide,2020-05-05,20:21:46,"#IBM, #KPMG, #Merck, and #Walmart Conclude #FDA #Blockchain Pilot; #DLT Is Key In #SupplyChain Tracing.  It Surpasses U.S. Drug Supply Chain Security Act (#DSCSA) Compliance  🔎Reduces Recall Medicines From Several Days, To Just A Few Seconds*   https://t.co/eIbEuCeOeE",865284894292758528,530,[],"['IBM', 'KPMG', 'Merck', 'Walmart', 'FDA', 'Blockchain', 'DLT', 'SupplyChain', 'DSCSA']",0,4,1,0,ibm kpmg merck and walmart conclude fda blockchain pilot dlt is key in supplychain tracing it surpasses us drug supply chain security act dscsa compliance reduces recall medicines from several days to just a few seconds,-0.06666666666666667,Neutral,0
1252552859868160002,kpmgim,2020-04-21,16:30:47,Read 'Beyond this challenge' and learn what the COVID-19 response teaches for supply chains:  https://t.co/4War6kmkVb or contact Russell Kelly for more information. #kpmg #isleofman #iom #covid19 #supplychain @RKelly_KPMGIM  https://t.co/kHurGSlb4q,2350113450,530,['RKelly_KPMGIM'],"['kpmg', 'isleofman', 'iom', 'covid19', 'supplychain']",0,2,2,0,read beyond this challenge and learn what the covid19 response teaches for supply chains or contact russell kelly for more information kpmg isleofman iom covid19 supplychain rkellykpmgim,0.5,Positive,1
1242409302784081920,annikakrj,2020-03-24,16:43:55,What are the main areas that need immediate attention? And which next steps we all should be working on? Read the answers from Claudia's new blog post! #GSG #KPMG #SupplyChain,4826623091,530,[],"['GSG', 'KPMG', 'SupplyChain']",0,2,0,0,what are the main areas that need immediate attention and which next steps we all should be working on read the answers from claudias new blog post gsg kpmg supplychain,0.101010101010101,Positive,1
1238420148727369730,worm_robert,2020-03-13,16:32:26,Businesses are expected to take responsibility for the way their suppliers affect both #people and #environment. Supply chain specialists have identified a list of steps on how #KPMG is able to help these businesses reach a transparent #supplychain.  #risk  https://t.co/rONJd6tuYp,4928192722,530,[],"['people', 'environment', 'KPMG', 'supplychain', 'risk']",0,1,1,0,businesses are expected to take responsibility for the way their suppliers affect both people and environment supply chain specialists have identified a list of steps on how kpmg is able to help these businesses reach a transparent supplychain risk,0.2,Positive,1
1225442923707191296,aldewereld,2020-02-06,21:05:35,"SpringBoard event in collaboration with the #KPMG Netherlands - Industry experts shaerd their knowledge and best practices on cloud-based #SupplyChain technologies, blockchain, transparency in agriculture and food supply chains,  and more.  https://t.co/grlmz6pJt3",53661946,530,[],"['KPMG', 'SupplyChain']",0,0,0,0,springboard event in collaboration with the kpmg netherlands industry experts shaerd their knowledge and best practices on cloudbased supplychain technologies blockchain transparency in agriculture and food supply chains and more,0.75,Positive,1
1222214391585619968,blockchainusa2,2020-01-28,23:16:33,"In the calendar year last month December 2019, #Walmart, #KPMG, #Merck &amp; #IBM has finished the #Drug #SupplyChain Security Act Interoperability Pilot as part of the U.S. #FDA #PilotProjectProgram.  Read @BlockchainUSA  https://t.co/UNcIS67xYw  #BlockchainPharma #Pharma #Health  https://t.co/HOYSEKmq3v",1157331528960974853,530,['BlockchainUSA'],"['Walmart', 'KPMG', 'Merck', 'IBM', 'Drug', 'SupplyChain', 'FDA', 'PilotProjectProgram', 'BlockchainPharma', 'Pharma', 'Health']",0,1,1,0,in the calendar year last month december 2019 walmart kpmg merck amp ibm has finished the drug supplychain security act interoperability pilot as part of the us fda pilotprojectprogram read blockchainusa blockchainpharma pharma health,0.0,Neutral,0
1217709640424792066,derekm007,2020-01-16,12:56:16,I really like KPMG's take on getting beyond the hype of 4.0. Perhaps not a revolution but an evolution?  #kpmg #industry4 #epm #supplychain #bigdataanalytics #big4 #spreadsheets #epmcloud #forecasting #planninganalytics #knowyournu… https://t.co/sYgmju68o3  https://t.co/RoO6Y1UbKn,2949246448,530,[],"['kpmg', 'industry4', 'epm', 'supplychain', 'bigdataanalytics', 'big4', 'spreadsheets', 'epmcloud', 'forecasting', 'planninganalytics', 'knowyournu']",0,1,0,0,i really like kpmgs take on getting beyond the hype of 40 perhaps not a revolution but an evolution kpmg industry4 epm supplychain bigdataanalytics big4 spreadsheets epmcloud forecasting planninganalytics knowyournu,0.2,Positive,1
1214824609322803200,jerwintholen,2020-01-08,13:52:11,Enhancing due diligence in supply chain management #humanrights #supplychain #OECD #KPMG  https://t.co/GG6HCLRB7J,570777804,530,[],"['humanrights', 'supplychain', 'OECD', 'KPMG']",0,1,0,0,enhancing due diligence in supply chain management humanrights supplychain oecd kpmg,-0.125,Negative,-1
1214562617575923714,kpmgindia,2020-01-07,20:31:08,"Changes in consumer shopping behaviour are likely to segment #deliverymarkets into three different layers: same-hour, same-day and next-day delivery: #KPMG report  https://t.co/e8f1sLUFzo | #logistics #supplychain",237572296,530,[],"['deliverymarkets', 'KPMG', 'logistics', 'supplychain']",0,3,0,0,changes in consumer shopping behaviour are likely to segment deliverymarkets into three different layers samehour sameday and nextday delivery kpmg report logistics supplychain,0.0,Neutral,0
1212643207672147969,maikshakil,2020-01-02,13:24:05,Bringing enterprise analytics to transportation presents a unique opportunity to increase efficiency and meet global customer requirements. #kpmg #supplychain  https://t.co/81u253j6OO,415299729,530,[],"['kpmg', 'supplychain']",0,0,0,0,bringing enterprise analytics to transportation presents a unique opportunity to increase efficiency and meet global customer requirements kpmg supplychain,0.1875,Positive,1
