id,username,date,time,tweet,user_id,timezone,mentions,hashtags,replies_count,likes_count,retweets_count,replies_count.1,cleaned_review,sentiment_polarity,sentiment,sentiment_int
1322457726899769344,payuindiacare,2020-10-31,14:07:46,"@ani_raman Hi, we are here to help you. Please help us understand your concern along with the needful PayU Payment ID over DM for assistance.   https://t.co/M8R5hZBovU",3108265670,530,['ani_raman'],[],0,0,0,0,aniraman hi we are here to help you please help us understand your concern along with the needful payu payment id over dm for assistance,0.0,Neutral,0
1322440761636384769,payuindiacare,2020-10-31,13:00:21,"@sakthivelanr Hi, we are here to help you. Please help us understand your concern along with the needful Merchant ID/Case ID over DM for assistance.   https://t.co/M8R5hZBovU",3108265670,530,['sakthivelanr'],[],1,0,0,1,sakthivelanr hi we are here to help you please help us understand your concern along with the needful merchant idcase id over dm for assistance,0.0,Neutral,0
1322404964795248640,payuindiacare,2020-10-31,10:38:07,"@vishalmukadam Hi, we are here to help you. Please help us with the needful PayU Payment ID over DM for assistance.   https://t.co/M8R5hZBovU",3108265670,530,['vishalmukadam'],[],0,1,0,0,vishalmukadam hi we are here to help you please help us with the needful payu payment id over dm for assistance,0.0,Neutral,0
1322400794121887744,payuindiacare,2020-10-31,10:21:32,"@ChamkeeliTrippy Hi, we have shared the details over DM. Let us know for any other assistance.",3108265670,530,['ChamkeeliTrippy'],[],0,1,0,0,chamkeelitrippy hi we have shared the details over dm let us know for any other assistance,-0.125,Negative,-1
1322399638540808193,payuindiacare,2020-10-31,10:16:57,"@RajeshK82944879 Hi, we are here to help you. Please help us understand your concern along with the needful PayU Payment ID over DM for assistance.   https://t.co/M8R5hZBovU",3108265670,530,['RajeshK82944879'],[],0,0,0,0,rajeshk82944879 hi we are here to help you please help us understand your concern along with the needful payu payment id over dm for assistance,0.0,Neutral,0
1322094724346376192,payuindiacare,2020-10-30,14:05:20,@guddu2373 Hi! Our team is looking into this. We'll get you an update as soon as possible.,3108265670,530,['guddu2373'],[],0,0,0,0,guddu2373 hi our team is looking into this well get you an update as soon as possible,0.0,Neutral,0
1322094081296592896,payuindiacare,2020-10-30,14:02:46,"@sumangal531 Hi Sumangal, as checked our team contacted you and shared the needful details over an email. Please revert over the same mail for any further assistance.",3108265670,530,['sumangal531'],[],0,0,0,0,sumangal531 hi sumangal as checked our team contacted you and shared the needful details over an email please revert over the same mail for any further assistance,0.0,Neutral,0
1322073952194195458,payuindiacare,2020-10-30,12:42:47,"@Rahul_modak Hi Rahul, as checked our team member contacted you and shared the needful details with you. Let us know for any other assistance.",3108265670,530,['Rahul_modak'],[],1,0,0,1,rahulmodak hi rahul as checked our team member contacted you and shared the needful details with you let us know for any other assistance,-0.125,Negative,-1
1322069144515174400,payuindiacare,2020-10-30,12:23:41,@mailhaider • Transaction date along with the amount. • Email id or phone number used for processing the transaction. • First 6 and last 4 digits of your card. • UPI / VPA if any used,3108265670,530,['mailhaider'],[],1,0,0,1,mailhaider transaction date along with the amount email id or phone number used for processing the transaction first 6 and last 4 digits of your card upi vpa if any used,0.125,Positive,1
1322069103830421504,payuindiacare,2020-10-30,12:23:31,"@mailhaider Hi! We are not able to trace any transaction with the given information. Request you to share below mentioned details for further assistance. • PayU, Merchant and Bank reference number. • Scan copy of bank statement indicating the debit for the required transaction.",3108265670,530,['mailhaider'],[],0,0,0,0,mailhaider hi we are not able to trace any transaction with the given information request you to share below mentioned details for further assistance payu merchant and bank reference number scan copy of bank statement indicating the debit for the required transaction,-0.125,Negative,-1
1322067808260218880,payuindiacare,2020-10-30,12:18:22,"@Rahul_modak Hi, we have acknowledged your concern and will get this resolved for you on priority.",3108265670,530,['Rahul_modak'],[],0,0,0,0,rahulmodak hi we have acknowledged your concern and will get this resolved for you on priority,0.0,Neutral,0
1322065344630910976,payuindiacare,2020-10-30,12:08:35,@mailhaider Hi! Apologies for the inconvenience. Please allow us some time to get this checked and we’ll soon be back with an update.,3108265670,530,['mailhaider'],[],0,0,0,0,mailhaider hi apologies for the inconvenience please allow us some time to get this checked and well soon be back with an update,0.0,Neutral,0
1322060199952179200,payuindiacare,2020-10-30,11:48:09,"@sumangal531 Hi, we have acknowledged your concern and will get this resolved for you on priority.",3108265670,530,['sumangal531'],[],0,0,0,0,sumangal531 hi we have acknowledged your concern and will get this resolved for you on priority,0.0,Neutral,0
1322058957926531072,payuindiacare,2020-10-30,11:43:12,"@Suruchi0603 Since the said transactions are successfully processed, any refund/resolution will be provided by the merchant only. In case you do not receive support from the merchant, you may raise a chargeback at your issuing bank.(2/2)",3108265670,530,['Suruchi0603'],[],2,0,1,2,suruchi0603 since the said transactions are successfully processed any refundresolution will be provided by the merchant only in case you do not receive support from the merchant you may raise a chargeback at your issuing bank22,0.375,Positive,1
1322058847096246272,payuindiacare,2020-10-30,11:42:46,@Suruchi0603 PayU is a payment aggregator who helps merchants and customers to do online transactions. It is a merchant who delivers the services and gives refund/replacement as per their policy in case of any issues. (1/2),3108265670,530,['Suruchi0603'],[],0,1,0,0,suruchi0603 payu is a payment aggregator who helps merchants and customers to do online transactions it is a merchant who delivers the services and gives refundreplacement as per their policy in case of any issues 12,0.0,Neutral,0
1322038402003263489,payuindiacare,2020-10-30,10:21:31,"@keshav_tima Hi, we are here to help you. Please help us with the needful PayU Payment ID over DM for assistance.   https://t.co/M8R5hZBovU",3108265670,530,['keshav_tima'],[],0,0,0,0,keshavtima hi we are here to help you please help us with the needful payu payment id over dm for assistance,0.0,Neutral,0
1322037380392472577,payuindiacare,2020-10-30,10:17:28,"@KARTIKKUMARGU12 Hi, as checked refund was successfully initiated on 2020-09-24 for PayU id 11181364447, Amount - 24962.50 INR. Please find the needful Bank ARN no. for your reference 026816168461. Hope this helps.",3108265670,530,['KARTIKKUMARGU12'],[],1,0,0,1,kartikkumargu12 hi as checked refund was successfully initiated on 20200924 for payu id 11181364447 amount 2496250 inr please find the needful bank arn no for your reference 026816168461 hope this helps,0.75,Positive,1
1322034544594186241,payuindiacare,2020-10-30,10:06:12,"@TechInverted Hi, we are here to help you. Please help us understand your concern along with the needful Merchant ID/Case ID over DM for assistance.   https://t.co/M8R5hZBovU",3108265670,530,['TechInverted'],[],0,0,0,0,techinverted hi we are here to help you please help us understand your concern along with the needful merchant idcase id over dm for assistance,0.0,Neutral,0
1321725738156920832,payuindiacare,2020-10-29,13:39:07,@theAvinesh Hi! Apologies for the inconvenience if something went wrong. Request you to elaborate your concern along with your registered details in order for us to assist you further with your query.    https://t.co/M8R5hZBovU,3108265670,530,['theAvinesh'],[],0,0,0,0,theavinesh hi apologies for the inconvenience if something went wrong request you to elaborate your concern along with your registered details in order for us to assist you further with your query,0.0,Neutral,0
1321715282532995074,payuindiacare,2020-10-29,12:57:34,@logrow Hi! Apologies for the inconvenience. Request you to share your registered details in order for us to assist you further with your query.    https://t.co/M8R5hZBovU,3108265670,530,['logrow'],[],0,0,0,0,logrow hi apologies for the inconvenience request you to share your registered details in order for us to assist you further with your query,0.0,Neutral,0
1321415053183127557,payuindiacare,2020-10-28,17:04:34,"@HimanshChawla Hi, we are here to help you. Please help us understand your concern along with the needful Merchant ID/Case ID over DM for assistance.   https://t.co/M8R5hZBovU",3108265670,530,['HimanshChawla'],[],0,0,0,0,himanshchawla hi we are here to help you please help us understand your concern along with the needful merchant idcase id over dm for assistance,0.0,Neutral,0
1321353189862486016,payuindiacare,2020-10-28,12:58:44,"@KaranPa70714783 Hi Karan, as checked our team contacted you and shared the needful details. Let us know for any other assistance.",3108265670,530,['KaranPa70714783'],[],0,0,0,0,karanpa70714783 hi karan as checked our team contacted you and shared the needful details let us know for any other assistance,-0.125,Negative,-1
1321352760445427713,payuindiacare,2020-10-28,12:57:02,"@NESTBYAA Hi Arpit, as checked Hitesh from our team contacted you and shared the needful details. Let us know for any other assistance.",3108265670,530,['NESTBYAA'],[],1,1,0,1,nestbyaa hi arpit as checked hitesh from our team contacted you and shared the needful details let us know for any other assistance,-0.125,Negative,-1
1321347690077151237,payuindiacare,2020-10-28,12:36:53,"@kevalc7 Hi, please share the below details  over DM for assistance. • Transaction date along with the amount. • Email id or phone number used for processing the transaction. • First 6 and last 4 digits of your card   https://t.co/M8R5hZBovU",3108265670,530,['kevalc7'],[],0,0,0,0,kevalc7 hi please share the below details over dm for assistance transaction date along with the amount email id or phone number used for processing the transaction first 6 and last 4 digits of your card,0.125,Positive,1
1321344777913131008,payuindiacare,2020-10-28,12:25:19,"@NESTBYAA Hi, we have forwarded your concern to our team. They shall assist you soon for this. Appreciate your cooperation here.",3108265670,530,['NESTBYAA'],[],0,0,0,0,nestbyaa hi we have forwarded your concern to our team they shall assist you soon for this appreciate your cooperation here,0.0,Neutral,0
1321342086843527172,payuindiacare,2020-10-28,12:14:37,"@Sriniva58604496 Hi, we are here to help you. Please help us with the correct PayU Payment ID over DM for assistance.   https://t.co/M8R5hZBovU",3108265670,530,['Sriniva58604496'],[],2,0,0,2,sriniva58604496 hi we are here to help you please help us with the correct payu payment id over dm for assistance,0.0,Neutral,0
1321316969337876480,payuindiacare,2020-10-28,10:34:49,"@ajaxv94 Hi, we are here to help you. Please help us understand your concern along with the needful Merchant ID/Case ID over DM for assistance.   https://t.co/M8R5hZBovU",3108265670,530,['ajaxv94'],[],0,0,0,0,ajaxv94 hi we are here to help you please help us understand your concern along with the needful merchant idcase id over dm for assistance,0.0,Neutral,0
1321316488012165120,payuindiacare,2020-10-28,10:32:54,"@garryk4 Hey, this is a successful TXN via PayUmoney Payment ID 343907404 at our end, the amount for the same has been remitted to the merchant. For any concern regarding, delivery of the product//Refund you are requested to contact the merchant directly to get the status at their end.",3108265670,530,['garryk4'],[],0,0,0,0,garryk4 hey this is a successful txn via payumoney payment id 343907404 at our end the amount for the same has been remitted to the merchant for any concern regarding delivery of the productrefund you are requested to contact the merchant directly to get the status at their end,0.2833333333333333,Positive,1
1321310392698720256,payuindiacare,2020-10-28,10:08:41,"@shanitist Hi, please share the below details  over DM for assistance. • Scan copy of bank statement indicating the debit for the required transaction. • Email id or phone number used for processing the transaction. • First 6 and last 4 digits of your card   https://t.co/M8R5hZjNEm",3108265670,530,['shanitist'],[],0,1,0,0,shanitist hi please share the below details over dm for assistance scan copy of bank statement indicating the debit for the required transaction email id or phone number used for processing the transaction first 6 and last 4 digits of your card,0.125,Positive,1
1321083590709547010,payuindiacare,2020-10-27,19:07:27,"@GauravKChandu Hi! As checked with our team your refund got failed as the transaction is more than 6 months old. Further, we would suggest you to initiate manual refund or NEFT directly to customer.    https://t.co/M8R5hZjNEm",3108265670,530,['GauravKChandu'],[],0,0,0,0,gauravkchandu hi as checked with our team your refund got failed as the transaction is more than 6 months old further we would suggest you to initiate manual refund or neft directly to customer,0.04,Neutral,0
1321080907709640704,payuindiacare,2020-10-27,18:56:47,"@KaranPa70714783 Hi, we have acknowledged your concern and will get this resolved for you on priority.",3108265670,530,['KaranPa70714783'],[],2,0,0,2,karanpa70714783 hi we have acknowledged your concern and will get this resolved for you on priority,0.0,Neutral,0
1321035261917106176,payuindiacare,2020-10-27,15:55:24,@aakarsh_choubey Hi! I have forwarded your concern to our respective team. Please be assured we'll resolve your query as soon as possible.   https://t.co/M8R5hZBovU,3108265670,530,['aakarsh_choubey'],[],0,0,0,0,aakarshchoubey hi i have forwarded your concern to our respective team please be assured well resolve your query as soon as possible,0.0,Neutral,0
1321033168841928705,payuindiacare,2020-10-27,15:47:05,@aakarsh_choubey Hi! Apologies for the inconvenience. Please allow us some time to get this checked and we’ll soon be back with an update.   https://t.co/M8R5hZBovU,3108265670,530,['aakarsh_choubey'],[],0,0,0,0,aakarshchoubey hi apologies for the inconvenience please allow us some time to get this checked and well soon be back with an update,0.0,Neutral,0
1321023331802337280,payuindiacare,2020-10-27,15:08:00,@GauravKChandu Hi! I have forwarded your concern to our respective team. Please be assured we'll resolve your query as soon as possible.   https://t.co/M8R5hZBovU,3108265670,530,['GauravKChandu'],[],1,0,0,1,gauravkchandu hi i have forwarded your concern to our respective team please be assured well resolve your query as soon as possible,0.0,Neutral,0
1321021931856957441,payuindiacare,2020-10-27,15:02:26,@GauravKChandu Hi! Apologies for the inconvenience. Please allow us some time to get this checked and we’ll soon be back with an update.   https://t.co/M8R5hZBovU,3108265670,530,['GauravKChandu'],[],0,0,0,0,gauravkchandu hi apologies for the inconvenience please allow us some time to get this checked and well soon be back with an update,0.0,Neutral,0
1321005334274560000,payuindiacare,2020-10-27,13:56:29,@privygau Hi! Request you to try paying after sometime. Your transaction will go through.   https://t.co/M8R5hZBovU,3108265670,530,['privygau'],[],0,0,0,0,privygau hi request you to try paying after sometime your transaction will go through,0.0,Neutral,0
1320991983049998336,payuindiacare,2020-10-27,13:03:26,@akhilpw Hi! Our team is working on it. We'll get you an update soon.,3108265670,530,['akhilpw'],[],0,0,0,0,akhilpw hi our team is working on it well get you an update soon,0.0,Neutral,0
1320982235701407745,payuindiacare,2020-10-27,12:24:42,"@NESTBYAA Hi, we have acknowledged your concern and will get this resolved for you on priority.",3108265670,530,['NESTBYAA'],[],1,0,0,1,nestbyaa hi we have acknowledged your concern and will get this resolved for you on priority,0.0,Neutral,0
1320977057937985536,payuindiacare,2020-10-27,12:04:07,"@avgoud Hi, you need to select an option saying issue not resolved through  https://t.co/kJZ1ebyzxH and then raise a ticket for further assistance. Hope this helps.",3108265670,530,['avgoud'],[],1,0,0,1,avgoud hi you need to select an option saying issue not resolved through and then raise a ticket for further assistance hope this helps,0.0,Neutral,0
1320974689410318337,payuindiacare,2020-10-27,11:54:43,"@devanshjain3110 Hi, we are here to help you. Please help us understand your concern along with the needful Merchant ID/Case ID over DM for assistance.   https://t.co/M8R5hZBovU",3108265670,530,['devanshjain3110'],[],3,0,0,3,devanshjain3110 hi we are here to help you please help us understand your concern along with the needful merchant idcase id over dm for assistance,0.0,Neutral,0
1320963639931617280,payuindiacare,2020-10-27,11:10:48,@ForlornSumit Hi! Apologies for the inconvenience if something went wrong. Request you to elaborate your concern along with your registered details in order for us to assist you further with your query.   https://t.co/M8R5hZBovU,3108265670,530,['ForlornSumit'],[],0,0,0,0,forlornsumit hi apologies for the inconvenience if something went wrong request you to elaborate your concern along with your registered details in order for us to assist you further with your query,0.0,Neutral,0
1320950216141402112,payuindiacare,2020-10-27,10:17:28,"@dxmadan Hi! As informed earlier, this was a successful transaction via PayU id 10482832497 at our end . Further, we have received the chargeback against this transaction. Request you to contact your issuing bank for further assistance.   https://t.co/M8R5hZBovU",3108265670,530,['dxmadan'],[],0,0,0,0,dxmadan hi as informed earlier this was a successful transaction via payu id 10482832497 at our end further we have received the chargeback against this transaction request you to contact your issuing bank for further assistance,0.1875,Positive,1
1320948942301872129,payuindiacare,2020-10-27,10:12:24,"@FarhanS00474249 Hi, we are here to help you. Please help us understand your concern along with the needful PayU Payment ID over DM for assistance.   https://t.co/M8R5hZBovU",3108265670,530,['FarhanS00474249'],[],0,0,0,0,farhans00474249 hi we are here to help you please help us understand your concern along with the needful payu payment id over dm for assistance,0.0,Neutral,0
1320704681543282691,payuindiacare,2020-10-26,18:01:48,"@CrowdKash Hi, as checked Rajesh from our team contacted you and shared the needful details. Let us know for any other assistance.",3108265670,530,['CrowdKash'],[],0,0,0,0,crowdkash hi as checked rajesh from our team contacted you and shared the needful details let us know for any other assistance,-0.125,Negative,-1
1320704033028362242,payuindiacare,2020-10-26,17:59:13,"@saraswat2385 Hi! Apologies for the inconvenience. Request you to DM us your registered number and email id used during this transaction along with the screenshot of transaction details (Transaction id, amount and date) for further assistance with your query.   https://t.co/M8R5hZBovU",3108265670,530,['saraswat2385'],[],0,0,0,0,saraswat2385 hi apologies for the inconvenience request you to dm us your registered number and email id used during this transaction along with the screenshot of transaction details transaction id amount and date for further assistance with your query,0.0,Neutral,0
1320703395338936320,payuindiacare,2020-10-26,17:56:41,"@vickysh81678545 Hi! As checked, your transaction has been refunded. Further, amount will reflect in source account within 3-5  working days (except Saturday, Sunday and bank holidays).",3108265670,530,['vickysh81678545'],[],0,0,0,0,vickysh81678545 hi as checked your transaction has been refunded further amount will reflect in source account within 35 working days except saturday sunday and bank holidays,0.0,Neutral,0
1320701767194034178,payuindiacare,2020-10-26,17:50:13,"@avgoud Hi, we are here to help you. Please help us understand your concern along with the needful Merchant ID/Case ID over DM for assistance.   https://t.co/M8R5hZBovU",3108265670,530,['avgoud'],[],1,0,0,1,avgoud hi we are here to help you please help us understand your concern along with the needful merchant idcase id over dm for assistance,0.0,Neutral,0
1320695450811334657,payuindiacare,2020-10-26,17:25:07,"@Vinny5786 Hi! As checked, your transaction has been refunded. You will receive the amount in your source account within 5-7 working days (except Saturday, Sunday and bank holidays).   https://t.co/M8R5hZBovU",3108265670,530,['Vinny5786'],[],1,1,0,1,vinny5786 hi as checked your transaction has been refunded you will receive the amount in your source account within 57 working days except saturday sunday and bank holidays,0.0,Neutral,0
1320661805807538177,payuindiacare,2020-10-26,15:11:25,@Vinny5786 Hi! I have forwarded your concern to our respective team. Please be assured we'll resolve your query as soon as possible.   https://t.co/M8R5hZBovU,3108265670,530,['Vinny5786'],[],1,1,0,1,vinny5786 hi i have forwarded your concern to our respective team please be assured well resolve your query as soon as possible,0.0,Neutral,0
1320659169070858240,payuindiacare,2020-10-26,15:00:57,@Vinny5786 Hi! Apologies for the inconvenience. Please allow us some time to get this checked and we’ll soon be back with an update.   https://t.co/M8R5hZBovU,3108265670,530,['Vinny5786'],[],0,1,0,0,vinny5786 hi apologies for the inconvenience please allow us some time to get this checked and well soon be back with an update,0.0,Neutral,0
1320649839638499328,payuindiacare,2020-10-26,14:23:52,@vickysh81678545 Hi! I have forwarded your concern to our respective team. Please be assured we'll resolve your query as soon as possible.   https://t.co/M8R5hZBovU,3108265670,530,['vickysh81678545'],[],0,0,0,0,vickysh81678545 hi i have forwarded your concern to our respective team please be assured well resolve your query as soon as possible,0.0,Neutral,0
1320648523105271811,payuindiacare,2020-10-26,14:18:39,@vickysh81678545 Hi! Apologies for the inconvenience. Please allow us some time to get this checked and we’ll soon be back with an update.   https://t.co/M8R5hZBovU,3108265670,530,['vickysh81678545'],[],0,0,0,0,vickysh81678545 hi apologies for the inconvenience please allow us some time to get this checked and well soon be back with an update,0.0,Neutral,0
1320613422338170880,payuindiacare,2020-10-26,11:59:10,@tweetsbysumit Hi! As I can check we are already addressing your concern on our Facebook page. Request you to maintain one channel of communication in order to avoid delay in resolution.    https://t.co/M8R5hZBovU,3108265670,530,['tweetsbysumit'],[],0,0,0,0,tweetsbysumit hi as i can check we are already addressing your concern on our facebook page request you to maintain one channel of communication in order to avoid delay in resolution,0.0,Neutral,0
1320607969579388928,payuindiacare,2020-10-26,11:37:30,@tweetsbysumit Hi! Apologies for the inconvenience. Please allow us some time to get this checked and we’ll soon be back with an update.   https://t.co/M8R5hZBovU,3108265670,530,['tweetsbysumit'],[],0,0,0,0,tweetsbysumit hi apologies for the inconvenience please allow us some time to get this checked and well soon be back with an update,0.0,Neutral,0
1320597126305386496,payuindiacare,2020-10-26,10:54:25,"@pirjade_humer Hi! Apologies for the inconvenience. Request you to DM us your registered number and email id used during this transaction along with the screenshot of transaction details (Transaction id, amount and date) for further assistance with your query.   https://t.co/M8R5hZBovU",3108265670,530,['pirjade_humer'],[],1,0,0,1,pirjadehumer hi apologies for the inconvenience request you to dm us your registered number and email id used during this transaction along with the screenshot of transaction details transaction id amount and date for further assistance with your query,0.0,Neutral,0
1320583664711860227,payuindiacare,2020-10-26,10:00:55,@onlytaniya2310 Your welcome :),3108265670,530,['onlytaniya2310'],[],0,0,0,0,onlytaniya2310 your welcome,0.8,Positive,1
1320316546678337536,payuindiacare,2020-10-25,16:19:29,"@therajsarthak Hi Sartak, please DM us your merchant ID so that we can assist you.",3108265670,530,['therajsarthak'],[],1,0,0,1,therajsarthak hi sartak please dm us your merchant id so that we can assist you,0.0,Neutral,0
1320267946569027586,payuindiacare,2020-10-25,13:06:22,"@ForlornSumit Hi Sumit, please visit  https://t.co/bDHOvqBlmI to raise any query. You may also DM us your concern in detail so that we can assist you.",3108265670,530,['ForlornSumit'],[],0,0,0,0,forlornsumit hi sumit please visit to raise any query you may also dm us your concern in detail so that we can assist you,0.0,Neutral,0
1320223592856973312,payuindiacare,2020-10-25,10:10:07,"@CrowdKash We believe your account manager is in touch with you for the same issue, we are trying to get this fixed on the highest priority. Thanks  🙏 (2/2)",3108265670,530,['CrowdKash'],[],0,0,0,0,crowdkash we believe your account manager is in touch with you for the same issue we are trying to get this fixed on the highest priority thanks 22,0.10000000000000002,Positive,1
