id,username,date,time,tweet,user_id,timezone,mentions,hashtags,replies_count,likes_count,retweets_count,replies_count.1,cleaned_review,sentiment_polarity,sentiment,sentiment_int
1263407124157095936,payuindiacare,2020-05-21,15:21:46,@utekarrahul24 Hi Rahul! As checked this is a failed transaction via transaction id 6895474. Request you to connect with your bank for further assistance regarding this transaction.,3108265670,530,['utekarrahul24'],[],1,0,0,1,utekarrahul24 hi rahul as checked this is a failed transaction via transaction id 6895474 request you to connect with your bank for further assistance regarding this transaction,-0.25,Negative,-1
1263387589647663110,payuindiacare,2020-05-21,14:04:08,"@Shabbir35669709 Hi! As checked, our team has sent you an email regarding your concern. Request you to reply on same email for further assistance.",3108265670,530,['Shabbir35669709'],[],1,0,0,1,shabbir35669709 hi as checked our team has sent you an email regarding your concern request you to reply on same email for further assistance,0.0,Neutral,0
1263384681145233409,payuindiacare,2020-05-21,13:52:35,"@cprbykgs Hello Gomathi, please accept our sincere apology for the inconvenience caused. We never wanted you to go through this hassles. We have shared the settlement details with you over DM, please check and let us know in case of any further query.",3108265670,530,['cprbykgs'],[],0,0,0,0,cprbykgs hello gomathi please accept our sincere apology for the inconvenience caused we never wanted you to go through this hassles we have shared the settlement details with you over dm please check and let us know in case of any further query,0.25,Positive,1
1263381394299838464,payuindiacare,2020-05-21,13:39:31,@Shabbir35669709 Hi! I have forwarded your concern to our respective team. Please be assured we'll resolve your query as soon as possible.   https://t.co/M8R5hZBovU,3108265670,530,['Shabbir35669709'],[],0,0,0,0,shabbir35669709 hi i have forwarded your concern to our respective team please be assured well resolve your query as soon as possible,0.0,Neutral,0
1263378933543665666,payuindiacare,2020-05-21,13:29:44,@Shabbir35669709 Hi! Apologies for the inconvenience. Please allow us some time to get this checked and we’ll soon be back with an update.   https://t.co/M8R5hZBovU,3108265670,530,['Shabbir35669709'],[],0,0,0,0,shabbir35669709 hi apologies for the inconvenience please allow us some time to get this checked and well soon be back with an update,0.0,Neutral,0
1263364357770973184,payuindiacare,2020-05-21,12:31:49,@Arjunsarita Hi! Apologies for the inconvenience. Please can you confirm that are you a merchant or the customer.   https://t.co/M8R5hZBovU,3108265670,530,['Arjunsarita'],[],0,0,0,0,arjunsarita hi apologies for the inconvenience please can you confirm that are you a merchant or the customer,0.0,Neutral,0
1263359910550499328,payuindiacare,2020-05-21,12:14:09,"@free_rider Hi Hitanshi, we are sorry to hear about your experience with us. If you could please DM us your transaction details we'd love to look into it and get it resolved for you.     https://t.co/M8R5hZBovU",3108265670,530,['free_rider'],[],0,0,0,0,freerider hi hitanshi we are sorry to hear about your experience with us if you could please dm us your transaction details wed love to look into it and get it resolved for you,0.0,Neutral,0
1263355612328390656,payuindiacare,2020-05-21,11:57:04,"@girrajIITian @Facebook @PayUindia HI Girraj, please DM us your payment ID so that we may check and assist.",3108265670,530,"['girrajIITian', 'Facebook', 'PayUindia']",[],0,0,0,0,girrajiitian facebook payuindia hi girraj please dm us your payment id so that we may check and assist,0.0,Neutral,0
1263336239106670592,payuindiacare,2020-05-21,10:40:05,"@DevanshSRajput Hi Devansh, we regret the inconvenience. As communicated on Facebook, we have shared your concern with our team and we will keep you updated over there.",3108265670,530,['DevanshSRajput'],[],0,0,0,0,devanshsrajput hi devansh we regret the inconvenience as communicated on facebook we have shared your concern with our team and we will keep you updated over there,0.0,Neutral,0
1263102154987802628,payuindiacare,2020-05-20,19:09:55,@vihanev Hi! Apologies for the inconvenience. Request you to share your registered details in order for us to assist you further with your query.   https://t.co/M8R5hZBovU,3108265670,530,['vihanev'],[],0,0,0,0,vihanev hi apologies for the inconvenience request you to share your registered details in order for us to assist you further with your query,0.0,Neutral,0
1263057300559818752,payuindiacare,2020-05-20,16:11:41,"@Prizzy1D Hi, we are really sorry about this and totally understand your concern over here. We'd suggest you to raise this immediately to the Cyber Cell office and they shall assist you further.     https://t.co/M8R5hZBovU",3108265670,530,['Prizzy1D'],[],1,1,0,1,prizzy1d hi we are really sorry about this and totally understand your concern over here wed suggest you to raise this immediately to the cyber cell office and they shall assist you further,-0.16666666666666666,Negative,-1
1263034931560673281,payuindiacare,2020-05-20,14:42:48,"@Mplan17 Hi, we regret the inconvenience. We were experiencing temporary downtime due to service outage at Microsoft Azure across central India. Please try now and let us know if you need any assistance from us. Further, you may visit  https://t.co/kJZ1ebyzxH to raise any query.",3108265670,530,['Mplan17'],[],0,0,0,0,mplan17 hi we regret the inconvenience we were experiencing temporary downtime due to service outage at microsoft azure across central india please try now and let us know if you need any assistance from us further you may visit to raise any query,-0.041666666666666664,Neutral,0
1263031302116085760,payuindiacare,2020-05-20,14:28:23,@rafatshaikharts We regret the inconvenience. Please share your Ticket ID or Merchant ID so that we can look into it and assist you.,3108265670,530,['rafatshaikharts'],[],1,0,0,1,rafatshaikharts we regret the inconvenience please share your ticket id or merchant id so that we can look into it and assist you,0.0,Neutral,0
1263026214379253760,payuindiacare,2020-05-20,14:08:10,@JayadityaK Happy to Help!,3108265670,530,['JayadityaK'],[],0,0,0,0,jayadityak happy to help,0.8,Positive,1
1263006819674320896,payuindiacare,2020-05-20,12:51:05,"@mani2h Hi Manish, we regret your experience with us. We'd like to look into your issue and get it resolved for you. Please DM us your Merchant ID or your ticket ID.     https://t.co/M8R5hZBovU",3108265670,530,['mani2h'],[],1,0,0,1,mani2h hi manish we regret your experience with us wed like to look into your issue and get it resolved for you please dm us your merchant id or your ticket id,0.0,Neutral,0
1263006268605661184,payuindiacare,2020-05-20,12:48:54,"@gniranjan0022 Hi! As checked, refund has been initiated for the transaction after your approval for the same on your ticket id FP5814212313.",3108265670,530,['gniranjan0022'],[],0,0,0,0,gniranjan0022 hi as checked refund has been initiated for the transaction after your approval for the same on your ticket id fp5814212313,0.0,Neutral,0
1262998708158959617,payuindiacare,2020-05-20,12:18:52,@arjjunse Hi Arjjun! As I can check we are already addressing this concern on our other Facebook page. Request you to maintain one channel of communication in order to avoid delay in resolution.,3108265670,530,['arjjunse'],[],1,0,0,1,arjjunse hi arjjun as i can check we are already addressing this concern on our other facebook page request you to maintain one channel of communication in order to avoid delay in resolution,-0.125,Negative,-1
1262992497170460673,payuindiacare,2020-05-20,11:54:11,"@RaoManojKumar2 Hi! As informed earlier, request you to share the invoice as asked by our team on your ticket id GQ0369855724 for further assistance.",3108265670,530,['RaoManojKumar2'],[],2,0,0,2,raomanojkumar2 hi as informed earlier request you to share the invoice as asked by our team on your ticket id gq0369855724 for further assistance,0.0,Neutral,0
1262990046170251264,payuindiacare,2020-05-20,11:44:26,@MunnaKu55253216 Your welcome :)   https://t.co/M8R5hZBovU,3108265670,530,['MunnaKu55253216'],[],0,0,0,0,munnaku55253216 your welcome,0.8,Positive,1
1262978927904976896,payuindiacare,2020-05-20,11:00:16,"@AdarshAgarwala Hi Adarsh, please DM us your Payment ID or transaction details so that we may check and assist you.    https://t.co/M8R5hZBovU",3108265670,530,['AdarshAgarwala'],[],0,0,0,0,adarshagarwala hi adarsh please dm us your payment id or transaction details so that we may check and assist you,0.0,Neutral,0
1262974961808838661,payuindiacare,2020-05-20,10:44:30,"@GrvUnited We regret the unpleasant experience you had with us. We have shared your concern with our team, they will connect with you and get this resolved at the earliest. We shall keep you updated.     https://t.co/M8R5hZBovU",3108265670,530,['GrvUnited'],[],1,0,0,1,grvunited we regret the unpleasant experience you had with us we have shared your concern with our team they will connect with you and get this resolved at the earliest we shall keep you updated,-0.6499999999999999,Negative,-1
1262966737437437952,payuindiacare,2020-05-20,10:11:49,@singhraja501 Hi! Apologies for the inconvenience. Request you to raise your query via  https://t.co/kJZ1ebgYG9 and our team will assist you further with the process.    https://t.co/M8R5hZjNEm,3108265670,530,['singhraja501'],[],0,0,0,0,singhraja501 hi apologies for the inconvenience request you to raise your query via and our team will assist you further with the process,0.0,Neutral,0
1262965982181679105,payuindiacare,2020-05-20,10:08:49,@jayabharath97 Hi! Apologies for the inconvenience if something went wrong. Request you to elaborate your concern along with your registered details in order for us to assist you further with your query.    https://t.co/M8R5hZjNEm,3108265670,530,['jayabharath97'],[],0,0,0,0,jayabharath97 hi apologies for the inconvenience if something went wrong request you to elaborate your concern along with your registered details in order for us to assist you further with your query,0.0,Neutral,0
1262734852517883912,payuindiacare,2020-05-19,18:50:23,"@shivom_oza Hi Shivom, please share the below details over DM for assistance. • Scan copy of bank statement indicating the debit for the required transaction. • Transaction date along with the amount. • Email id or phone number used for processing the transaction.   https://t.co/M8R5hZBovU",3108265670,530,['shivom_oza'],[],0,0,0,0,shivomoza hi shivom please share the below details over dm for assistance scan copy of bank statement indicating the debit for the required transaction transaction date along with the amount email id or phone number used for processing the transaction,0.0,Neutral,0
1262730344207273986,payuindiacare,2020-05-19,18:32:29,"@ayush_dipzip Hi Ayush,  we are glad to inform you that your account stands completely live with us. Your pending settlement shall reflect in your account by tomorrow 8 PM. Let us know for any other assistance.",3108265670,530,['ayush_dipzip'],[],1,1,0,1,ayushdipzip hi ayush we are glad to inform you that your account stands completely live with us your pending settlement shall reflect in your account by tomorrow 8 pm let us know for any other assistance,0.17045454545454544,Positive,1
1262714510009266179,payuindiacare,2020-05-19,17:29:33,"@PayUmoneyCare Hi, the needful refund has been successfully initiated from our end and shall reflect in the source account within 3 to 5 working days. Let us know for any other assistance.",3108265670,530,['PayUmoneyCare'],[],0,0,0,0,payumoneycare hi the needful refund has been successfully initiated from our end and shall reflect in the source account within 3 to 5 working days let us know for any other assistance,0.3125,Positive,1
1262713770444419072,payuindiacare,2020-05-19,17:26:37,@lavanyadeepak Hi! Request you to elaborate your concern along with your registered details in order for us to assist you further with your query.   https://t.co/M8R5hZBovU,3108265670,530,['lavanyadeepak'],[],0,0,0,0,lavanyadeepak hi request you to elaborate your concern along with your registered details in order for us to assist you further with your query,0.25,Positive,1
1262707404640157707,payuindiacare,2020-05-19,17:01:19,"@SRaviKu36091188 Hi, thank you for sharing the needful refund approval.  We will soon update you regarding your refund status here.  Thanks!",3108265670,530,['SRaviKu36091188'],[],0,0,0,0,sraviku36091188 hi thank you for sharing the needful refund approval we will soon update you regarding your refund status here thanks,0.2,Positive,1
1262701095647801345,payuindiacare,2020-05-19,16:36:15,"@ayush_dipzip Hi Ayush, we will update you soon on this.",3108265670,530,['ayush_dipzip'],[],0,0,0,0,ayushdipzip hi ayush we will update you soon on this,0.0,Neutral,0
1262678414474874880,payuindiacare,2020-05-19,15:06:08,"@sneha_ddrwl Hi! As checked, this is a failed transaction and amount for same has been refunded on 19/05/2020 via RRN 013900380577. You will receive the amount in your source account within 5-7 working days (except Saturday, Sunday and bank holidays).   https://t.co/M8R5hZBovU",3108265670,530,['sneha_ddrwl'],[],0,0,0,0,snehaddrwl hi as checked this is a failed transaction and amount for same has been refunded on 19052020 via rrn 013900380577 you will receive the amount in your source account within 57 working days except saturday sunday and bank holidays,-0.25,Negative,-1
1262657790985728001,payuindiacare,2020-05-19,13:44:11,"@issaboyEsarje Hi, sorry for the inconvenience caused. We were experiencing temporary downtime due to service outage at Microsoft Azure across central India. Please try now and let us know if you need any assistance from us.",3108265670,530,['issaboyEsarje'],[],0,0,0,0,issaboyesarje hi sorry for the inconvenience caused we were experiencing temporary downtime due to service outage at microsoft azure across central india please try now and let us know if you need any assistance from us,-0.20833333333333334,Negative,-1
1262647711859216384,payuindiacare,2020-05-19,13:04:08,"@RishiSiddhant Hi, please drop us a mail at alliances.citrus@payu.in for assistance.",3108265670,530,"['RishiSiddhant', 'payu']",[],0,0,0,0,rishisiddhant hi please drop us a mail at alliancescitruspayuin for assistance,0.0,Neutral,0
1262642591612284928,payuindiacare,2020-05-19,12:43:47,"@aurovrata Hi, sorry for the inconvenience caused. We were experiencing temporary downtime due to service outage at Microsoft Azure across central India. Please try now and let us know if you need any assistance from us.",3108265670,530,['aurovrata'],[],0,0,0,0,aurovrata hi sorry for the inconvenience caused we were experiencing temporary downtime due to service outage at microsoft azure across central india please try now and let us know if you need any assistance from us,-0.20833333333333334,Negative,-1
1262642156369408000,payuindiacare,2020-05-19,12:42:03,"@SaurabhG86 Hi Saurabh, we have shared the needful over DM. Let us know for any other assistance.",3108265670,530,['SaurabhG86'],[],0,0,0,0,saurabhg86 hi saurabh we have shared the needful over dm let us know for any other assistance,-0.125,Negative,-1
1262639116623048704,payuindiacare,2020-05-19,12:29:58,@MunnaKu55253216 Hi! Please ask your merchant to connect with our team via  https://t.co/kJZ1ebyzxH and our team will assist him further with his concern.   https://t.co/M8R5hZBovU,3108265670,530,['MunnaKu55253216'],[],1,0,0,1,munnaku55253216 hi please ask your merchant to connect with our team via and our team will assist him further with his concern,0.0,Neutral,0
1262637758385807360,payuindiacare,2020-05-19,12:24:34,"@b770c6ff271e41f Hi, sorry for the inconvenience caused. We were experiencing temporary downtime due to service outage at Microsoft Azure across central India. Please try now and let us know if you need any assistance from us.",3108265670,530,['b770c6ff271e41f'],[],0,0,0,0,b770c6ff271e41f hi sorry for the inconvenience caused we were experiencing temporary downtime due to service outage at microsoft azure across central india please try now and let us know if you need any assistance from us,-0.20833333333333334,Negative,-1
1262634346046869504,payuindiacare,2020-05-19,12:11:01,"@CrowdKash Hi, sorry for the inconvenience caused. We were experiencing temporary downtime due to service outage at Microsoft Azure across central India. Please try now and let us know if you need any assistance from us.",3108265670,530,['CrowdKash'],[],0,0,0,0,crowdkash hi sorry for the inconvenience caused we were experiencing temporary downtime due to service outage at microsoft azure across central india please try now and let us know if you need any assistance from us,-0.20833333333333334,Negative,-1
1262629056966582274,payuindiacare,2020-05-19,11:50:00,@ek__bhartiya Hi! Our team is looking into this. We'll get you an update as soon as possible.,3108265670,530,['ek__bhartiya'],[],0,0,0,0,ekbhartiya hi our team is looking into this well get you an update as soon as possible,0.0,Neutral,0
1262624596282376194,payuindiacare,2020-05-19,11:32:16,@Rv8140001523 Hi! Apologies for the inconvenience. Please try using it now and let us know if you need any assistance from us.   https://t.co/M8R5hZBovU,3108265670,530,['Rv8140001523'],[],0,0,0,0,rv8140001523 hi apologies for the inconvenience please try using it now and let us know if you need any assistance from us,0.0,Neutral,0
1262619534315274241,payuindiacare,2020-05-19,11:12:09,@Mplan17 Hi! Apologies for the inconvenience. Please try using gateway again and let us know if you need any assistance from us.   https://t.co/M8R5hZBovU,3108265670,530,['Mplan17'],[],0,0,0,0,mplan17 hi apologies for the inconvenience please try using gateway again and let us know if you need any assistance from us,0.0,Neutral,0
1262614913626734592,payuindiacare,2020-05-19,10:53:48,"@Suraj_S_Nair Hi, we were experiencing temporary downtime due to service outage at Microsoft Azure. Please try now and, let us know if you need any assistance from us.",3108265670,530,['Suraj_S_Nair'],[],0,0,0,0,surajsnair hi we were experiencing temporary downtime due to service outage at microsoft azure please try now and let us know if you need any assistance from us,-0.125,Negative,-1
1262613738324021250,payuindiacare,2020-05-19,10:49:08,"@booksnbeyondbox Hi, sorry for the inconvenience caused here. We have shared the needful details over DM. Let us know for any further assistance.",3108265670,530,['booksnbeyondbox'],[],0,0,0,0,booksnbeyondbox hi sorry for the inconvenience caused here we have shared the needful details over dm let us know for any further assistance,-0.25,Negative,-1
1262377306682785792,payuindiacare,2020-05-18,19:09:38,@vihanev Hi! Apologies for the inconvenience if something went wrong. Request you to elaborate your concern along with your registered details in order for us to assist you further with your query.   https://t.co/M8R5hZjNEm,3108265670,530,['vihanev'],[],0,0,0,0,vihanev hi apologies for the inconvenience if something went wrong request you to elaborate your concern along with your registered details in order for us to assist you further with your query,0.0,Neutral,0
1262369335227453444,payuindiacare,2020-05-18,18:37:57,@cprbykgs Hi Gomathi. we are working on your concern raised and shall get this resolved for you on priority.,3108265670,530,['cprbykgs'],[],1,0,0,1,cprbykgs hi gomathi we are working on your concern raised and shall get this resolved for you on priority,0.0,Neutral,0
1262364454483660800,payuindiacare,2020-05-18,18:18:34,"@Panchams2 Hi, we understand your concern over here. We'd suggest you to raise this immediately to the Cyber Cell office and they shall assist you further.   https://t.co/M8R5hZBovU",3108265670,530,['Panchams2'],[],2,0,0,2,panchams2 hi we understand your concern over here wed suggest you to raise this immediately to the cyber cell office and they shall assist you further,0.0,Neutral,0
1262363803116691456,payuindiacare,2020-05-18,18:15:58,"@NeerajNeelu Hi, we are unable to share the details with you over DM.  You need to follow the page or change your privacy settings for the same.",3108265670,530,['NeerajNeelu'],[],1,0,0,1,neerajneelu hi we are unable to share the details with you over dm you need to follow the page or change your privacy settings for the same,-0.25,Negative,-1
1262357591125983232,payuindiacare,2020-05-18,17:51:17,@Jagjeet94207687 Hi! I have forwarded your concern to our respective team. Please be assured we'll resolve your query as soon as possible.   https://t.co/M8R5hZBovU,3108265670,530,['Jagjeet94207687'],[],0,0,0,0,jagjeet94207687 hi i have forwarded your concern to our respective team please be assured well resolve your query as soon as possible,0.0,Neutral,0
1262338229857955840,payuindiacare,2020-05-18,16:34:21,"@Rajesh_jsg Hi Rajesh, we would request you to share the needful proof of deliveries over Ticket id IN0454780056 so that we can process the settlement for you on priority.",3108265670,530,['Rajesh_jsg'],[],0,0,0,0,rajeshjsg hi rajesh we would request you to share the needful proof of deliveries over ticket id in0454780056 so that we can process the settlement for you on priority,0.0,Neutral,0
1262336595325140994,payuindiacare,2020-05-18,16:27:52,"@Rajesh_jsg Hi Rajesh, we are working on your concern raised. Please allow us some time for this. Rest assured we shall keep you posted till the closure.",3108265670,530,['Rajesh_jsg'],[],0,0,0,0,rajeshjsg hi rajesh we are working on your concern raised please allow us some time for this rest assured we shall keep you posted till the closure,0.0,Neutral,0
1262291659955433473,payuindiacare,2020-05-18,13:29:18,"@go_egreen Hi, we have successfully released your settlement from our end and the amount shall reflect in your account within 24 to 48 Hrs. Let us know for any other assistance.",3108265670,530,['go_egreen'],[],1,0,0,1,goegreen hi we have successfully released your settlement from our end and the amount shall reflect in your account within 24 to 48 hrs let us know for any other assistance,0.3125,Positive,1
1262290002681032704,payuindiacare,2020-05-18,13:22:43,"@PayUmoneyCare Hi Ayush, the address is not mentioned in the uploaded gov proof.  Please rectify the same so that we could get this resolved for you on priority.",3108265670,530,['PayUmoneyCare'],[],1,0,0,1,payumoneycare hi ayush the address is not mentioned in the uploaded gov proof please rectify the same so that we could get this resolved for you on priority,0.0,Neutral,0
1262276398229581825,payuindiacare,2020-05-18,12:28:39,"@imsuny19 Hi! As checked, our team contacted you and assisted you regarding your concern. Please write us back in case any further assistance is required.   https://t.co/M8R5hZBovU",3108265670,530,['imsuny19'],[],0,0,0,0,imsuny19 hi as checked our team contacted you and assisted you regarding your concern please write us back in case any further assistance is required,0.0,Neutral,0
1262272476765028352,payuindiacare,2020-05-18,12:13:05,"@SRaviKu36091188 Hi, please revert on the TicketId HV3076910109 that we've sent you seeking relevant approval for refund after TDR deduction so that we can get this resolved for you on priority.",3108265670,530,['SRaviKu36091188'],[],2,0,0,2,sraviku36091188 hi please revert on the ticketid hv3076910109 that weve sent you seeking relevant approval for refund after tdr deduction so that we can get this resolved for you on priority,0.4,Positive,1
1262265830726750225,payuindiacare,2020-05-18,11:46:40,@imsuny19 Hi! I have forwarded your concern to our respective team. Please be assured we'll resolve your query as soon as possible.   https://t.co/M8R5hZBovU,3108265670,530,['imsuny19'],[],0,0,0,0,imsuny19 hi i have forwarded your concern to our respective team please be assured well resolve your query as soon as possible,0.0,Neutral,0
1262260797394219008,payuindiacare,2020-05-18,11:26:40,"@ayush_dipzip Hi, we are working on your concern raised and shall get this resolved for you on priority.",3108265670,530,['ayush_dipzip'],[],1,0,0,1,ayushdipzip hi we are working on your concern raised and shall get this resolved for you on priority,0.0,Neutral,0
1262260717903679490,payuindiacare,2020-05-18,11:26:21,"@pebel_vsrk Hi! As checked, your issue has been resolved. Further, all your transaction has been refunded. All the amount will be refunded to source account within 5-7 working days.   https://t.co/M8R5hZBovU",3108265670,530,['pebel_vsrk'],[],0,0,0,0,pebelvsrk hi as checked your issue has been resolved further all your transaction has been refunded all the amount will be refunded to source account within 57 working days,0.0,Neutral,0
1262254587894829056,payuindiacare,2020-05-18,11:01:59,"@Shubham13955029 Hi Shunham, please help us with the Payu Payment ID via DM So that we could assist you for the same.    https://t.co/M8R5hZBovU",3108265670,530,['Shubham13955029'],[],0,0,0,0,shubham13955029 hi shunham please help us with the payu payment id via dm so that we could assist you for the same,0.0,Neutral,0
1262253963132297216,payuindiacare,2020-05-18,10:59:31,"@SRaviKu36091188 Hi, we have acknowledged your concern and will get this resolved for you on priority.",3108265670,530,['SRaviKu36091188'],[],0,0,0,0,sraviku36091188 hi we have acknowledged your concern and will get this resolved for you on priority,0.0,Neutral,0
1262248461321121793,payuindiacare,2020-05-18,10:37:39,"@sneha_ddrwl Hi! as checked, the given transaction is under pending status. We will get you an actual status on this transaction by tomorrow.   https://t.co/M8R5hZBovU",3108265670,530,['sneha_ddrwl'],[],2,0,0,2,snehaddrwl hi as checked the given transaction is under pending status we will get you an actual status on this transaction by tomorrow,0.0,Neutral,0
