id,username,date,time,tweet,user_id,timezone,mentions,hashtags,replies_count,likes_count,retweets_count,replies_count.1,cleaned_review,sentiment_polarity,sentiment,sentiment_int
1281519684131491840,payuindiacare,2020-07-10,14:54:36,@dbalunayak Hi! I have forwarded your concern to our respective team. Please be assured we'll resolve your query as soon as possible.   https://t.co/M8R5hZBovU,3108265670,530,['dbalunayak'],[],0,0,0,0,dbalunayak hi i have forwarded your concern to our respective team please be assured well resolve your query as soon as possible,0.0,Neutral,0
1281516154645704704,payuindiacare,2020-07-10,14:40:35,@dbalunayak Hi! Apologies for the inconvenience. Please allow us some time to get this checked and we’ll soon be back with an update.   https://t.co/M8R5hZBovU,3108265670,530,['dbalunayak'],[],0,0,0,0,dbalunayak hi apologies for the inconvenience please allow us some time to get this checked and well soon be back with an update,0.0,Neutral,0
1281494342750711808,payuindiacare,2020-07-10,13:13:54,"@rithikkumar41 Hi Rithik, we have responded to DM.",3108265670,530,['rithikkumar41'],[],0,0,0,0,rithikkumar41 hi rithik we have responded to dm,0.0,Neutral,0
1281487549937008642,payuindiacare,2020-07-10,12:46:55,@Iamsuraj999 Hi! I have forwarded your concern to our respective team. Please be assured we'll resolve your query as soon as possible.   https://t.co/M8R5hZBovU,3108265670,530,['Iamsuraj999'],[],1,0,0,1,iamsuraj999 hi i have forwarded your concern to our respective team please be assured well resolve your query as soon as possible,0.0,Neutral,0
1281456403429781505,payuindiacare,2020-07-10,10:43:09,"@ShivamITF Hi Shivam, please visit  https://t.co/yeDndWywAj to raise any query or DM us your contact detail so that we can connect with you.",3108265670,530,['ShivamITF'],[],0,0,0,0,shivamitf hi shivam please visit to raise any query or dm us your contact detail so that we can connect with you,0.0,Neutral,0
1281447214175277056,payuindiacare,2020-07-10,10:06:38,"@Rishavdevk Hi Rishav, we've shared your request with our team and you will hear from them soon. We will keep you posted.   https://t.co/M8R5hZBovU",3108265670,530,['Rishavdevk'],[],0,0,0,0,rishavdevk hi rishav weve shared your request with our team and you will hear from them soon we will keep you posted,0.0,Neutral,0
1281446989142487045,payuindiacare,2020-07-10,10:05:45,@atodd98560968 Hi! Apologies for the inconvenience. Request you to share your ticket id for further assistance.,3108265670,530,['atodd98560968'],[],0,0,0,0,atodd98560968 hi apologies for the inconvenience request you to share your ticket id for further assistance,0.0,Neutral,0
1281167108743692290,payuindiacare,2020-07-09,15:33:36,"@whydisway Hi Vishal, we'd love to look into it and assist you. Please DM us the ticket ID or email ID.    https://t.co/M8R5hZBovU",3108265670,530,['whydisway'],[],0,0,0,0,whydisway hi vishal wed love to look into it and assist you please dm us the ticket id or email id,0.5,Positive,1
1281145559047221248,payuindiacare,2020-07-09,14:07:58,"@viveklath Hi Vivek, thanks for reaching out, we will definitely look through it.",3108265670,530,['viveklath'],[],0,0,0,0,viveklath hi vivek thanks for reaching out we will definitely look through it,0.1,Positive,1
1281129716452225025,payuindiacare,2020-07-09,13:05:01,"@Sameer20990213 Hi Sameer, we'd like to understand if this is an unauthorized transaction or the payment was made by you only.    https://t.co/M8R5hZBovU",3108265670,530,['Sameer20990213'],[],0,0,0,0,sameer20990213 hi sameer wed like to understand if this is an unauthorized transaction or the payment was made by you only,0.0,Neutral,0
1281120406766620677,payuindiacare,2020-07-09,12:28:01,"@Shivanshu_2007 Hi Shivanshu, that's unfortunate. We sincerely regret the inconvenience. We are getting this checked with our team and we'll get this resolved for you at the earliest.    https://t.co/M8R5hZBovU",3108265670,530,['Shivanshu_2007'],[],1,0,0,1,shivanshu2007 hi shivanshu thats unfortunate we sincerely regret the inconvenience we are getting this checked with our team and well get this resolved for you at the earliest,0.0,Neutral,0
1281100079407882245,payuindiacare,2020-07-09,11:07:15,"@RajibBa56904983 Hi, we have acknowledged your concern and will get this resolved for you at the earliest.",3108265670,530,['RajibBa56904983'],[],2,0,0,2,rajibba56904983 hi we have acknowledged your concern and will get this resolved for you at the earliest,0.0,Neutral,0
1281096004821909504,payuindiacare,2020-07-09,10:51:03,"@writeofcentre Hi Vibhav, we are here to help you. Please help us with your website URL, Email id, and registered contact details over DM for assistance.    https://t.co/M8R5hZBovU",3108265670,530,['writeofcentre'],[],0,0,0,0,writeofcentre hi vibhav we are here to help you please help us with your website url email id and registered contact details over dm for assistance,0.0,Neutral,0
1281091739277594624,payuindiacare,2020-07-09,10:34:06,"@s_jaskirat Hi, As per our records, your transaction attempt with the PayU ID:334866378  processed on 2020-07-08  is failed and we have not received funds for the same yet. We request you to wait for 2 working days and we will update you with the exact status of this transaction. Thanks!",3108265670,530,['s_jaskirat'],[],1,0,0,1,sjaskirat hi as per our records your transaction attempt with the payu id334866378 processed on 20200708 is failed and we have not received funds for the same yet we request you to wait for 2 working days and we will update you with the exact status of this transaction thanks,-0.012499999999999997,Neutral,0
1281087280526921729,payuindiacare,2020-07-09,10:16:23,"@Salmanusyed Hi, sorry to hear that. Please DM us your registered details (Email ID, Mobile number, Legal name &amp; Domain name)so that we can check and assist on priority.    https://t.co/M8R5hZBovU",3108265670,530,['Salmanusyed'],[],1,0,0,1,salmanusyed hi sorry to hear that please dm us your registered details email id mobile number legal name amp domain nameso that we can check and assist on priority,-0.15,Negative,-1
1281086484297048065,payuindiacare,2020-07-09,10:13:13,"@Vaibhav42334754 Hi Vaibhav, we have responded to your DM.",3108265670,530,['Vaibhav42334754'],[],0,0,0,0,vaibhav42334754 hi vaibhav we have responded to your dm,0.0,Neutral,0
1280839604426305537,payuindiacare,2020-07-08,17:52:13,"@TheSanghiBrain Hi Aabhas, please help us with the needful Merchant ID/Case ID over DM for assistance.    https://t.co/M8R5hZBovU",3108265670,530,['TheSanghiBrain'],[],0,0,0,0,thesanghibrain hi aabhas please help us with the needful merchant idcase id over dm for assistance,0.0,Neutral,0
1280823523380871168,payuindiacare,2020-07-08,16:48:19,"@ShivamM21456920 Hi, please share the below details over DM for assistance. • Scan copy of bank statement indicating the debit for the required transaction. • Transaction date along with the amount. • Email id or phone number used for processing the transaction.    https://t.co/M8R5hZBovU",3108265670,530,['ShivamM21456920'],[],0,0,0,0,shivamm21456920 hi please share the below details over dm for assistance scan copy of bank statement indicating the debit for the required transaction transaction date along with the amount email id or phone number used for processing the transaction,0.0,Neutral,0
1280822294793732096,payuindiacare,2020-07-08,16:43:26,"@booksyaari Hi,  Please follow the below steps to download commission invoice: - Login to your PayUmoney account - Go to Settlement tab on the left panel - Click on generate report under the TDR report.  Let us know for any further assistance.",3108265670,530,['booksyaari'],[],0,0,0,0,booksyaari hi please follow the below steps to download commission invoice login to your payumoney account go to settlement tab on the left panel click on generate report under the tdr report let us know for any further assistance,0.0,Neutral,0
1280800583717281792,payuindiacare,2020-07-08,15:17:09,"@Vengabus Hi, we have notified our team about this. Meanwhile, feel free to drop a mail at  alliances.citrus@payu.in for any further assistance.",3108265670,530,"['Vengabus', 'payu']",[],0,0,0,0,vengabus hi we have notified our team about this meanwhile feel free to drop a mail at alliancescitruspayuin for any further assistance,0.2,Positive,1
1280767247657533442,payuindiacare,2020-07-08,13:04:42,@Hackersdaddy_in Hi! Apologies for the inconvenience if something went wrong. Request you to elaborate your concern along with your registered details in order for us to assist you further with your query.    https://t.co/M8R5hZBovU,3108265670,530,['Hackersdaddy_in'],[],1,0,0,1,hackersdaddyin hi apologies for the inconvenience if something went wrong request you to elaborate your concern along with your registered details in order for us to assist you further with your query,0.0,Neutral,0
1280753196198096896,payuindiacare,2020-07-08,12:08:51,"@samdtrivedi1 Hi,  We are here to help you. please help us with the needful PayU Payment ID over DM for assistance.",3108265670,530,['samdtrivedi1'],[],1,0,0,1,samdtrivedi1 hi we are here to help you please help us with the needful payu payment id over dm for assistance,0.0,Neutral,0
1280742802687586304,payuindiacare,2020-07-08,11:27:33,"@Himansh00547369 Hi, You can raise your concern through  https://t.co/kJZ1ebyzxH  for assistance.",3108265670,530,['Himansh00547369'],[],1,0,0,1,himansh00547369 hi you can raise your concern through for assistance,0.0,Neutral,0
1280727330214645761,payuindiacare,2020-07-08,10:26:04,"@ashishsanal Hi! Apologies for the inconvenience. Request you to DM us your registered number along with the screenshot of transaction details (Transaction id, amount and date) and we will get this checked for you.    https://t.co/M8R5hZBovU",3108265670,530,['ashishsanal'],[],0,0,0,0,ashishsanal hi apologies for the inconvenience request you to dm us your registered number along with the screenshot of transaction details transaction id amount and date and we will get this checked for you,0.0,Neutral,0
1280496533167890435,payuindiacare,2020-07-07,19:08:58,@Sameer20990213 Please DM us for further assistance.    https://t.co/M8R5hZjNEm,3108265670,530,['Sameer20990213'],[],0,0,0,0,sameer20990213 please dm us for further assistance,0.0,Neutral,0
1280496182893195268,payuindiacare,2020-07-07,19:07:35,"@Sameer20990213 Hi Sameer, we regret the inconvenience. If you have already filed a complaint at Cyber cell, they will contact us for the same and necessary details will be provided internally by our team. Hence, we request you to follow up with Cyber cell from your end.",3108265670,530,['Sameer20990213'],[],4,0,0,4,sameer20990213 hi sameer we regret the inconvenience if you have already filed a complaint at cyber cell they will contact us for the same and necessary details will be provided internally by our team hence we request you to follow up with cyber cell from your end,-0.075,Neutral,0
1280481286541328384,payuindiacare,2020-07-07,18:08:23,"@SushantJPEW Hi Sushant, as per the conversation on DM, we hope your issue has been resolved.",3108265670,530,['SushantJPEW'],[],1,0,0,1,sushantjpew hi sushant as per the conversation on dm we hope your issue has been resolved,0.0,Neutral,0
1280392685849722881,payuindiacare,2020-07-07,12:16:19,@Praveen18445473 The refund is not getting processed either due to insufficient funds in your account. Please DM for further assistance.  (2/2)   https://t.co/M8R5hZBovU,3108265670,530,['Praveen18445473'],[],2,0,0,2,praveen18445473 the refund is not getting processed either due to insufficient funds in your account please dm for further assistance 22,-0.0625,Neutral,0
1280392482698625024,payuindiacare,2020-07-07,12:15:31,"@Praveen18445473 Hi Praveen, we regret the unpleasant experience you had with us. You may visit  https://t.co/kJZ1ebyzxH to raise any query with us. Moreover, please note that the settlement of your payment- 324523213 is not getting processed as you have initiated a refund. (1/2)",3108265670,530,['Praveen18445473'],[],0,0,0,0,praveen18445473 hi praveen we regret the unpleasant experience you had with us you may visit to raise any query with us moreover please note that the settlement of your payment 324523213 is not getting processed as you have initiated a refund 12,-0.6499999999999999,Negative,-1
1280373684696313856,payuindiacare,2020-07-07,11:00:49,"@sehgal121 Hi! As checked, your issue has been resolved. Your settlement has been released yesterday via UTR CITIN20094214028. Request you to check the same. Please write us back in case any further assistance is required.   https://t.co/M8R5hZBovU",3108265670,530,['sehgal121'],[],0,0,0,0,sehgal121 hi as checked your issue has been resolved your settlement has been released yesterday via utr citin20094214028 request you to check the same please write us back in case any further assistance is required,0.0,Neutral,0
1280358860339871744,payuindiacare,2020-07-07,10:01:54,"@carpediemnoww Hi, we regret the inconvenience. We have responded to DM, please check and revert for further assistance.    https://t.co/M8R5hZBovU",3108265670,530,['carpediemnoww'],[],0,0,0,0,carpediemnoww hi we regret the inconvenience we have responded to dm please check and revert for further assistance,0.0,Neutral,0
1280127111949242368,payuindiacare,2020-07-06,18:41:01,"@Sauravind Hi! As checked, our respective team has updated you regarding the status of your concern. Please write us back in case any further assistance is required.",3108265670,530,['Sauravind'],[],0,0,0,0,sauravind hi as checked our respective team has updated you regarding the status of your concern please write us back in case any further assistance is required,0.0,Neutral,0
1280117700568641537,payuindiacare,2020-07-06,18:03:37,"@ReShivaram Hi, we will check and update on the DM.   https://t.co/M8R5hZBovU",3108265670,530,['ReShivaram'],[],0,0,0,0,reshivaram hi we will check and update on the dm,0.0,Neutral,0
1280114283603357696,payuindiacare,2020-07-06,17:50:03,"@techabdulkhalik Hi, apologize for the delay in response here. We believe our team has contacted you and assist accordingly, feel free to reach out for further assistance.",3108265670,530,['techabdulkhalik'],[],0,0,0,0,techabdulkhalik hi apologize for the delay in response here we believe our team has contacted you and assist accordingly feel free to reach out for further assistance,0.2,Positive,1
1280078853948362759,payuindiacare,2020-07-06,15:29:16,"@FiZbQ Hi Soumit, we have shared the needful details over DM. Let us know for any other assistance.",3108265670,530,['FiZbQ'],[],0,0,0,0,fizbq hi soumit we have shared the needful details over dm let us know for any other assistance,-0.125,Negative,-1
1280077432758788096,payuindiacare,2020-07-06,15:23:37,"@TitusRobyK Hi, please DM us your transaction details so that we can check and assist you.    https://t.co/M8R5hZBovU",3108265670,530,['TitusRobyK'],[],1,1,0,1,titusrobyk hi please dm us your transaction details so that we can check and assist you,0.0,Neutral,0
1280068775732056064,payuindiacare,2020-07-06,14:49:13,@Saurabh61359258 Someone from the team will contact you and address your concern by today soon.,3108265670,530,['Saurabh61359258'],[],1,0,0,1,saurabh61359258 someone from the team will contact you and address your concern by today soon,0.0,Neutral,0
1280047591086886912,payuindiacare,2020-07-06,13:25:02,"@TeluguTechSteps Hi, your transactions have been refunded and same will get credited into the source account within 5 to 7 working days (Excluding Saturday, Sunday, and bank holiday) from the date of refund.",3108265670,530,['TeluguTechSteps'],[],0,0,0,0,telugutechsteps hi your transactions have been refunded and same will get credited into the source account within 5 to 7 working days excluding saturday sunday and bank holiday from the date of refund,0.0,Neutral,0
1280018946544918528,payuindiacare,2020-07-06,11:31:13,"@Saurabh61359258 Hi, we regret the inconvenience caused. We have shared your concern with our team, they will connect with you and assist you on priority. Please DM for further assistance.     https://t.co/M8R5hZBovU",3108265670,530,['Saurabh61359258'],[],1,0,0,1,saurabh61359258 hi we regret the inconvenience caused we have shared your concern with our team they will connect with you and assist you on priority please dm for further assistance,0.0,Neutral,0
1280015529462263811,payuindiacare,2020-07-06,11:17:38,"@TanishankTandon Hi Shashank, we will check and update you on the status over DM.",3108265670,530,['TanishankTandon'],[],1,1,0,1,tanishanktandon hi shashank we will check and update you on the status over dm,0.0,Neutral,0
1280001739316269056,payuindiacare,2020-07-06,10:22:50,"@Nitheesh_Reddy_ Hi, regret the inconvenience. We will get this checked and let you know, please DM us for further assistance.    https://t.co/M8R5hZBovU",3108265670,530,['Nitheesh_Reddy_'],[],0,0,0,0,nitheeshreddy hi regret the inconvenience we will get this checked and let you know please dm us for further assistance,0.0,Neutral,0
1280000001771372545,payuindiacare,2020-07-06,10:15:56,"@kharemohit786 Hi Mohit, please share your registered details over DM so that we can sare with our team to assist you accordingly with the integration.   https://t.co/M8R5hZBovU",3108265670,530,['kharemohit786'],[],0,1,0,0,kharemohit786 hi mohit please share your registered details over dm so that we can sare with our team to assist you accordingly with the integration,0.0,Neutral,0
1279997551828058117,payuindiacare,2020-07-06,10:06:12,"@SushantJPEW Hi Sushant, we regret the inconvenience. Please DM us your registered details (Email ID, Mobile Number, LegalName &amp; Website) so that we can assist you on priority.    https://t.co/M8R5hZBovU",3108265670,530,['SushantJPEW'],[],1,0,0,1,sushantjpew hi sushant we regret the inconvenience please dm us your registered details email id mobile number legalname amp website so that we can assist you on priority,0.0,Neutral,0
1279771336986918913,payuindiacare,2020-07-05,19:07:18,"@Anand_108_Om Hi, Please help us understand your concern along with the needful details over DM for assistance.    https://t.co/M8R5hZBovU",3108265670,530,['Anand_108_Om'],[],1,0,0,1,anand108om hi please help us understand your concern along with the needful details over dm for assistance,0.0,Neutral,0
1279688859207397376,payuindiacare,2020-07-05,13:39:34,"@foetron Hi, sorry to hear that. We are checking the settlement issue against our team and we'll update you on the status by tomorrow. Please DM us for further assistance.    https://t.co/M8R5hZBovU",3108265670,530,['foetron'],[],3,0,0,3,foetron hi sorry to hear that we are checking the settlement issue against our team and well update you on the status by tomorrow please dm us for further assistance,-0.25,Negative,-1
1279636450984615937,payuindiacare,2020-07-05,10:11:19,"@TeluguTechSteps Hi, we regret the inconvenience caused. We are getting this checked with our team and we'll get this resolved on priority. We will keep you posted.    https://t.co/M8R5hZBovU",3108265670,530,['TeluguTechSteps'],[],0,0,0,0,telugutechsteps hi we regret the inconvenience caused we are getting this checked with our team and well get this resolved on priority we will keep you posted,0.0,Neutral,0
1279388810711728128,payuindiacare,2020-07-04,17:47:17,"@Himansh00547369 Hey, this is a successful TXN via PayUmoney Payment ID 333666229 at our end, the amount for the same has been remitted to the merchant. For any concern regarding, delivery of the product//Refund you are requested to contact the merchant directly to get the status at their end.",3108265670,530,['Himansh00547369'],[],1,0,0,1,himansh00547369 hey this is a successful txn via payumoney payment id 333666229 at our end the amount for the same has been remitted to the merchant for any concern regarding delivery of the productrefund you are requested to contact the merchant directly to get the status at their end,0.2833333333333333,Positive,1
1279348333115367424,payuindiacare,2020-07-04,15:06:26,"@drrajpadhiyar Hi Raj, sorry to know this. Please help us with your Merchant  ID/Case id over DM for assistance.    https://t.co/M8R5hZBovU",3108265670,530,['drrajpadhiyar'],[],0,0,0,0,drrajpadhiyar hi raj sorry to know this please help us with your merchant idcase id over dm for assistance,-0.5,Negative,-1
1279341927050035200,payuindiacare,2020-07-04,14:40:59,"@ashishsinghsimm Hi Ashish, we have already shared the needful resolution over the DM. Please check the same and let us know for any other assistance.",3108265670,530,['ashishsinghsimm'],[],0,0,0,0,ashishsinghsimm hi ashish we have already shared the needful resolution over the dm please check the same and let us know for any other assistance,-0.0625,Neutral,0
1279335501057540097,payuindiacare,2020-07-04,14:15:27,@Gaffarbhai Hi! I have forwarded your concern to our respective team. Please be assured we'll resolve your query as soon as possible.   https://t.co/M8R5hZBovU,3108265670,530,['Gaffarbhai'],[],1,0,0,1,gaffarbhai hi i have forwarded your concern to our respective team please be assured well resolve your query as soon as possible,0.0,Neutral,0
1279332498913128451,payuindiacare,2020-07-04,14:03:31,@Gaffarbhai Hi! Apologies for the inconvenience. Please allow us some time to get this checked and we’ll soon be back with an update.   https://t.co/M8R5hZBovU,3108265670,530,['Gaffarbhai'],[],1,0,0,1,gaffarbhai hi apologies for the inconvenience please allow us some time to get this checked and well soon be back with an update,0.0,Neutral,0
1279273410829234176,payuindiacare,2020-07-04,10:08:43,@VivekR20055871 Hi! Apologies for the inconvenience. Please allow us some time to get this checked and we’ll soon be back with an update.   https://t.co/M8R5hZBovU,3108265670,530,['VivekR20055871'],[],0,0,0,0,vivekr20055871 hi apologies for the inconvenience please allow us some time to get this checked and well soon be back with an update,0.0,Neutral,0
1279036250482077696,payuindiacare,2020-07-03,18:26:20,@sehgal121 Hi! I have forwarded your concern to our respective team. Please be assured we'll resolve your query as soon as possible.   https://t.co/M8R5hZBovU,3108265670,530,['sehgal121'],[],1,0,0,1,sehgal121 hi i have forwarded your concern to our respective team please be assured well resolve your query as soon as possible,0.0,Neutral,0
1279031107585892353,payuindiacare,2020-07-03,18:05:53,@sehgal121 Hi! Apologies for the inconvenience. Request you to share your registered details in order for us to assist you further with your query.    https://t.co/M8R5hZBovU,3108265670,530,['sehgal121'],[],0,0,0,0,sehgal121 hi apologies for the inconvenience request you to share your registered details in order for us to assist you further with your query,0.0,Neutral,0
1278988672918892548,payuindiacare,2020-07-03,15:17:16,@YogiTriipathi Hi! Apologies for the inconvenience if something went wrong. Request you to elaborate your concern along with your registered details in order for us to assist you further with your query.,3108265670,530,['YogiTriipathi'],[],1,0,0,1,yogitriipathi hi apologies for the inconvenience if something went wrong request you to elaborate your concern along with your registered details in order for us to assist you further with your query,0.0,Neutral,0
1278979730859933697,payuindiacare,2020-07-03,14:41:44,@abhimanyunet Hi! Our team is working on it. We'll get you an update soon.   https://t.co/M8R5hZBovU,3108265670,530,['abhimanyunet'],[],1,0,0,1,abhimanyunet hi our team is working on it well get you an update soon,0.0,Neutral,0
1278973750633877504,payuindiacare,2020-07-03,14:17:58,"@Punter2010 Hi Pramit, please DM us your transaction details so that may check and assist you with the status.    https://t.co/M8R5hZBovU",3108265670,530,['Punter2010'],[],0,0,0,0,punter2010 hi pramit please dm us your transaction details so that may check and assist you with the status,0.0,Neutral,0
1278965249442328578,payuindiacare,2020-07-03,13:44:12,"@DevanshSaraswa4 Hi Devansh, we regret the inconvenience. We have responded to DM, please check and revert.",3108265670,530,['DevanshSaraswa4'],[],0,0,0,0,devanshsaraswa4 hi devansh we regret the inconvenience we have responded to dm please check and revert,0.0,Neutral,0
1278943322258587650,payuindiacare,2020-07-03,12:17:04,"@Divyansh93 Hi! Apologies for the inconvenience. Request you to DM us your registered number along with the screenshot of transaction details (Transaction id, amount and date) and we will get this checked for you.    https://t.co/M8R5hZBovU",3108265670,530,['Divyansh93'],[],1,0,0,1,divyansh93 hi apologies for the inconvenience request you to dm us your registered number along with the screenshot of transaction details transaction id amount and date and we will get this checked for you,0.0,Neutral,0
1278940111984459776,payuindiacare,2020-07-03,12:04:18,@Divyansh93 Hi! Apologies for the inconvenience. Please allow us some time to get this checked and we’ll soon be back with an update.   https://t.co/M8R5hZBovU,3108265670,530,['Divyansh93'],[],0,0,0,0,divyansh93 hi apologies for the inconvenience please allow us some time to get this checked and well soon be back with an update,0.0,Neutral,0
1278933308143833089,payuindiacare,2020-07-03,11:37:16,"@_anshumanpatro Hi! As checked, there is a mismatch in bank account IFSC code on agreement and uploaded bank proof. Request you to upload the correct details in order to get your account approved on priority.   https://t.co/M8R5hZBovU",3108265670,530,['_anshumanpatro'],[],0,0,0,0,anshumanpatro hi as checked there is a mismatch in bank account ifsc code on agreement and uploaded bank proof request you to upload the correct details in order to get your account approved on priority,0.0,Neutral,0
