id,username,date,time,tweet,user_id,timezone,mentions,hashtags,replies_count,likes_count,retweets_count,replies_count.1,cleaned_review,sentiment_polarity,sentiment,sentiment_int
1302885198841823232,payuindiacare,2020-09-07,13:53:32,"@veer158 Hi, your account stands completely live with us, and the pending settlement shall reflect in your account by today 8 PM. Let us know for any other assistance.",3108265670,530,['veer158'],[],0,0,0,0,veer158 hi your account stands completely live with us and the pending settlement shall reflect in your account by today 8 pm let us know for any other assistance,0.005681818181818177,Neutral,0
1302880458984701952,payuindiacare,2020-09-07,13:34:42,"@RKasnia Hi, we are here to help you. Please help us understand your concern along with the needful Merchant ID over DM for assistance.   https://t.co/M8R5hZBovU",3108265670,530,['RKasnia'],[],0,0,0,0,rkasnia hi we are here to help you please help us understand your concern along with the needful merchant id over dm for assistance,0.0,Neutral,0
1302879648682897408,payuindiacare,2020-09-07,13:31:29,"@veer158 Hi, we have acknowledged your concern and will get this resolved for you on priority.",3108265670,530,['veer158'],[],0,0,0,0,veer158 hi we have acknowledged your concern and will get this resolved for you on priority,0.0,Neutral,0
1302867735915888640,payuindiacare,2020-09-07,12:44:09,"@WinniDaksha Hi Vishal, please help us with the contact no. of the user over DM for further assistance.    https://t.co/M8R5hZBovU",3108265670,530,['WinniDaksha'],[],0,0,0,0,winnidaksha hi vishal please help us with the contact no of the user over dm for further assistance,0.0,Neutral,0
1302854863634587648,payuindiacare,2020-09-07,11:53:00,"@rohan_bagad Hi Rohan, sorry to hear that Please DM us your merchant transaction ID so that we can check and assist on priority.    https://t.co/M8R5hZBovU",3108265670,530,['rohan_bagad'],[],0,0,0,0,rohanbagad hi rohan sorry to hear that please dm us your merchant transaction id so that we can check and assist on priority,-0.5,Negative,-1
1302851253282598914,payuindiacare,2020-09-07,11:38:39,"@IlIIIlIIIlIlIlI Hi, the status of this transaction with PayU id11040314567 stands dropped That means we have not received the funds. The amount shall be auto-credited in your account within 5 to 7 working days if there was any accidental deduction in your account. Thanks!",3108265670,530,['IlIIIlIIIlIlIlI'],[],0,0,0,0,iliiiliiililili hi the status of this transaction with payu id11040314567 stands dropped that means we have not received the funds the amount shall be autocredited in your account within 5 to 7 working days if there was any accidental deduction in your account thanks,0.2,Positive,1
1302847453402525696,payuindiacare,2020-09-07,11:23:33,"@KanojiaParitosh Hi, your account stands completely live with us, and the pending settlement shall reflect in your account by today 8 PM. Let us know for any other assistance.",3108265670,530,['KanojiaParitosh'],[],1,0,0,1,kanojiaparitosh hi your account stands completely live with us and the pending settlement shall reflect in your account by today 8 pm let us know for any other assistance,0.005681818181818177,Neutral,0
1302831729565077504,payuindiacare,2020-09-07,10:21:04,"@PrinceDua17 Hi Prince, we will get this checked ith our team and update you on the status soon.    https://t.co/M8R5hZBovU",3108265670,530,['PrinceDua17'],[],1,0,0,1,princedua17 hi prince we will get this checked ith our team and update you on the status soon,0.0,Neutral,0
1302828780742868993,payuindiacare,2020-09-07,10:09:21,"@_veedant Hi! As checked, our team tried contacting you on your contact number but your number was switched off. Further, our team have sent you an email regarding your concern. Request you to check the same and reply on same email for further assistance.   https://t.co/M8R5hZBovU",3108265670,530,['_veedant'],[],0,0,0,0,veedant hi as checked our team tried contacting you on your contact number but your number was switched off further our team have sent you an email regarding your concern request you to check the same and reply on same email for further assistance,0.0,Neutral,0
1302543966240292866,payuindiacare,2020-09-06,15:17:36,"@GoyellShubham Hi Shubham, we are here to help you. Please help us with your Merchant ID over DM for assistance.    https://t.co/M8R5hZBovU",3108265670,530,['GoyellShubham'],[],0,0,0,0,goyellshubham hi shubham we are here to help you please help us with your merchant id over dm for assistance,0.0,Neutral,0
1302511401127145472,payuindiacare,2020-09-06,13:08:12,"@KanojiaParitosh Hi, we have acknowledged your concern and will get this resolved for you on priority.",3108265670,530,['KanojiaParitosh'],[],0,1,0,0,kanojiaparitosh hi we have acknowledged your concern and will get this resolved for you on priority,0.0,Neutral,0
1302236136962572288,payuindiacare,2020-09-05,18:54:24,"@IlIIIlIIIlIlIlI Hey, this is a successful TXN via PayU Payment ID 11044588035at our end, the amount for the same has been remitted to the merchant. For any concern regarding, delivery of the product//Refund you are requested to contact the merchant directly to get the status at their end.",3108265670,530,['IlIIIlIIIlIlIlI'],[],0,0,0,0,iliiiliiililili hey this is a successful txn via payu payment id 11044588035at our end the amount for the same has been remitted to the merchant for any concern regarding delivery of the productrefund you are requested to contact the merchant directly to get the status at their end,0.2833333333333333,Positive,1
1302207614646800384,payuindiacare,2020-09-05,17:01:03,"@_S___________J_ Hi, the status of this transaction with PayU id11040314567 stands dropped That means we have not received the funds. The amount shall be auto-credited in your account within 5 to 7 working days if there was any accidental deduction in your account. Thanks!",3108265670,530,['_S___________J_'],[],0,0,0,0,sj hi the status of this transaction with payu id11040314567 stands dropped that means we have not received the funds the amount shall be autocredited in your account within 5 to 7 working days if there was any accidental deduction in your account thanks,0.2,Positive,1
1302132574924410880,payuindiacare,2020-09-05,12:02:52,"@RajatGuptaKnl Hi Rajat, we are here to help you. Please help us understand your concern along with the needful details over DM for assistance.    https://t.co/M8R5hZBovU",3108265670,530,['RajatGuptaKnl'],[],0,0,0,0,rajatguptaknl hi rajat we are here to help you please help us understand your concern along with the needful details over dm for assistance,0.0,Neutral,0
1302113876750655488,payuindiacare,2020-09-05,10:48:34,"@SarojDahiya6 Hi Saroj, we have already shared the needful refund status along with the screenshot over DM. Please check the same and contact your issuing bank for any further assistance.",3108265670,530,['SarojDahiya6'],[],1,0,0,1,sarojdahiya6 hi saroj we have already shared the needful refund status along with the screenshot over dm please check the same and contact your issuing bank for any further assistance,0.0,Neutral,0
1302107557666762752,payuindiacare,2020-09-05,10:23:28,"@RKasnia Hi, we are here to help you. Please help us understand your concern along with the needful Merchant ID for assistance.",3108265670,530,['RKasnia'],[],2,0,0,2,rkasnia hi we are here to help you please help us understand your concern along with the needful merchant id for assistance,0.0,Neutral,0
1302106981814079488,payuindiacare,2020-09-05,10:21:11,"@Krisallmighty Hey, this is a successful TXN via PayUmoney Payment ID 345935914 at our end, the amount for the same has been remitted to the merchant. For any concern regarding, delivery of the product//Refund you are requested to contact the merchant directly to get the status at their end.",3108265670,530,['Krisallmighty'],[],2,0,1,2,krisallmighty hey this is a successful txn via payumoney payment id 345935914 at our end the amount for the same has been remitted to the merchant for any concern regarding delivery of the productrefund you are requested to contact the merchant directly to get the status at their end,0.2833333333333333,Positive,1
1302105105253019649,payuindiacare,2020-09-05,10:13:43,"@Rahul737373Rs Hi Rahul, PayU is a payment aggregator who helps merchants and customers to do online transactions. It is a merchant who delivers the services. Please help us with the needful PayU Payment ID over DM for further assistance.    https://t.co/M8R5hZBovU",3108265670,530,['Rahul737373Rs'],[],0,0,0,0,rahul737373rs hi rahul payu is a payment aggregator who helps merchants and customers to do online transactions it is a merchant who delivers the services please help us with the needful payu payment id over dm for further assistance,0.0,Neutral,0
1302104086779551744,payuindiacare,2020-09-05,10:09:40,"@matiganeshprat1 As per the record, your documentation is not complete yet. We have shared the concern with our team, someone from the team will connect with you and assist with approval on priority,    https://t.co/M8R5hZBovU",3108265670,530,['matiganeshprat1'],[],1,0,0,1,matiganeshprat1 as per the record your documentation is not complete yet we have shared the concern with our team someone from the team will connect with you and assist with approval on priority,-0.05,Neutral,0
1302103934299852801,payuindiacare,2020-09-05,10:09:04,"@matiganeshprat1 We regret the inconvenience caused. Please note that the transactions you have received on your account were done through the website, and to get the settlement of your website transactions, your website and documents verification should be complete. (1/2)",3108265670,530,['matiganeshprat1'],[],1,0,0,1,matiganeshprat1 we regret the inconvenience caused please note that the transactions you have received on your account were done through the website and to get the settlement of your website transactions your website and documents verification should be complete 12,0.1,Positive,1
1301869542583402496,payuindiacare,2020-09-04,18:37:41,@8008447954varun Please DM us so that we can share the receipt over DM.    https://t.co/M8R5hZBovU,3108265670,530,['8008447954varun'],[],1,1,0,1,8008447954varun please dm us so that we can share the receipt over dm,0.0,Neutral,0
1301855664025657346,payuindiacare,2020-09-04,17:42:32,"@aanand841 Hi Abhinav, please DM us your transaction details so that we can check and assist you with the status.",3108265670,530,['aanand841'],[],0,0,0,0,aanand841 hi abhinav please dm us your transaction details so that we can check and assist you with the status,0.0,Neutral,0
1301799710911471617,payuindiacare,2020-09-04,14:00:12,@Bookatfirst We regret the unpleasant experience you had with us. Please DM us your Merchant ID or registered email ID so that we can check and assist you on priority.,3108265670,530,['Bookatfirst'],[],0,1,0,0,bookatfirst we regret the unpleasant experience you had with us please dm us your merchant id or registered email id so that we can check and assist you on priority,-0.6499999999999999,Negative,-1
1301798375264669697,payuindiacare,2020-09-04,13:54:53,"@veer158 Hi, Please revert to the Ticket id - RS2331693804 that we've sent you seeking relevant approval so that we can get this resolved for you on priority. Also, please note that self transactions are prohibited at PayU.  Thanks!",3108265670,530,['veer158'],[],0,0,0,0,veer158 hi please revert to the ticket id rs2331693804 that weve sent you seeking relevant approval so that we can get this resolved for you on priority also please note that self transactions are prohibited at payu thanks,0.30000000000000004,Positive,1
1301797363338551296,payuindiacare,2020-09-04,13:50:52,"@AkshayK10542584 Yes, the refund will get credited into the source account within 7 to 10 working days (Excluding Saturday, Sunday, and bank holiday) from the date of refund. Feel free to reach out in case of any further assistance required.",3108265670,530,['AkshayK10542584'],[],0,0,0,0,akshayk10542584 yes the refund will get credited into the source account within 7 to 10 working days excluding saturday sunday and bank holiday from the date of refund feel free to reach out in case of any further assistance required,0.2,Positive,1
1301791795131510784,payuindiacare,2020-09-04,13:28:44,"@veer158 Hi, we have acknowledged your concern and will get this resolved for you on priority.",3108265670,530,['veer158'],[],0,0,0,0,veer158 hi we have acknowledged your concern and will get this resolved for you on priority,0.0,Neutral,0
1301746002806804482,payuindiacare,2020-09-04,10:26:46,"@MahajanYashika Hi, sorry to hear that.  We have responded to you DM,  please revert with required detail for further assistance.",3108265670,530,['MahajanYashika'],[],1,0,0,1,mahajanyashika hi sorry to hear that we have responded to you dm please revert with required detail for further assistance,-0.25,Negative,-1
1301443656738459650,payuindiacare,2020-09-03,14:25:22,@GahoiHardik ..In case the concerned merchant is not providing the services. We are just their payment processing partner and do not have access or control to their internal processes. (2/2),3108265670,530,['GahoiHardik'],[],1,0,0,1,gahoihardik in case the concerned merchant is not providing the services we are just their payment processing partner and do not have access or control to their internal processes 22,0.0,Neutral,0
1301443591978455040,payuindiacare,2020-09-03,14:25:06,"@GahoiHardik Hi, sorry to hear that. Since the said transactions are successfully processed, hence any refund/resolution will be provided by the merchant only. We advise you to get in touch with the issuing bank and initiate an official complaint (Dispute) regarding the same. (1/2)",3108265670,530,['GahoiHardik'],[],0,0,0,0,gahoihardik hi sorry to hear that since the said transactions are successfully processed hence any refundresolution will be provided by the merchant only we advise you to get in touch with the issuing bank and initiate an official complaint dispute regarding the same 12,-0.009999999999999998,Neutral,0
1301378386154024960,payuindiacare,2020-09-03,10:06:00,@studiobysumit Hi! Apologies for the inconvenience. Please allow us some time to get this checked and we’ll soon be back with an update.   https://t.co/M8R5hZBovU,3108265670,530,['studiobysumit'],[],1,0,0,1,studiobysumit hi apologies for the inconvenience please allow us some time to get this checked and well soon be back with an update,0.0,Neutral,0
1301377923530674176,payuindiacare,2020-09-03,10:04:10,@drambikaprasad You can make a self-transaction on your account so that your refund gets processed automatically. Please DM us for further assistance (2/2)   https://t.co/M8R5hZBovU,3108265670,530,['drambikaprasad'],[],0,0,0,0,drambikaprasad you can make a selftransaction on your account so that your refund gets processed automatically please dm us for further assistance 22,0.0,Neutral,0
1301377831725719553,payuindiacare,2020-09-03,10:03:48,"@drambikaprasad Hi Sir, you have initiated a refund against payment ID- 328803433, and currently, we do not have sufficient funds available in your account, due to which your Refund has not been processed.(1/2)",3108265670,530,['drambikaprasad'],[],0,0,0,0,drambikaprasad hi sir you have initiated a refund against payment id 328803433 and currently we do not have sufficient funds available in your account due to which your refund has not been processed12,0.09166666666666667,Neutral,0
1301108681778450432,payuindiacare,2020-09-02,16:14:17,"@Umesh57675245 Hi Umesh, as checked you have already raised a chargeback against PayU Payment ID 10658844851. Please contact your issuing bank for any further assistance. Thanks!",3108265670,530,['Umesh57675245'],[],1,0,0,1,umesh57675245 hi umesh as checked you have already raised a chargeback against payu payment id 10658844851 please contact your issuing bank for any further assistance thanks,0.1,Positive,1
1301102627783016448,payuindiacare,2020-09-02,15:50:14,"@StutyaLogiciel Hi, sorry for the delay. We believe you have received the settlement in your bank account.",3108265670,530,['StutyaLogiciel'],[],0,0,0,0,stutyalogiciel hi sorry for the delay we believe you have received the settlement in your bank account,-0.5,Negative,-1
1301101378115260416,payuindiacare,2020-09-02,15:45:16,"@mandybedi Hi Mandira, your account stands completely live with us and the pending settlement shall reflect in your account by today 8 PM. Let us know for any other assistance.",3108265670,530,['mandybedi'],[],0,1,0,0,mandybedi hi mandira your account stands completely live with us and the pending settlement shall reflect in your account by today 8 pm let us know for any other assistance,0.005681818181818177,Neutral,0
1301090500150132736,payuindiacare,2020-09-02,15:02:02,@RohitKu46093679 Please note that this is a successful transaction via PayU Id - 10896164503 at our end. Please contact the merchant with Merchant Order Id - wyn8c0xzQ0kkmcOyKgEK in order to get the status at their end    https://t.co/M8R5hZBovU,3108265670,530,['RohitKu46093679'],[],0,0,0,0,rohitku46093679 please note that this is a successful transaction via payu id 10896164503 at our end please contact the merchant with merchant order id wyn8c0xzq0kkmcoykgek in order to get the status at their end,0.75,Positive,1
1301071524779057153,payuindiacare,2020-09-02,13:46:38,"@Equitywithrahul Hi! As checked, our team called you and assisted you with your concern. Please let us know in case any further assistance is required.   https://t.co/M8R5hZBovU",3108265670,530,['Equitywithrahul'],[],0,0,0,0,equitywithrahul hi as checked our team called you and assisted you with your concern please let us know in case any further assistance is required,0.0,Neutral,0
1301068228349714432,payuindiacare,2020-09-02,13:33:32,"@Prashant_pawash Hi, this is a successful transaction via PayU Id - 10941685171 at our end. You are requested to contact the merchant directly with Merchant Order Id - 195245218_3 in order to get the status at their end.   https://t.co/M8R5hZBovU",3108265670,530,['Prashant_pawash'],[],0,0,0,0,prashantpawash hi this is a successful transaction via payu id 10941685171 at our end you are requested to contact the merchant directly with merchant order id 1952452183 in order to get the status at their end,0.425,Positive,1
1301050165025931265,payuindiacare,2020-09-02,12:21:46,"@RohitKu46093679 Hi Rohit, please DM us your transaction details so that we can assist you with the status.",3108265670,530,['RohitKu46093679'],[],0,0,0,0,rohitku46093679 hi rohit please dm us your transaction details so that we can assist you with the status,0.0,Neutral,0
1301049611679723521,payuindiacare,2020-09-02,12:19:34,"@harshad_ifour Hi, the refund has been processed against the transaction and the same will get credited into the source account within 5 to 7 working days (Excluding Saturday, Sunday, and bank holiday) from the date of refund.",3108265670,530,['harshad_ifour'],[],1,0,0,1,harshadifour hi the refund has been processed against the transaction and the same will get credited into the source account within 5 to 7 working days excluding saturday sunday and bank holiday from the date of refund,0.0,Neutral,0
1301046833221955584,payuindiacare,2020-09-02,12:08:31,"@AkshayK10542584 Hey, we believe our team has contacted you and assist you with your concern.",3108265670,530,['AkshayK10542584'],[],0,0,0,0,akshayk10542584 hey we believe our team has contacted you and assist you with your concern,0.0,Neutral,0
1301040670686105602,payuindiacare,2020-09-02,11:44:02,"@AkshayK10542584 Hi Akshay, we sincerely regret the unpleasant experience you had with us. We have notified our team to get this resolved on priority, please allow some time.",3108265670,530,['AkshayK10542584'],[],0,0,0,0,akshayk10542584 hi akshay we sincerely regret the unpleasant experience you had with us we have notified our team to get this resolved on priority please allow some time,-0.07499999999999996,Neutral,0
1301039467206045697,payuindiacare,2020-09-02,11:39:15,"@RohitKu46093679 Hi Rohit, please DM us your transaction details so that we can assist you with the status.",3108265670,530,['RohitKu46093679'],[],1,0,0,1,rohitku46093679 hi rohit please dm us your transaction details so that we can assist you with the status,0.0,Neutral,0
1301020754851454976,payuindiacare,2020-09-02,10:24:54,"@VikasSr78064088 Hi, this is a successful transaction via PayU Id - 11019475755 at our end. For any concern regarding Services/Cancellation/Refund, you are requested to contact the merchant directly with Merchant Order Id - 5834823546.    https://t.co/M8R5hZBovU",3108265670,530,['VikasSr78064088'],[],0,1,0,0,vikassr78064088 hi this is a successful transaction via payu id 11019475755 at our end for any concern regarding servicescancellationrefund you are requested to contact the merchant directly with merchant order id 5834823546,0.425,Positive,1
1301015304575709186,payuindiacare,2020-09-02,10:03:14,@UditGarud45 Sorry to hear that. Please DM us your merchant ID or registered email ID so that we can check and assist you on priority.,3108265670,530,['UditGarud45'],[],0,0,0,0,uditgarud45 sorry to hear that please dm us your merchant id or registered email id so that we can check and assist you on priority,-0.5,Negative,-1
1300788720510132225,payuindiacare,2020-09-01,19:02:53,"@SarojDahiya6 Hi Saroj, as checked the needful refund has been successfully initiated on 2020-09-01  against PayU id 10983774541 and shall reflect back in the source account within 3 to 5 working days.  Hope this helps.",3108265670,530,['SarojDahiya6'],[],1,0,0,1,sarojdahiya6 hi saroj as checked the needful refund has been successfully initiated on 20200901 against payu id 10983774541 and shall reflect back in the source account within 3 to 5 working days hope this helps,0.375,Positive,1
1300708581403029504,payuindiacare,2020-09-01,13:44:26,"@mandybedi Hi Mandira, as discussed please revert to the mail that we've sent you seeking relevant information with details so that we can get this resolved for you on priority.   https://t.co/M8R5hZBovU",3108265670,530,['mandybedi'],[],0,1,0,0,mandybedi hi mandira as discussed please revert to the mail that weve sent you seeking relevant information with details so that we can get this resolved for you on priority,0.4,Positive,1
1300673344979656704,payuindiacare,2020-09-01,11:24:25,"@veer158 Hi, we have successfully resolved your concern and the settlement shall be reflecting in your account by now. Let us know for any other assistance.",3108265670,530,['veer158'],[],1,0,0,1,veer158 hi we have successfully resolved your concern and the settlement shall be reflecting in your account by now let us know for any other assistance,0.3125,Positive,1
1300668456715444224,payuindiacare,2020-09-01,11:04:59,"@mbansal14 Hi Mohit, your account with Merchant ID 392724 stands completely live with us and the settlement shall reflect in your account within 2 working days. Please feel free to write us directly at merchantsupport@payu.in for any further assistance.",3108265670,530,"['mbansal14', 'payu']",[],1,0,0,1,mbansal14 hi mohit your account with merchant id 392724 stands completely live with us and the settlement shall reflect in your account within 2 working days please feel free to write us directly at merchantsupportpayuin for any further assistance,0.1590909090909091,Positive,1
1300666000627568642,payuindiacare,2020-09-01,10:55:14,"@mandybedi Hi Mandira, we tried contacting you multiple times regarding the issues highlighted but our attempts were unsuccessful. We've sent an email to the registered email ID with the details. Kindly check the same. Do let us know for any other assistance.     https://t.co/M8R5hZBovU",3108265670,530,['mandybedi'],[],1,2,0,1,mandybedi hi mandira we tried contacting you multiple times regarding the issues highlighted but our attempts were unsuccessful weve sent an email to the registered email id with the details kindly check the same do let us know for any other assistance,0.11875,Positive,1
1300658589783085058,payuindiacare,2020-09-01,10:25:47,"@mandybedi Hi Mandira, sorry for the inconvenience caused here. We have acknowledged your concern and will get this resolved for you on priority.",3108265670,530,['mandybedi'],[],0,2,0,0,mandybedi hi mandira sorry for the inconvenience caused here we have acknowledged your concern and will get this resolved for you on priority,-0.5,Negative,-1
1300653134029578245,payuindiacare,2020-09-01,10:04:06,"@dmsbharti Hi Dilip, please help us understand your concern along with the needful PayU Payment ID over DM for assistance.    https://t.co/M8R5hZBovU",3108265670,530,['dmsbharti'],[],0,0,0,0,dmsbharti hi dilip please help us understand your concern along with the needful payu payment id over dm for assistance,0.0,Neutral,0
1300425193542754308,payuindiacare,2020-08-31,18:58:21,"@LokeshOraon Hi Lokesh, please help understand your concern so that we can check and assist you on priority.    https://t.co/M8R5hZBovU",3108265670,530,['LokeshOraon'],[],0,0,0,0,lokeshoraon hi lokesh please help understand your concern so that we can check and assist you on priority,0.0,Neutral,0
1300424395140153344,payuindiacare,2020-08-31,18:55:11,"@harshad_ifour Hi Harshad, we regret the inconvenience caused. We have shared your concern with our team, they will connect with you and assist you soon.        https://t.co/M8R5hZBovU",3108265670,530,['harshad_ifour'],[],0,0,0,0,harshadifour hi harshad we regret the inconvenience caused we have shared your concern with our team they will connect with you and assist you soon,0.0,Neutral,0
