id,username,date,time,tweet,user_id,timezone,mentions,hashtags,replies_count,likes_count
1002188009897381889,kpmg,2018-05-31,14:00:15,We’re excited to announce our new alliance with @googlecloud. Learn how our combined expertise can help your organization accelerate  https://t.co/rh6WPPe4yL #DigitalTransformation  https://t.co/tstCCn2YbI,267939430,+0000,"[{'screen_name': 'googlecloud', 'name': 'google cloud', 'id': '19367815'}]",['digitaltransformation'],1,25
1002172896494669825,kpmg,2018-05-31,13:00:12,"Christoph Zinke, on the importance of #partnerships  https://t.co/hdRwWUmZkl #CEOoutlook  https://t.co/LjzZRkcbm3",267939430,+0000,[],"['partnerships', 'ceooutlook']",0,4
1002127607905865728,kpmg,2018-05-31,10:00:15,We're excited to launch our new #IFRS podcast – topical insights on the new accounting standards  https://t.co/aZ3B5IPrIN  https://t.co/PwvDuZyYYu,267939430,+0000,[],['ifrs'],1,8
1002127573936164864,kpmg,2018-05-31,10:00:06,"Learn how @tarek_sultan, CEO and Vice Chairman of @Agility, plans to transform his business  https://t.co/Ke2K8VAm7k #CEOoutlook",267939430,+0000,"[{'screen_name': 'tarek_sultan', 'name': 'tarek sultan', 'id': '281696711'}, {'screen_name': 'agility', 'name': 'agility', 'id': '21106613'}]",['ceooutlook'],0,1
1001910714531901441,kpmg,2018-05-30,19:38:23,"[POLL] @RaeShamus, Head of Digital Disruption, @kpmguk, is at #BrainBar this week answering the question ""Can you future-proof your job from robots?"" What do you think?",267939430,+0000,"[{'screen_name': 'raeshamus', 'name': 'shamus rae', 'id': '603638744'}, {'screen_name': 'kpmguk', 'name': 'kpmg in the uk', 'id': '52393483'}]",['brainbar'],0,8
1001901117364686854,kpmg,2018-05-30,19:00:15,Close to 7 in 10 #CEOs have prioritized their own intution over #data-driven insights in the past 3 years  https://t.co/BRL6lgPjyj #CEOoutlook,267939430,+0000,[],"['ceos', 'data', 'ceooutlook']",1,6
1001765188268421120,kpmg,2018-05-30,10:00:07,".@tarek_sultan, CEO &amp; Vice Chairman of @Agility shares his views on digitization  https://t.co/Ke2K8VAm7k #CEOoutlook  https://t.co/cp99lkcjSL",267939430,+0000,"[{'screen_name': 'tarek_sultan', 'name': 'tarek sultan', 'id': '281696711'}, {'screen_name': 'agility', 'name': 'agility', 'id': '21106613'}]",['ceooutlook'],0,12
1001568933537898499,kpmg,2018-05-29,21:00:16,.@janemccormickuk: A global view is critical in the tax sector  https://t.co/SBSVp3gcN9 #CEOoutlook  https://t.co/kSncWyNd0M,267939430,+0000,"[{'screen_name': 'janemccormickuk', 'name': 'jane mccormick', 'id': '3200629323'}]",['ceooutlook'],0,6
1001553853613998080,kpmg,2018-05-29,20:00:21,What are the enterprise values (EV) of the football clubs covered in the third edition of “The European Elite 2018” report?  https://t.co/4i4w9qkOWl @Football_BM  https://t.co/9S0DX8wLbB,267939430,+0000,"[{'screen_name': 'football_bm', 'name': 'kpmg football benchmark', 'id': '3305634982'}]",[],2,19
1001538779834920961,kpmg,2018-05-29,19:00:27,Find out how new and evolving headwinds are raising the bar for #CEOs in all countries and all sectors  https://t.co/fO0fhWrHEw #CEOoutlook,267939430,+0000,[],"['ceos', 'ceooutlook']",0,3
1001508622386515968,kpmg,2018-05-29,17:00:37,Carmen Bekker on what lies between institutions and people  https://t.co/SBSVp3gcN9 #CEOoutlook  https://t.co/kHv3E8AjON,267939430,+0000,[],['ceooutlook'],1,11
1001493534560616449,kpmg,2018-05-29,16:00:40,How does @Fujitsu_Global deal with emerging #DigitalDisruption?  https://t.co/Z0B2yOZ27d #CEOoutlook,267939430,+0000,"[{'screen_name': 'fujitsu_global', 'name': 'fujitsu global', 'id': '32379204'}]","['digitaldisruption', 'ceooutlook']",0,4
1001478316849692674,kpmg,2018-05-29,15:00:11,That's correct - US respondents are the most confident when it comes to their 3-year growth prospects. Find out the others in the full survey:  https://t.co/BRL6lh6UpR #CEOoutlook  https://t.co/hZcANwYco2,267939430,+0000,[],['ceooutlook'],0,7
1001448445297741825,kpmg,2018-05-29,13:01:30,Here's how smart leaders are approaching #cybersecurity  https://t.co/SBSVp3gcN9 #CEOoutlook  https://t.co/7hHXoerAxv,267939430,+0000,[],"['cybersecurity', 'ceooutlook']",1,15
1001402805360447488,kpmg,2018-05-29,10:00:08,"Talent: #1 challenge for @DuncanATait, SEVP, Head of Americas and EMEIA, Fujitsu  https://t.co/Z0B2yOZ27d #CEOoutlook  https://t.co/7IuEvo8Oew",267939430,+0000,"[{'screen_name': 'duncanatait', 'name': 'duncan andrew tait', 'id': '821286876728463360'}]",['ceooutlook'],1,7
1001206535794626560,kpmg,2018-05-28,21:00:14,What is the currency of business? Mark Goodburn explains  https://t.co/uQwehHCH2O #CEOoutlook  https://t.co/rY5EToZaTM,267939430,+0000,[],['ceooutlook'],0,12
1001176353620856833,kpmg,2018-05-28,19:00:18,"At @DowChemical, the innovation process is a mix of freedom and collaboration with customers  https://t.co/uQwehHCH2O #CEOoutlook",267939430,+0000,"[{'screen_name': 'dowchemical', 'name': 'dow', 'id': '1098648812745342976'}]",['ceooutlook'],0,4
1001163354340249601,kpmg,2018-05-28,18:08:39,How should #CEOs approach #geopolitics? @GaryReader_KPMG explains  https://t.co/SBSVp3gcN9 #CEOoutlook  https://t.co/Zp9xbJNWOB,267939430,+0000,"[{'screen_name': 'garyreader_kpmg', 'name': 'gary reader', 'id': '2571225331'}]","['ceos', 'geopolitics', 'ceooutlook']",0,17
1001150346276810752,kpmg,2018-05-28,17:16:57,7 in 10 #CEOs are personally prepared to lead a radical transformation of their organization  https://t.co/SK2tN7wej9 #CEOoutlook,267939430,+0000,[],"['ceos', 'ceooutlook']",0,18
1001116018058645506,kpmg,2018-05-28,15:00:33,.@SteveHill_SI shares his thoughts for the 2018 Global #CEOoutlook  https://t.co/SK2tN7wej9  https://t.co/o8RWYt5o1S,267939430,+0000,"[{'screen_name': 'stevehill_si', 'name': 'steven hill', 'id': '624764620'}]",['ceooutlook'],0,6
1001101660020555776,kpmg,2018-05-28,14:03:29,"According to our 2018 Global #CEOoutlook, CEOs from which country are most confident in their 3-year growth prospects?  https://t.co/BRL6lh6UpR",267939430,+0000,[],['ceooutlook'],0,7
1001085814695186432,kpmg,2018-05-28,13:00:32,.@DowChemical Chairman &amp; CEO speaks on the similarities between 1918 and 2018  https://t.co/BRL6lgPjyj #CEOoutlook  https://t.co/a7nGk58k7V,267939430,+0000,"[{'screen_name': 'dowchemical', 'name': 'dow', 'id': '1098648812745342976'}]",['ceooutlook'],0,8
1000104382938144768,kpmg,2018-05-25,20:00:40,Developing a future-focused strategy can help leaders in financial services proactively guide their organization's #digital transformation  https://t.co/RQM5Q85aP6 #CEOoutlook #finserv,267939430,+0000,[],"['digital', 'ceooutlook', 'finserv']",1,10
1000089258122674176,kpmg,2018-05-25,19:00:34,How can business leaders in financial services merge old and new effectively?  https://t.co/RQM5Q85aP6 #CEOoutlook #finserv #banking,267939430,+0000,[],"['ceooutlook', 'finserv', 'banking']",0,7
1000028912632639489,kpmg,2018-05-25,15:00:47,.@amwater created employee apps similar to what they use at home. The result? Check out the interview  https://t.co/aZ3AejTUJY #CEOoutlook,267939430,+0000,"[{'screen_name': 'amwater', 'name': 'american water', 'id': '25565709'}]",['ceooutlook'],0,4
999998621641682944,kpmg,2018-05-25,13:00:25,"Over the last 3 years, what have 67% of CEOs overlooked because it contradicted their intuition, according to our 2018 Global #CEOoutlook?  https://t.co/BRL6lh6UpR",267939430,+0000,[],['ceooutlook'],1,12
999757146148491266,kpmg,2018-05-24,21:00:52,Almost 6 in 10 CEOs say that protecting #CustomerData is one of their most critical personal responsibilities  https://t.co/SK2tN7wej9 #CEOoutlook,267939430,+0000,[],"['customerdata', 'ceooutlook']",1,26
999726983276908546,kpmg,2018-05-24,19:01:01,Explore and share the key findings of the 2018 Global #CEOoutlook  https://t.co/fO0fhWrHEw,267939430,+0000,[],['ceooutlook'],0,6
999711847371636741,kpmg,2018-05-24,18:00:52,"“Many CEOs are coming to realize that simple, top-line revenue growth is no longer their sole, or most important, measure of success in the digital era” Mark A. Goodburn, Global Head of Advisory, @KPMG  https://t.co/HROXo7fz2Y #CEOoutlook",267939430,+0000,"[{'screen_name': 'kpmg', 'name': 'kpmg', 'id': '267939430'}]",['ceooutlook'],1,9
999681619727409152,kpmg,2018-05-24,16:00:45,"Susan Story, President and CEO, @amwater on #DigitalTransformation  https://t.co/aZ3AejTUJY #CEOoutlook  https://t.co/1ZruU5Re3Y",267939430,+0000,"[{'screen_name': 'amwater', 'name': 'american water', 'id': '25565709'}]","['digitaltransformation', 'ceooutlook']",3,15
999409687824142336,kpmg,2018-05-23,22:00:12,Almost 6 in 10 CEOs believe agility is the new currency of business  https://t.co/uQwehHCH2O #CEOoutlook,267939430,+0000,[],['ceooutlook'],0,18
999402184558219264,kpmg,2018-05-23,21:30:23,Our Football Clubs' Valuation report provides an indication of the Enterprise Value (EV) of the 32 most prominent European football clubs.  https://t.co/LuByJQNvHw @Football_BM #FCV18  https://t.co/dXWDxGqidI,267939430,+0000,"[{'screen_name': 'football_bm', 'name': 'kpmg football benchmark', 'id': '3305634982'}]",['fcv18'],0,11
999394566296907776,kpmg,2018-05-23,21:00:07,Our 2018 Global #CEOoutlook found that more than 60% of CEOs expect #ArtificialIntelligence to create more jobs than it destroys. Do you agree?  https://t.co/SK2tN7eCUz #AI,267939430,+0000,[],"['ceooutlook', 'artificialintelligence', 'ai']",1,10
999384156357382144,kpmg,2018-05-23,20:18:45,"Very close, but we actually interviewed CEOs from over 11 regions for this year's report! Find out what they had to say here:  https://t.co/BRL6lh6UpR #CEOoutlook  https://t.co/6eL7nDWZeZ",267939430,+0000,[],['ceooutlook'],0,3
999304091582025728,kpmg,2018-05-23,15:00:36,52% of #CEOs say they need to hit growth targets before hiring new skills  https://t.co/hdRwWUmZkl #CEOoutlook,267939430,+0000,[],"['ceos', 'ceooutlook']",2,11
999228479454539776,kpmg,2018-05-23,10:00:08,Which companies have an easier time innovating - small or large? Find out here:  https://t.co/yEI0QDob5S #CEOoutlook,267939430,+0000,[],['ceooutlook'],0,14
999002048984109057,kpmg,2018-05-22,19:00:23,"For our 2018 Global #CEOoutlook, we interviewed CEOs from how many different regions?  https://t.co/BRL6lh6UpR",267939430,+0000,[],['ceooutlook'],0,6
998971862460895235,kpmg,2018-05-22,17:00:26,"For Ken Allen, CEO, @DHLexpress, the future is bright  https://t.co/yEI0QDob5S #CEOoutlook  https://t.co/KZyiMh6Fcw",267939430,+0000,"[{'screen_name': 'dhlexpress', 'name': 'dhl express', 'id': '869879920645865472'}]",['ceooutlook'],0,17
998941703993282560,kpmg,2018-05-22,15:00:36,"Learn about the growing pains of 1,300 global #CEOs  https://t.co/D3c6fKDGuQ #CEOoutlook",267939430,+0000,[],"['ceos', 'ceooutlook']",0,7
998911482250309632,kpmg,2018-05-22,13:00:30,.@BillThomas_KPMG shares his thoughts on the 2018 Global #CEOoutlook survey results  https://t.co/T1JiDp2sfA,267939430,+0000,"[{'screen_name': 'billthomas_kpmg', 'name': 'bill thomas', 'id': '841710853309132801'}]",['ceooutlook'],0,9
998708959283417090,kpmg,2018-05-21,23:35:45,Here's what UK CEOs had to say in our 2018 Global #CEOoutlook:  https://t.co/9liMR0QHGf,267939430,+0000,[],['ceooutlook'],0,8
998700479084408833,kpmg,2018-05-21,23:02:03,The 2018 Global #CEOoutlook is here:  https://t.co/BRL6lgPjyj @BillThomas_KPMG  https://t.co/wHRatnFHCt,267939430,+0000,"[{'screen_name': 'billthomas_kpmg', 'name': 'bill thomas', 'id': '841710853309132801'}]",['ceooutlook'],0,59
998564113461792768,kpmg,2018-05-21,14:00:11,Digitization should revolve around improving the #customer experience - not just making the service look better  https://t.co/J0j6EQ1s7c,267939430,+0000,[],['customer'],0,3
998548994329542657,kpmg,2018-05-21,13:00:07,European #VC trends in Q1'18  https://t.co/FTodv4wRTx  https://t.co/vYN0XXtpiM,267939430,+0000,[],['vc'],0,3
998518822234677248,kpmg,2018-05-21,11:00:13,#Lease accounting for assets used by joint arrangements in the oil and gas industry isn't always straightforward under #IFRS16. Our new guide helps.  https://t.co/M0SidZKsBg,267939430,+0000,[],"['lease', 'ifrs16']",0,17
998428206385520642,kpmg,2018-05-21,05:00:08,"David Linke, National Managing Partner, Deals, Tax &amp; Legal, at #KPMGCatalyst LIVE wraps up a great event, attended by forward-thinking business leaders, ready to transform their departments.  https://t.co/zl0EsOOaGH",267939430,+0000,[],['kpmgcatalyst'],0,5
998382920703365122,kpmg,2018-05-21,02:00:12,"We'll be launching six new #tax technology solutions today at #KPMGCatalyst LIVE in Sydney, follow us to find out more!  https://t.co/O3yJTVco4L",267939430,+0000,[],"['tax', 'kpmgcatalyst']",1,7
998367803676733440,kpmg,2018-05-21,01:00:07,How can companies navigate the complexities of regulatory change and compliance? #KPMGCatalyst LIVE in Sydney uncovers how #technology is driving the transformation of legal services.  https://t.co/Cl1jloJjPr #legal,267939430,+0000,[],"['kpmgcatalyst', 'technology', 'legal']",0,2
998361066156503041,kpmg,2018-05-21,00:33:21,"KPMG's Tim Gillis, Global Head of Tax Technology and Innovation, kicks things off at #KPMGCatalyst LIVE in Sydney with a dynamic presentation on the megatrends driving transformation across tax, transactions and legal.  https://t.co/hg2SqD1gAJ  https://t.co/ioHyx44w9g",267939430,+0000,[],['kpmgcatalyst'],1,2
998359899288547329,kpmg,2018-05-21,00:28:43,"KPMG's Tim Gillis, Global Head of Tax Technology and Innovation, kicks things off at #KPMGCatalyst LIVE in Sydney with a dynamic presentation on the megatrends driving transformation across tax, transactions and legal.  https://t.co/hg2SqD1gAJ",267939430,+0000,[],['kpmgcatalyst'],0,7
998337625672114176,kpmg,2018-05-20,23:00:12,"How is #technology transforming tax, legal and transactions today, and which tools will be used in the future? #KPMGCatalyst Sydney is about to commence!  https://t.co/0Si5jBuEf8",267939430,+0000,[],"['technology', 'kpmgcatalyst']",0,4
998262102384087040,kpmg,2018-05-20,18:00:06,"General Counsels were responsible for setting data protection compliance policies at over a third (34%) of organizations, while one-quarter of respondents said this responsibility sits with their chief compliance officer.  https://t.co/VDwKbzWXR9",267939430,+0000,[],[],1,8
997869584546979840,kpmg,2018-05-19,16:00:23,Find out how #millennials are altering the picture of #familybusiness #succession  https://t.co/Z0k2r4Uaag  https://t.co/rpGX7GYMsN,267939430,+0000,[],"['millennials', 'familybusiness', 'succession']",0,17
997839314179559425,kpmg,2018-05-19,14:00:06,#VC in New York  https://t.co/FTodv4wRTx  https://t.co/mfkkFOAC4R,267939430,+0000,[],['vc'],0,5
997597792800526336,kpmg,2018-05-18,22:00:22,"With a rapidly improving oil price environment, this year’s quarterly earnings season kicked off with a resurgence in #oil &amp; #gas company profitability  https://t.co/TzkVtWjZbF",267939430,+0000,[],"['oil', 'gas']",0,7
997582676923215872,kpmg,2018-05-18,21:00:19,Have you looked at your supply chain as a potential risk for #GDPR compliance? Many businesses haven’t.  https://t.co/VDwKbzWXR9,267939430,+0000,[],['gdpr'],0,15
997567769297281024,kpmg,2018-05-18,20:01:04,.@LordHastings led an inspiring panel on empowering change and the power of purpose at the KPMG Islands Group Partners Conference this week  https://t.co/bYrqaV57QI,267939430,+0000,"[{'screen_name': 'lordhastings', 'name': 'michael hastings', 'id': '1734772086'}]",[],0,6
997552429565665280,kpmg,2018-05-18,19:00:07,#Tax leaders are being seen as integral to the leadership team of multinational organizations  https://t.co/Nfe90G5FKx  https://t.co/j3tqJ0kCq8,267939430,+0000,[],['tax'],0,4
997537370311446528,kpmg,2018-05-18,18:00:17,"For urban planners and dwellers, we answered the question: What is the smartest route to building a ""smart city""?  https://t.co/xHyVTN0aBM",267939430,+0000,[],[],1,6
997522265049837568,kpmg,2018-05-18,17:00:15,"Effective cyber security is 50% cultural, 30% process and just 20% technology  https://t.co/tFt7WNPHjX",267939430,+0000,[],[],0,11
997514682649980928,kpmg,2018-05-18,16:30:07,"46% of tax leaders assess their TP results against targeted policies on an annual basis, but with the rapid pace of change, this may rise.  https://t.co/56cZsQocQL #KPMGXB",267939430,+0000,[],['kpmgxb'],0,2
997492036424093699,kpmg,2018-05-18,15:00:08,Is 2018 the year for Unicorn exits? Find out in our Q1'18 Venture Pulse report:  https://t.co/pkgwwJ1RkR,267939430,+0000,[],[],0,2
997484488975421440,kpmg,2018-05-18,14:30:09,"Technology can help cities improve living standards, but it will only get them so far. It's how they use it that counts. 4 steps to help:  https://t.co/xHyVTN0aBM",267939430,+0000,[],[],0,6
997479744814964736,kpmg,2018-05-18,14:11:18,"44% of tax leaders say their TP function is optimized, yet 58% admit typically using manual spreadsheets for TP calculations.  https://t.co/56cZsQocQL #KPMGXB",267939430,+0000,[],['kpmgxb'],0,11
997477129490137089,kpmg,2018-05-18,14:00:54,"With many #banks having issued their first quarter reports, we take a closer look at the #IFRS9 disclosures they’ve made to date  https://t.co/FJv4vhpUNh",267939430,+0000,[],"['banks', 'ifrs9']",0,3
997476983385751556,kpmg,2018-05-18,14:00:19,"With leaders active in the business until a later age, disruption in #familybusiness #succession plans may occur  https://t.co/rDVbeJU3KM",267939430,+0000,[],"['familybusiness', 'succession']",0,3
997461831131201536,kpmg,2018-05-18,13:00:07,Regulators' expectations from #banks in today's challenging environment  https://t.co/gcCz7fTqqq  https://t.co/wAfHUARokO,267939430,+0000,[],['banks'],1,3
997235388879077376,kpmg,2018-05-17,22:00:19,What trends are the #oil &amp; #gas sector facing this month?  https://t.co/TzkVtWjZbF,267939430,+0000,[],"['oil', 'gas']",0,3
997227849814855683,kpmg,2018-05-17,21:30:21,The former CEO of UK's Ministry of Defence tells us why culture matters most when improving cyber security  https://t.co/tFt7WNPHjX,267939430,+0000,[],[],1,9
997220351280066560,kpmg,2018-05-17,21:00:33,What will global #MnA activity look like in 2018? Find out which sectors are expected to outperform.  https://t.co/oAOkx838nB,267939430,+0000,[],['mna'],0,5
997220217641152512,kpmg,2018-05-17,21:00:01,What will global #MnA activity look like in 2018? Find out which sectors are expected to outperform.  https://t.co/UFqGyvApxi  https://t.co/6l8hAerM4e,267939430,+0000,[],['mna'],0,6
997212664995700736,kpmg,2018-05-17,20:30:01,Three teams pitched why their business issue was the most crucial for TP Leaders to act on now. The majority of audience members at today’s TP forum in Miami voted that technology is the most urgent challenge to address. #KPMGXB  https://t.co/V2cP1JjUBK,267939430,+0000,[],['kpmgxb'],0,7
997205250741284865,kpmg,2018-05-17,20:00:33,".@BrianBann, Global Head of Communications, KPMG gives a behind-the-scenes look at our upcoming #CEOoutlook  https://t.co/CSMoIO6wv6",267939430,+0000,"[{'screen_name': 'brianbann', 'name': 'brian bannister', 'id': '213678713'}]",['ceooutlook'],0,14
997196692868001792,kpmg,2018-05-17,19:26:33,"Transfer Pricing leaders gather to tackle the complexities of the day as #Action13 unfolds around the world and US #TaxReform takes hold, with KPMG's Komal Dhall, kicking off the session in Miami. #KPMGXB  https://t.co/wulKP6BwHA",267939430,+0000,[],"['action13', 'taxreform', 'kpmgxb']",0,5
997159876638986241,kpmg,2018-05-17,17:00:15,The importance of being prepared for a transfer so founders can 'push the button' if needed  https://t.co/Z0k2r4Uaag  https://t.co/TzIAp4LDzk,267939430,+0000,[],[],1,10
997129685275328514,kpmg,2018-05-17,15:00:17,Employees are also your customers - #insurers need to support &amp; motivate them to ensure quality #CustomerService  https://t.co/J0j6EPJQIC,267939430,+0000,[],"['insurers', 'customerservice']",1,3
997114589937627136,kpmg,2018-05-17,14:00:18,What makes a smart city actually... smart?  https://t.co/xHyVTN0aBM,267939430,+0000,[],[],0,4
997099432184373248,kpmg,2018-05-17,13:00:04,Global venture firms are finding plenty of promising European companies to back  https://t.co/G4019ynxTl #FintechPulse  https://t.co/BbMHIgSPC1,267939430,+0000,[],['fintechpulse'],0,3
996842920027348993,kpmg,2018-05-16,20:00:47,What impacts do millennials have on the #FamilyBusiness?  https://t.co/Z0k2r4Uaag  https://t.co/glptkMRz8I,267939430,+0000,[],['familybusiness'],0,16
996827741776437249,kpmg,2018-05-16,19:00:28,5 key areas #insurers can work on to simplify the #customer experience and drive higher engagement  https://t.co/J0j6EQ1s7c,267939430,+0000,[],"['insurers', 'customer']",0,5
996812697294528518,kpmg,2018-05-16,18:00:41,"Cities pour money into the latest technologies, but is it actually making them ""smarter""?  https://t.co/xHyVTN0aBM",267939430,+0000,[],[],0,3
996797465344053248,kpmg,2018-05-16,17:00:09,Intelligent automation: Not “if” but “where” and “how”. #Tax leaders need to carefully assess what skills the department will require in the future.  https://t.co/SRThvNV1Ir,267939430,+0000,[],['tax'],0,3
996767245509554177,kpmg,2018-05-16,15:00:05,Q1'18 results further signify a sustained plateau in exit activity in the US  https://t.co/pkgwwJ1RkR,267939430,+0000,[],[],0,3
996752224343687169,kpmg,2018-05-16,14:00:23,"Brands aren’t fighting for shelf space anymore, they’re in a “virtual fight for mindshare”  https://t.co/S1CX9HGyoz",267939430,+0000,[],[],0,7
996495469936369665,kpmg,2018-05-15,21:00:08,Many organizations lack the cyber security processes needed to adequately defend themselves  https://t.co/tFt7WNPHjX,267939430,+0000,[],[],0,4
996480368277639168,kpmg,2018-05-15,20:00:08,"""#GDPR is a good opportunity to win consumer trust, examine closely how data is collected and stored, and prepare for a world where this data will become increasingly valuable."" Juerg Birri, Head of Global Legal Services, KPMG.  https://t.co/VDwKbzWXR9",267939430,+0000,[],['gdpr'],0,7
996465282850918402,kpmg,2018-05-15,19:00:11,Brazil is leading a trend among #tax and regulatory authorities worldwide. Read more in the latest edition of the Taxation of Cross-Border Mergers and Acquisitions.  https://t.co/LimDmKeQVu,267939430,+0000,[],['tax'],0,2
996450271051083777,kpmg,2018-05-15,18:00:32,Simplifying the customer experience is essential if #insurers are to drive higher engagement &amp; meet rising #customer expectations  https://t.co/J0j6EQ1s7c,267939430,+0000,[],"['insurers', 'customer']",1,6
996435190644920320,kpmg,2018-05-15,17:00:36,4 main actions to help any city or community leader get smarter about their tech investments  https://t.co/xHyVTN0aBM,267939430,+0000,[],[],0,5
996420111669059586,kpmg,2018-05-15,16:00:41,UK-based #familybusinesses should think through potential talent management issues that could arise due to #Brexit  https://t.co/rDVbeJU3KM,267939430,+0000,[],"['familybusinesses', 'brexit']",0,3
996404873825538049,kpmg,2018-05-15,15:00:08,Missed our #webcast on deal making in the #renewable energy sector? Listen and download the presentation here:  https://t.co/2IHq1dOtBL,267939430,+0000,[],"['webcast', 'renewable']",0,3
996390328411144192,kpmg,2018-05-15,14:02:20,"Non-tech sectors are essential to transforming business models, enhancing operations and leapfrogging the competition  https://t.co/Skf0yWhQb6 #MnA  https://t.co/ajyRUoAPTH",267939430,+0000,[],['mna'],0,4
996374655576543232,kpmg,2018-05-15,13:00:04,How are regulators responding to #fintech in different regions?  https://t.co/G4019ynxTl #FintechPulse,267939430,+0000,[],"['fintech', 'fintechpulse']",0,8
996133129369935872,kpmg,2018-05-14,21:00:19,"The ""insider threat"" has long been a problem for organizational security. These 2 things should be your top priority.  https://t.co/tFt7WNPHjX",267939430,+0000,[],[],0,6
996118005762404353,kpmg,2018-05-14,20:00:14,How can #blockchain speed up #tax transactions and lower costs? Hear from @KPMG_US' David Karczyk at #Consensus2018  https://t.co/wQLQMPMLXa  https://t.co/y76nw9iRCw,267939430,+0000,"[{'screen_name': 'kpmg_us', 'name': 'kpmg us', 'id': '18341726'}]","['blockchain', 'tax', 'consensus2018']",0,3
996110399790551040,kpmg,2018-05-14,19:30:00,#GDPR is nearly here but the journey to privacy maturity can be long for companies who have not set up their privacy maturity plans. Are you ready?  https://t.co/uqvZRBFkh7  https://t.co/3X9TmLaO5H,267939430,+0000,[],['gdpr'],1,21
996102910969831425,kpmg,2018-05-14,19:00:15,What are the differences between first generation and second generation #FamilyBusiness #succession and transfers?  https://t.co/Z0k2r4Uaag  https://t.co/pW5QhvxtAl,267939430,+0000,[],"['familybusiness', 'succession']",0,3
996087863572910080,kpmg,2018-05-14,18:00:27,#IFRS17 #Insurance – key takeaways from the Transition Resource Group’s May meeting.  https://t.co/Uka2WUKbop,267939430,+0000,[],"['ifrs17', 'insurance']",0,0
996072705844830214,kpmg,2018-05-14,17:00:13,"How should #insurers prepare for the age of #AutonomousVehicles, which could bring potentially lower premiums and new competition?  https://t.co/fdDR3fT0SA",267939430,+0000,[],"['insurers', 'autonomousvehicles']",1,8
996057684356096000,kpmg,2018-05-14,16:00:32,Faster &amp; more convenient P&amp;C #AutoClaims with #blockchain - Catch @KPMG_US' Malik Faizullah's session at #Consensus2018!  https://t.co/wQLQMPMLXa  https://t.co/tCSmXN5a5Z,267939430,+0000,"[{'screen_name': 'kpmg_us', 'name': 'kpmg us', 'id': '18341726'}]","['autoclaims', 'blockchain', 'consensus2018']",0,3
996042473897189376,kpmg,2018-05-14,15:00:06,#CVC participation in the US continues to soar in Q1'18  https://t.co/pkgwwJ1RkR,267939430,+0000,[],['cvc'],0,2
