id,username,date,time,tweet,user_id,timezone,mentions,hashtags,replies_count,likes_count
1176194589004353539,kpmg,2019-09-23,18:00:17,Adding more layers of security to #banking can cause challenges for customers. How many authentications are too much?  https://t.co/IRhZCx2i80 #Sibos,267939430,+0000,[],"['banking', 'sibos']",0,12
1176164347342721024,kpmg,2019-09-23,16:00:07,"While the Libra #cryptocurrency is likely to face significant challenges with respect to its launch, it will likely pull #fintech investors' attention back to cryptocurrencies  https://t.co/GQhXLAF1uv #FintechPulse",267939430,+0000,[],"['cryptocurrency', 'fintech', 'fintechpulse']",0,6
1176156796211388416,kpmg,2019-09-23,15:30:06,Leading #banks are working with #payment service providers to develop innovative solutions - but are they aligned on cyber security protocols?  https://t.co/i1BPZ2ad8I #Sibos,267939430,+0000,[],"['banks', 'payment', 'sibos']",1,13
1176149516547973122,kpmg,2019-09-23,15:01:11,"To manage expectations and create desired AI results, organizations should be realistic about AI’s potential and its limitations. Read more in our article:  https://t.co/jaMiuz4Az5  https://t.co/KE6bcUeoqU",267939430,+0000,[],[],0,5
1176134183263133698,kpmg,2019-09-23,14:00:15,"How should banks and payment service providers balance innovation, customer experience, and cyber security?  https://t.co/i1BPZ2ad8I #Sibos",267939430,+0000,[],['sibos'],0,9
1176119034389127169,kpmg,2019-09-23,13:00:03,No country is immune to change. How it reacts has an impact on the welfare of its citizens and institutions.  https://t.co/EQJEMVnnEi,267939430,+0000,[],[],1,14
1175107414510710786,kpmg,2019-09-20,18:00:14,KPMG’s Powered Enterprise approach can help to reduce the time and risk of a @Workday rollout while maximizing results  https://t.co/eSTuP7l8Qh  https://t.co/J5NWzQ8jRc,267939430,+0000,"[{'screen_name': 'workday', 'name': 'workday', 'id': '54983317'}]",[],1,8
1175031878602153984,kpmg,2019-09-20,13:00:05,How can lower income countries make the transitions necessary for greater resilience? @MikeHayes_KPMG addresses this question and more in the 2019 Change Readiness Index  https://t.co/EQJEMVnnEi,267939430,+0000,"[{'screen_name': 'mikehayes_kpmg', 'name': 'mike hayes', 'id': '933645506986864640'}]",[],1,8
1174956376591699970,kpmg,2019-09-20,08:00:04,Applying materiality when preparing #IFRS financial statements – remember to use materiality as a filter  https://t.co/BqtHtzGzDz,267939430,+0000,[],['ifrs'],2,8
1174775229937324034,kpmg,2019-09-19,20:00:15,Learn how to unlock the quality inside value proposition for life sciences.  https://t.co/qGcNBXuXUX #LifeSciences  https://t.co/6gQDtUIR6t,267939430,+0000,[],['lifesciences'],0,6
1174729974181441538,kpmg,2019-09-19,17:00:25,KPMG is proud to receive two Oracle Partner of the Year awards in recognition of delivering innovative #cloud solutions and customer success. Read more about the awards and our alliance with @Oracle:  https://t.co/VmpecgfTq9 #oow19  https://t.co/nDxcjfoAIt,267939430,+0000,"[{'screen_name': 'oracle', 'name': 'oracle', 'id': '809273'}]","['cloud', 'oow19']",0,9
1174669499620044800,kpmg,2019-09-19,13:00:07,"Large M&amp;A and buyouts accounted for the biggest #fintech deals in H1'19, including deals from: Canada, Germany and France  https://t.co/GQhXLAF1uv #FintechPulse",267939430,+0000,[],"['fintech', 'fintechpulse']",0,7
1174314655914889216,kpmg,2019-09-18,13:30:06,Livestream the Enactus World Cup Final Round of competition today at 2:30PM PDT to see who is named world champion! #NextGenLeaders #WeAllWin #Enactus  https://t.co/L9etCarFwk  https://t.co/yUz1Vx25Dd,267939430,+0000,[],"['nextgenleaders', 'weallwin', 'enactus']",0,8
1174307102694752256,kpmg,2019-09-18,13:00:05,"Governments, policy makers, NGOs, civil society institutions, development partners, investors, and private sector enterprises need to develop greater capacity for managing change  https://t.co/EQJEMVnnEi",267939430,+0000,[],[],0,11
1174231608104300544,kpmg,2019-09-18,08:00:06,Need to check which #IFRS standards are mandatory for your business this year? Use our web tool  https://t.co/SOcs90Q2LT,267939430,+0000,[],['ifrs'],0,8
1174050455648911360,kpmg,2019-09-17,20:00:16,Job one in life sciences: Kickstart the transition from formal quality to quality inside  https://t.co/qGcNBXuXUX  https://t.co/plUnzRDcSL,267939430,+0000,[],[],0,13
1173944712681664512,kpmg,2019-09-17,13:00:04,"Hong Kong (SAR), China, has made major strides in fintech during H1'19 with the issuance of 8 #VirtualBanking licenses  https://t.co/c4Gsgcbnxm #FintechPulse  https://t.co/QsdFaZMxkd",267939430,+0000,[],"['virtualbanking', 'fintechpulse']",0,5
1173584739556634629,kpmg,2019-09-16,13:09:40,Insurers – you have until 25 September to respond to the proposals on #IFRS17. Our analysis is here to help you assess their impacts and your next steps  https://t.co/xvVtcj7QT0 #insurance  https://t.co/mHXbJUO6ao,267939430,+0000,[],"['ifrs17', 'insurance']",0,4
1173582329488596992,kpmg,2019-09-16,13:00:06,"Which countries have the strongest enterprise, government, and civil society capabilities to respond to change?  https://t.co/EQJEMVnnEi",267939430,+0000,[],[],0,8
1172555574430621698,kpmg,2019-09-13,17:00:08,"Enactus Cairo University's project Rosie makes and sells high-quality organic pads, made by women for women. #NextGenLeaders #WeAllWin #Enactus  https://t.co/JeEmumeOa1  https://t.co/yam7sr7nNI",267939430,+0000,[],"['nextgenleaders', 'weallwin', 'enactus']",0,8
1172540461883506688,kpmg,2019-09-13,16:00:05,How is #proptech evolving into a key area of investment?  https://t.co/c4Gsgcbnxm #FintechPulse  https://t.co/b2q3fl5QVO,267939430,+0000,[],"['proptech', 'fintechpulse']",0,12
1172464957444755460,kpmg,2019-09-13,11:00:03,Businesses grow and evolve. Our revenue handbook is here to help you apply #IFRS15 to new facts and circumstances  https://t.co/VaKCnmdhfG,267939430,+0000,[],['ifrs15'],0,9
1172132776058990593,kpmg,2019-09-12,13:00:05,This G-Zero world offers as much opportunity as it does risk. Find out how to take advantage in KPMG International's latest report with @EurasiaGroup  https://t.co/XEkzZBazR6,267939430,+0000,"[{'screen_name': 'eurasiagroup', 'name': 'eurasia group', 'id': '44706837'}]",[],0,5
1171845894884528128,kpmg,2019-09-11,18:00:07,38 students from Enactus University of Puerto Rico at Humacao are certifying dog rescue programs to address community mental health through animal assisted therapy. #Enactus #WeAllWin #NextGenLeaders  https://t.co/q67UowKts1  https://t.co/m5YisrxvKP,267939430,+0000,[],"['enactus', 'weallwin', 'nextgenleaders']",0,12
1171830789761327104,kpmg,2019-09-11,17:00:06,The Enactus team from Covenant University in Nigeria is replacing traditional binding agents such as cement with molten plastic in construction. #WeAllWin #NextGenLeaders #Enactus  https://t.co/ANkMMr0qEi  https://t.co/kyQ3Aj9RIy,267939430,+0000,[],"['weallwin', 'nextgenleaders', 'enactus']",0,11
1171815923889704967,kpmg,2019-09-11,16:01:02,"Helping you apply #IFRS Standards consistently across your business, whatever direction it takes  https://t.co/zulxGgSTMN  https://t.co/F4cXzQa98Y",267939430,+0000,[],['ifrs'],0,6
1171815692548628480,kpmg,2019-09-11,16:00:07,"While the number of deals dropped between H2’18 and H1’19, Canada continued to see significant interest in #fintech, particularly from US investors  https://t.co/c4Gsgcbnxm #FintechPulse  https://t.co/0VesjeG7kh",267939430,+0000,[],"['fintech', 'fintechpulse']",0,7
1171770391230111745,kpmg,2019-09-11,13:00:06,#ClimateChange has been identified as one of the major risks facing this and future generations. We examined the capabilities societies need to successfully address &amp; mitigate climate risks. Are countries ready?  https://t.co/EQJEMVnnEi,267939430,+0000,[],['climatechange'],0,12
1171498624926175235,kpmg,2019-09-10,19:00:12,What are the 6 questions insurers should consider when determining whether an insurtech will be a good fit for their organizations?  https://t.co/obm0OGiHOK,267939430,+0000,[],[],1,10
1171468436888645633,kpmg,2019-09-10,17:00:14,The Enactus team from the Netherlands is providing employment through a recycling process that breaks down restaurant plastic waste into raw materials. #WeAllWin #NextGenLeaders #Enactus  https://t.co/T2v9wxkHNK  https://t.co/TMhqVl9Rnm,267939430,+0000,[],"['weallwin', 'nextgenleaders', 'enactus']",0,9
1171453329114710016,kpmg,2019-09-10,16:00:12,The Enactus national team in Mexico is developing sanitation ecotech that uses aquatic plants and worms to filter water for crop use. #WeAllWin #NextGenLeaders #Enactus  https://t.co/SnZQ6fKZUE  https://t.co/Bhmpta0A5l,267939430,+0000,[],"['weallwin', 'nextgenleaders', 'enactus']",0,19
1171121139663482881,kpmg,2019-09-09,18:00:12,Enactus Kyrgyzstan's team of 37 students from Alatoo International University are helping farmers grow sugar beet farms to sustain a business. #Enactus #WeAllWin #NextGenLeaders #Enactus  https://t.co/GpaGwA76wo  https://t.co/MKSDNLmwXm,267939430,+0000,[],"['enactus', 'weallwin', 'nextgenleaders', 'enactus']",0,11
1171106051468472322,kpmg,2019-09-09,17:00:15,"Representing Kazakhstan at Enactus WorldC up, The  https://t.co/qbTwGVWleM. Dulaty Taraz State University is creating Warm Box Briquttes as a solution for heating in rural villages. #WeAllWin #NextGenLeaders #Enactus  https://t.co/27Mwpzde0T  https://t.co/A47hIB4IUm",267939430,+0000,[],"['weallwin', 'nextgenleaders', 'enactus']",0,9
1171090916549038080,kpmg,2019-09-09,16:00:06,"Despite ongoing Brexit concerns, UK continued to attract a significant amount of #fintech funding during H1’19 and accounted for 6 of the top 10 deals in Europe  https://t.co/GQhXLAF1uv #FintechPulse",267939430,+0000,[],"['fintech', 'fintechpulse']",1,13
1169701798912897027,kpmg,2019-09-05,20:00:15,"“I think of my career as a jungle gym rather than a ladder, with many different experiences to build your full toolkit. And I love the idea of women reaching into that jungle gym, helping other women.”  https://t.co/qftufcaupW  https://t.co/Wd1xGEV6k6",267939430,+0000,[],[],0,22
1169686735464337408,kpmg,2019-09-05,19:00:24,#FinancialServices clients ranked KPMG firms No.1 for overall quality of work among 13 leading consulting organizations - via @sourcegr's 2019 Client Perceptions report  https://t.co/ijlCAhKydu  https://t.co/rJpOlHNrV9,267939430,+0000,"[{'screen_name': 'sourcegr', 'name': 'source global research', 'id': '1527449136'}]",['financialservices'],1,14
1169671587693563905,kpmg,2019-09-05,18:00:12,The Enactus team from the Indian Institute of Technology Delhi are reducing the growth of landfills with a composting solution for homes. #WeAllWin #NextGenLeaders #Enactus  https://t.co/Ipy51gV0zi  https://t.co/9rShQLh9sG,267939430,+0000,[],"['weallwin', 'nextgenleaders', 'enactus']",0,11
1169656514912673794,kpmg,2019-09-05,17:00:18,The Enactus World Cup national team from Ghana is redefining the way plastic waste is used by recycling it into bricks for construction purposes. #WeAllWin #NextGenLeaders #Enactus  https://t.co/ll9FehOQcu  https://t.co/sENUFVktrj,267939430,+0000,[],"['weallwin', 'nextgenleaders', 'enactus']",0,12
1169641359994753024,kpmg,2019-09-05,16:00:05,A lot of companies have managed to get intermediary licenses or e-money licenses in Ireland over the past 6 months - more will be issued in H2'19 given the number of applications in the queue  https://t.co/c4Gsgcbnxm #FintechPulse  https://t.co/aLb2YGltPO,267939430,+0000,[],['fintechpulse'],0,3
1169626353844531200,kpmg,2019-09-05,15:00:28,What organizational considerations should an #insurer think about to create a successful #insurtech collaboration?  https://t.co/ZCq2x8hkwI,267939430,+0000,[],"['insurer', 'insurtech']",0,8
1169309237589303296,kpmg,2019-09-04,18:00:21,Representing France at Enactus World Cup will be the the team from YNCREA who is helping rural farmers convert to organic produce. #WeAllWin #NextGenLeaders #Enactus  https://t.co/IRBytVK7LC  https://t.co/LUuhIdp7vf,267939430,+0000,[],"['weallwin', 'nextgenleaders', 'enactus']",0,4
1169263928628645888,kpmg,2019-09-04,15:00:19,Representing China at Enactus World Cup will be the Southwest Minzu University. Their team  created a business that makes braille stickers and voice guidance systems for the blind.  #NextGenLeaders #WeAllWin #Enactus  https://t.co/Sa1TUN3hW2  https://t.co/aU1EQ3g3bn,267939430,+0000,[],"['nextgenleaders', 'weallwin', 'enactus']",0,5
1169248803775504385,kpmg,2019-09-04,14:00:13,"The amendments to #IFRS9 and IAS 39 for hedge accounting and the replacement of IBOR rates will be published this month, with effect in 2020  https://t.co/DlYlDuG5ne",267939430,+0000,[],['ifrs9'],0,13
1168999646187917312,kpmg,2019-09-03,21:30:09,"Representing Australia at Enactus World Cup, @EnactusUnimelb has helped their community by selling prints made from transit cards to help disadvantaged students travel to school. #NextGenLeaders #WeAllWin #Enactus  https://t.co/f3DU8vmSKr  https://t.co/u6hUBwis8s",267939430,+0000,"[{'screen_name': 'enactusunimelb', 'name': 'enactus unimelb', 'id': '62010613'}]","['nextgenleaders', 'weallwin', 'enactus']",0,5
1168992100622487553,kpmg,2019-09-03,21:00:10,"Venture capital funding for #wealthtech has seen dramatic uptake in the first half of 2019, fueled by a series of mega deals by challenger banks  https://t.co/c4Gsgcbnxm #FintechPulse  https://t.co/ao6gm2gn4y",267939430,+0000,[],"['wealthtech', 'fintechpulse']",0,9
1168984551365992449,kpmg,2019-09-03,20:30:10,Meet the team from the Federal University of Pará representing Brazil at #Enactus World Cup. Their project gives access to drinking water in the Amazon through rainwater systems for homes. #NextGenLeaders #WeAllWin  https://t.co/zebT1k0BO4  https://t.co/q4PflwkPmJ,267939430,+0000,[],"['enactus', 'nextgenleaders', 'weallwin']",0,13
1168931736706846720,kpmg,2019-09-03,17:00:18,"If you have #leases, you'll probably face component questions in implementing #IFRS16. Our guide shows how to identify lease and non-lease components and allocate the consideration  https://t.co/ttd98D97Iq",267939430,+0000,[],"['leases', 'ifrs16']",0,18
1168916590261407751,kpmg,2019-09-03,16:00:07,How did your country rank in the 2019 Change Readiness Index?  https://t.co/Aase1cyyk0  https://t.co/rAgTu8CWMT,267939430,+0000,[],[],0,4
1168886812150030336,kpmg,2019-09-03,14:01:47,What do insurers need to keep in mind to create a successful #insurtech collaboration? Register for our upcoming webinar  https://t.co/ku8Pjz6O6Z  https://t.co/BjjTe22Fd4,267939430,+0000,[],['insurtech'],0,9
1167421742853369857,kpmg,2019-08-30,13:00:07,"$1.1 billion in overall #insurtech deal value suggests VCs and corporate acquirers alike are still staying active, but more cautious than in the past  https://t.co/c4Gsgcbnxm #FintechPulse  https://t.co/CMxjh3UnRj",267939430,+0000,[],"['insurtech', 'fintechpulse']",1,10
1166742271749963777,kpmg,2019-08-28,16:00:09,Singapore's virtual #banking licenses may be particularly disruptive as they are expected to be issued to non-banking entities in other sectors such as telecom and ride-hailing  https://t.co/c4Gsgcbnxm #FintechPulse  https://t.co/43Lx7f8LOD,267939430,+0000,[],"['banking', 'fintechpulse']",0,7
1166334630267686915,kpmg,2019-08-27,13:00:19,"""Businesses that can read the interconnected proverbial ‘tea leaves’ and are willing to take unflinching action seem to be coming out ahead.""  https://t.co/VGKGBkl53G  https://t.co/uGmAIagYEo",267939430,+0000,[],[],0,15
1166093038877323265,kpmg,2019-08-26,21:00:20,".@GaryReader_KPMG: ""The CEOs and companies I’m talking with are acutely aware of the need to future proof their brand.”  https://t.co/VGKGBkl53G  https://t.co/NdVdyDpWjf",267939430,+0000,"[{'screen_name': 'garyreader_kpmg', 'name': 'gary reader', 'id': '2571225331'}]",[],0,12
1166062828069015558,kpmg,2019-08-26,19:00:17,#CEOs must re-consider the traditional playbook to face a new generation of threats and opportunities  https://t.co/vht2CGnuhz #CEOoutlook,267939430,+0000,[],"['ceos', 'ceooutlook']",0,21
1166017508442329089,kpmg,2019-08-26,16:00:12,"Global #fintech investors showed a preference toward fewer, larger deals during H1'19  https://t.co/c4Gsgcbnxm #FintechPulse  https://t.co/cUERRByy4m",267939430,+0000,[],"['fintech', 'fintechpulse']",0,16
1164771766163501057,kpmg,2019-08-23,05:30:04,"Benchmark interest rate reform affects all companies, not just banks. Our podcast explains  https://t.co/MNRqzpFqjS",267939430,+0000,[],[],0,7
1164643434705145856,kpmg,2019-08-22,21:00:07,How can #insurers and #insurtechs partner together to meet #mobility disruption head on? Read our 5 best practices.  https://t.co/c4EtJii4Wv,267939430,+0000,[],"['insurers', 'insurtechs', 'mobility']",0,4
1164613278657601536,kpmg,2019-08-22,19:00:17,"""As you climb, you are disrupted at every step, it’s critical that you plan your strategy with precision and be ready to adjust with the conditions. Mindset becomes more important than footsteps.""  https://t.co/6gTvOkuqbf  https://t.co/C5P5aurmIB",267939430,+0000,[],[],0,15
1164598142001655808,kpmg,2019-08-22,18:00:08,"Despite the pause in investment in H1'19, less mature areas of #fintech such as microfinance and consumer finance are growing rapidly in China  https://t.co/c4Gsgcbnxm #FintechPulse  https://t.co/MJJM7P0hgS",267939430,+0000,[],"['fintech', 'fintechpulse']",0,8
1164567979574616067,kpmg,2019-08-22,16:00:17,#VC backed companies raised $8.7B across 825 deals in Europe in Q2'19  https://t.co/Mx1tFDIFif  https://t.co/8aay5EDdJa,267939430,+0000,[],['vc'],0,10
1164205551175249922,kpmg,2019-08-21,16:00:07,"What are the 4 key areas banks should focus on if they want to move into more automated, predictive #banking models and solutions?  https://t.co/SyULik6tNg",267939430,+0000,[],['banking'],3,11
1164190452133912577,kpmg,2019-08-21,15:00:08,"IFRS 15  – when application questions arise, use our revenue handbook  https://t.co/VaKCnmdhfG #IFRS15 #IFRS",267939430,+0000,[],"['ifrs15', 'ifrs']",0,10
1164084750652514304,kpmg,2019-08-21,08:00:06,Illustrative disclosures and disclosure checklist to help with 2019 interim reporting  https://t.co/kZkIPnE0Gy #IFRS,267939430,+0000,[],['ifrs'],0,8
1163873363649007617,kpmg,2019-08-20,18:00:08,"Despite a slight dip, #fintech investment in the US is posed to skyrocket to record-breaking highs in the second half of the year pending 3 massive M&amp;A deals  https://t.co/c4Gsgcbnxm #FintechPulse  https://t.co/tcT8E5de6y",267939430,+0000,[],"['fintech', 'fintechpulse']",1,7
1163843183576530944,kpmg,2019-08-20,16:00:12,Make the most of the extra year – there's still a lot to do to get ready for #IFRS17  https://t.co/xvDQJ1K6rW #insurance  https://t.co/69t4Efbljc,267939430,+0000,[],"['ifrs17', 'insurance']",1,10
1163450779140841473,kpmg,2019-08-19,14:00:56,"#VCQ2 sees $33.7B raised in the Americas across 2,528 deals  https://t.co/vae28kOvJc  https://t.co/KygBqa0peG",267939430,+0000,[],['vcq2'],0,8
1162469110330122244,kpmg,2019-08-16,21:00:08,"Besides customer-focused value propositions, #fintechs are also seizing various opportunities derived from open data  https://t.co/c4Gsgcbnxm #FintechPulse  https://t.co/zo2q10zlq0",267939430,+0000,[],"['fintechs', 'fintechpulse']",0,12
1162031305909067776,kpmg,2019-08-15,16:00:27,How is the transport industry becoming more customer-centric? Find out here:  https://t.co/fAp121cXB1,267939430,+0000,[],[],0,9
1161744333613277191,kpmg,2019-08-14,21:00:07,#VC invested in the autonomous car space has turned into a race. Read more in the KPMG Enterprise Venture Pulse report  https://t.co/KNAi87j48F,267939430,+0000,[],['vc'],1,7
1161699059142406145,kpmg,2019-08-14,18:00:13,What are the key factors behind Asia-Pacific's multi-year low #fintech investments in the first half of 2019?  https://t.co/c4Gsgcbnxm #FintechPulse  https://t.co/qcl34ZOEVG,267939430,+0000,[],"['fintech', 'fintechpulse']",0,6
1161336680453984257,kpmg,2019-08-13,18:00:15,#Bancassurance is facing an urgent need for increased collaboration between #insurers and #banks to build omnichannel capability.  https://t.co/U0seOJBaoz,267939430,+0000,[],"['bancassurance', 'insurers', 'banks']",0,10
1161321615818469377,kpmg,2019-08-13,17:00:24,The trend in transport is moving towards offering door-to-door services. Letting customers experience a complete journey with one single point of contact:  https://t.co/fAp121cXB1,267939430,+0000,[],[],0,9
1161019573778485248,kpmg,2019-08-12,21:00:11,#VC investment in the US remains robust in #Q2VC  https://t.co/OgNHm5VrR1  https://t.co/wxyzFqca8B,267939430,+0000,[],"['vc', 'q2vc']",0,9
1160974288343764995,kpmg,2019-08-12,18:00:14,"Automated predictive solutions in #banking are changing from giving the ""next best offer"" to their customers, to focusing on their ""next critical need""  https://t.co/66KrGGOaQV  https://t.co/qD7TV1l65J",267939430,+0000,[],['banking'],0,14
1160929244635193348,kpmg,2019-08-12,15:01:15,"“You need alignment across the organization – a connected enterprise approach – to meet customer expectations, improve business performance and achieve profitable growth.""  https://t.co/qlwMNjp5mn  https://t.co/ZAXcnm8vNI",267939430,+0000,[],[],0,5
1160913878588502016,kpmg,2019-08-12,14:00:12,"The Americas saw a great start to the year in #fintech investment, well on pace to match 2018's investment high  https://t.co/c4Gsgcbnxm #FintechPulse  https://t.co/vJj50BQ1jA",267939430,+0000,[],"['fintech', 'fintechpulse']",0,5
1159856869092913154,kpmg,2019-08-09,16:00:01,"The 2019 Change Readiness Index highlights the strengths and weaknesses of various countries, while benchmarking progress around the world  https://t.co/U1ckp3AFPu #SDGs  https://t.co/HbM70fjQdW",267939430,+0000,[],['sdgs'],0,15
1159539852230180866,kpmg,2019-08-08,19:00:18,"“In my experience, women often get their first big opportunity with a company or business unit in difficulty — I would say ‘yes’ to the challenge, figure it out and grow it.”  https://t.co/XZSBWvG1zY  https://t.co/H4q51aUtkc",267939430,+0000,[],[],1,19
1159509730253033473,kpmg,2019-08-08,17:00:36,How are leading #banks and #fintechs combining automation and predictive analytics to reinvent the customer and employee experience?  https://t.co/SyULik6tNg,267939430,+0000,[],"['banks', 'fintechs']",0,9
1159479495402971136,kpmg,2019-08-08,15:00:28,"Financial firms increasingly turn to #regtech companies for solutions to help them fill compliance gaps, save on compliance costs and get ahead of requirements  https://t.co/c4Gsgcbnxm #FintechPulse  https://t.co/8z71R2Bkr8",267939430,+0000,[],"['regtech', 'fintechpulse']",0,16
1159449211525652480,kpmg,2019-08-08,13:00:08,"When investments are made in enterprises that seek to do social good, whose version of social good is it? Julie Patterson, @kpmguk's Head of #AssetManagement Regulatory Change explores in her @fundforum blog  https://t.co/1xCltaFEKJ",267939430,+0000,"[{'screen_name': 'kpmguk', 'name': 'kpmg in the uk', 'id': '52393483'}, {'screen_name': 'fundforum', 'name': 'fundforum', 'id': '96843715'}]",['assetmanagement'],0,13
1159207628142252033,kpmg,2019-08-07,21:00:10,"Switzerland, Denmark, Sweden, Rwanda, New Zealand, and the U.K. are punching above their weight in the 2019 Change Readiness Index  https://t.co/iZuRgw0H7Z  https://t.co/uOYlQ9XrxQ",267939430,+0000,[],[],1,16
1159132124466831360,kpmg,2019-08-07,16:00:08,Sustainable finance is not just about investment products. How should asset managers approach applying ESG to their funds?  https://t.co/uPAvpRbJAx,267939430,+0000,[],[],0,15
1159086817628631040,kpmg,2019-08-07,13:00:06,Establishing regular family meetings to ensure your business family is united is one way to help mitigate risks that can affect your business. See how you can make sure everyone's on the same page #familybusiness:  https://t.co/d8zFE0HSKl,267939430,+0000,[],['familybusiness'],0,6
1158784851450957824,kpmg,2019-08-06,17:00:12,"After a blockbuster year, #VC exits drop to historic norms in Asia  https://t.co/WiaYQOugsC  https://t.co/MHCPgCcVOS",267939430,+0000,[],['vc'],0,10
1158769729638731776,kpmg,2019-08-06,16:00:07,#AssetManagement CEOs feel personally responsible to ensure their company's ESG policies reflect customer values #CEOoutlook. How are they integrating ESG into their decisions?  https://t.co/YhUKRsOJpC,267939430,+0000,[],"['assetmanagement', 'ceooutlook']",0,8
1158754866765975552,kpmg,2019-08-06,15:01:03,UK dominated but Germany and France pulled in the largest two of the top 10 #fintech deals in Europe in H1'19  https://t.co/c4Gsgcbnxm #FintechPulse  https://t.co/cB9KKi8DNl,267939430,+0000,[],"['fintech', 'fintechpulse']",0,6
1158724448247263233,kpmg,2019-08-06,13:00:11,"According to @WHO, the biggest threat to global health in 2019 is air pollution and #ClimateChange. Is your country able to build a climate-ready future?  https://t.co/EQJEMVnnEi",267939430,+0000,"[{'screen_name': 'who', 'name': 'world health organization (who)', 'id': '14499829'}]",['climatechange'],0,10
1158437541189693440,kpmg,2019-08-05,18:00:07,Transforming to an agile #cyber organization has many challenges and opportunities. Is your organization prepared?  https://t.co/zjR5pja3f9,267939430,+0000,[],['cyber'],0,10
1158377161964904448,kpmg,2019-08-05,14:00:11,Switzerland ranks #1 in our 2019 Change Readiness Index - for the second time.  https://t.co/Aase1cyyk0  https://t.co/bWaEMj9dUV,267939430,+0000,[],[],0,5
1157395683508445184,kpmg,2019-08-02,21:00:08,$52.7B was raised globally by #VC backed companies in Q2 #Q2VC  https://t.co/KNAi87j48F,267939430,+0000,[],"['vc', 'q2vc']",1,8
