id,username,date,time,tweet,user_id,timezone,mentions,hashtags,replies_count,likes_count
1071170027733348352,kpmg,2018-12-07,22:30:10,".@CharlesSchwab's EVP, #HR Katie Casey believes their brand and clients' trust are directly related to the positive interactions &amp; relationships they foster among their employees  https://t.co/9rN4dPTwNL #FutureofHR  https://t.co/YB7CWHRbp9",267939430,+0000,"[{'screen_name': 'charlesschwab', 'name': 'charles schwab corp', 'id': '132703700'}]","['hr', 'futureofhr']",0,7
1071132299624894464,kpmg,2018-12-07,20:00:15,"#Insurers, here are 5 steps to build a #ConnectedEnterprise and to stay relevant with customers:  https://t.co/xk2Bqb2zPS @TomRobertsKPMG @DigitalInsurer",267939430,+0000,"[{'screen_name': 'digitalinsurer', 'name': 'the digital insurer', 'id': '877751179'}]","['insurers', 'connectedenterprise']",0,3
1071086981399097345,kpmg,2018-12-07,17:00:10,#CEOs: It’s time to step up and drive #i40 change. To succeed is to compete - and survive - in the digital economy  https://t.co/I15Dd5OYf7,267939430,+0000,[],"['ceos', 'i40']",0,8
1071041662380576768,kpmg,2018-12-07,14:00:05,How is the move toward #OpenBanking propelling #fintech activity globally?  https://t.co/8lUZkbBOFx #FintechPulse  https://t.co/r2sgi0cwg0,267939430,+0000,[],"['openbanking', 'fintech', 'fintechpulse']",0,3
1071041661957013504,kpmg,2018-12-07,14:00:05,We translated technical #IFRS16 content for business application. Learn more:  https://t.co/CVzZu80J91 #leases,267939430,+0000,[],"['ifrs16', 'leases']",0,5
1071011473110036481,kpmg,2018-12-07,12:00:08,Tax #digitization is one of the key factors reshaping the tax operating models of the future  https://t.co/gLkxwcCSBi #futureoftax,267939430,+0000,[],"['digitization', 'futureoftax']",0,4
1070769939068403713,kpmg,2018-12-06,20:00:22,"The shift to robotics creates new efficiencies at reduced costs, but how does it affect a company's structure?  https://t.co/JXSXsG3Ahq #FutureofHR #globalmobility",267939430,+0000,[],"['futureofhr', 'globalmobility']",1,15
1070754809484111872,kpmg,2018-12-06,19:00:14,"With the EU at the center of important geopolitical shifts, tax leaders need to think through and prepare for an array of possible implications.  https://t.co/v5sZ7VzUue #futureoftax #geopolitics",267939430,+0000,[],"['futureoftax', 'geopolitics']",0,5
1070724587577593856,kpmg,2018-12-06,17:00:09,The simple truth is that organizations that truly understand their customers – and put that knowledge at the heart of their business – will outperform their rivals  https://t.co/YtgCsIaCpI  https://t.co/G1fJ6KEjXq,267939430,+0000,[],[],0,6
1070723794208141312,kpmg,2018-12-06,16:57:00,64% of consumers around the world feel anxious about the unauthorized tracking of their online habits. Learn more here:  https://t.co/Qw9sdtcbAu,267939430,+0000,[],[],1,5
1070709643087736832,kpmg,2018-12-06,16:00:46,"""Governing what machines learn and allowing them to build on their interaction with people will be crucial in ensuring machines have a well rounded education.""  https://t.co/N5mnkDRmVM",267939430,+0000,[],[],1,4
1070694381047427072,kpmg,2018-12-06,15:00:07,Are you in the KNOW or in the NO when it comes to the #FutureofHR?   https://t.co/Al7ei9NjGB,267939430,+0000,[],['futureofhr'],0,7
1070664190451437568,kpmg,2018-12-06,13:00:09,What is your organization's policy towards your international assignees purchasing homes in their host country/jurisdiction?  https://t.co/OLNF8Pw7q4 #globalmobility  https://t.co/2F3pecX6Sm,267939430,+0000,[],['globalmobility'],0,3
1070437696248692736,kpmg,2018-12-05,22:00:09,"As business changes, tax changes. As tax changes, business changes. Listen to Tim Sarson, Partner, @kpmguk discuss what impact this will have on #BusinessModels in his latest podcast.  https://t.co/suUaSIqr4u #futureoftax",267939430,+0000,"[{'screen_name': 'kpmguk', 'name': 'kpmg in the uk', 'id': '52393483'}]","['businessmodels', 'futureoftax']",0,6
1070422597555376128,kpmg,2018-12-05,21:00:09,#Data is the key to knowing and getting closer to your customer  https://t.co/YtgCsIaCpI #customerinsights  https://t.co/FJNBMchHtt,267939430,+0000,[],"['data', 'customerinsights']",0,5
1070407521947529216,kpmg,2018-12-05,20:00:15,Being a #ConnectedEnterprise is about using data to create personalized offerings and a unique customer experience  https://t.co/xk2Bqb2zPS @TomRobertsKPMG @DigitalInsurer,267939430,+0000,"[{'screen_name': 'digitalinsurer', 'name': 'the digital insurer', 'id': '877751179'}]",['connectedenterprise'],0,2
1070399952449359873,kpmg,2018-12-05,19:30:10,"Shenaz Khan at @Westpac aims to develop a 'talent factory' to create the ""most skilled workforce in the industry.""  https://t.co/ZE4veb4hYg #FutureofHR  https://t.co/dIB2vmLi97",267939430,+0000,"[{'screen_name': 'westpac', 'name': 'westpac bank', 'id': '14686881'}]",['futureofhr'],0,2
1070392390974889984,kpmg,2018-12-05,19:00:07,Here are five crucial questions that today’s CEOs must ask themselves if they hope to pursue smarter #i40 initiatives  https://t.co/1t0W4tLsSc,267939430,+0000,[],['i40'],0,3
1070377301051883524,kpmg,2018-12-05,18:00:09,The #AI era is poised to make the human workforce more productive. Here's how:  https://t.co/H5SKa6tNzt,267939430,+0000,[],['ai'],0,3
1070362168640618498,kpmg,2018-12-05,17:00:02,#InternationalVolunteerDay serves as a reminder of the impact we can make if we take an active role in our communities. We’re proud of our people who give their time.  https://t.co/aWMBUBOz6z #IVD2018 #ResilientCommunities  https://t.co/l9oWkJnkgE,267939430,+0000,[],"['internationalvolunteerday', 'ivd2018', 'resilientcommunities']",0,42
1070349603633942528,kpmg,2018-12-05,16:10:06,"If you guessed 10 years old, you are correct! Find out more about the echo effect between Gen X parents and their Gen Z children in our second edition of Me, my life, my wallet report:  https://t.co/YtgCsIsdhg  https://t.co/RPy7MYihqk",267939430,+0000,[],[],0,5
1070348248248836097,kpmg,2018-12-05,16:04:43,Are you comfortable sharing your personal information online when holiday shopping?,267939430,+0000,[],[],1,2
1070347942253346816,kpmg,2018-12-05,16:03:30,"Offering healthier products has become a major consideration for companies, especially those in the food industry. Find out more here:  https://t.co/PGwG0jWp2G",267939430,+0000,[],[],0,2
1070316886171242496,kpmg,2018-12-05,14:00:05,What's driving the increased focus on regtech?  https://t.co/8lUZkbBOFx  https://t.co/oRM795YAeK,267939430,+0000,[],[],1,6
1070271578825547782,kpmg,2018-12-05,11:00:03,Which standards do you need to apply in your next financial statements? Use our web tool to check.  https://t.co/WAWwQnR7wl #IFRS,267939430,+0000,[],['ifrs'],0,2
1070031888528498688,kpmg,2018-12-04,19:07:37,How do companies and their #GlobalMobility employees begin to understand and accept the robot at the next desk?  https://t.co/JXSXsGlb8Y #FutureofHR,267939430,+0000,[],"['globalmobility', 'futureofhr']",1,9
1070014878373502977,kpmg,2018-12-04,18:00:01,Digital and human labor is the workforce of the future and the #FutureofHR. Learn more here:  https://t.co/yQoqONyTlC  https://t.co/Xod2uJ1gjD,267939430,+0000,[],['futureofhr'],0,5
1069984901074640896,kpmg,2018-12-04,16:00:54,At what age on average do you think children are gaining access to social media globally?  https://t.co/YtgCsIsdhg,267939430,+0000,[],[],1,5
1069939408202334214,kpmg,2018-12-04,13:00:08,Modernizing the #tax department with ever-advancing technologies like data and analytics and intelligent automation has a permanent spot on nearly every CTOs wish list.   https://t.co/DkXDvSxfmg,267939430,+0000,[],['tax'],0,2
1069712947088384000,kpmg,2018-12-03,22:00:15,Did you know companies that turn #insurers into #ConnectedEnterprises are seeing 2x overall ROI?  https://t.co/xk2Bqb2zPS @TomRobertsKPMG @DigitalInsurer,267939430,+0000,"[{'screen_name': 'digitalinsurer', 'name': 'the digital insurer', 'id': '877751179'}]","['insurers', 'connectedenterprises']",0,5
1069683091520741376,kpmg,2018-12-03,20:01:37,"Meet Peter, Shane and Lucas - some of our extraordinary people. Check out their inspiring stories here:  https://t.co/v8DnEhyWVG #futureisinclusive #IDPWD2018  https://t.co/khtNZYfmga",267939430,+0000,[],"['futureisinclusive', 'idpwd2018']",0,16
1069667658705068034,kpmg,2018-12-03,19:00:17,The increase in regulatory pressure means organizations must innovate their approach to sanctions compliance  https://t.co/qJsXJ7c9iX  https://t.co/10JF4pygrA,267939430,+0000,[],[],0,9
1069652580198989824,kpmg,2018-12-03,18:00:22,"No one should be left behind! Together we will continue to empower differently-abled persons to create an inclusive, equitable and sustainable future for all 💜  https://t.co/v8DnEhhm48 #futureisinclusive #IDPWD2018  https://t.co/fgvGTQ8IJ5",267939430,+0000,[],"['futureisinclusive', 'idpwd2018']",0,19
1069652533050773509,kpmg,2018-12-03,18:00:11,Exactly what does your business need to look like tomorrow to be competitive or disruptive via #i40? Find out here  https://t.co/TpVM8S5rMQ,267939430,+0000,[],['i40'],0,4
1069610404005896192,kpmg,2018-12-03,15:12:47,"When you shop for the #holidays, do you consider if the companies and/or brands you're buying from show an interest in your health and wellness?",267939430,+0000,[],['holidays'],2,2
1069607284630855681,kpmg,2018-12-03,15:00:23,How will the age of the smart machine impact mobile workers?  https://t.co/onwE3W4wbV #globalmobility #FutureofHR,267939430,+0000,[],"['globalmobility', 'futureofhr']",0,7
1069592108577759232,kpmg,2018-12-03,14:00:05,Which Asian countries dominated H1 2018's top 10 #fintech deals?  https://t.co/8lUZkbBOFx #FintechPulse  https://t.co/EJCGDhT36w,267939430,+0000,[],"['fintech', 'fintechpulse']",0,3
1069531710725988352,kpmg,2018-12-03,10:00:05,Do you need to know how to account for share-based payments? Check out our updated handbook  https://t.co/eyTOt9dIIz #IFRS,267939430,+0000,[],['ifrs'],0,6
1068626482010804225,kpmg,2018-11-30,22:03:02,Did you know millennials actually want to work more hours (7.7 per day) compared to Gen X and Baby Boomers? Find out more here:  https://t.co/YtgCsIsdhg,267939430,+0000,[],[],0,6
1068610682449551366,kpmg,2018-11-30,21:00:15,What is the impact of US #tax reforms on supply chains for global and US companies?   https://t.co/DkXDvSxfmg,267939430,+0000,[],['tax'],0,2
1068595526822699011,kpmg,2018-11-30,20:00:01,What's stopping #AssetManagers from addressing #ClimateRisks? @WimBartels explains in the video below. For more #sustainability videos register for the KPMG Global Sustainability Institute here:  https://t.co/rnO9MqUJwr  https://t.co/oVT7Zv3A4K,267939430,+0000,"[{'screen_name': 'wimbartels', 'name': 'wim bartels', 'id': '44193912'}]","['assetmanagers', 'climaterisks', 'sustainability']",0,6
1068580485272604673,kpmg,2018-11-30,19:00:15,"""To keep workers employable in the #AI age, business leaders need to build a culture that embraces continuous education."" @ClifJustice, Head of Cognitive Technology  https://t.co/H5SKa6tNzt",267939430,+0000,[],['ai'],1,8
1068565422344216577,kpmg,2018-11-30,18:00:24,How are financial institutions shaping their #workforce of the future? Find out:  https://t.co/RqfRPVyrnu #FutureofHR,267939430,+0000,[],"['workforce', 'futureofhr']",0,5
1068508479571148802,kpmg,2018-11-30,14:14:08,How many hours do you think millennials want to work per day?  https://t.co/YtgCsIsdhg,267939430,+0000,[],[],2,9
1068504980410286085,kpmg,2018-11-30,14:00:13,#Digitization has changed all aspects of taxation – from tax collections and compliance to the tax base itself:  https://t.co/VvdAkgzHf5 #futureoftax,267939430,+0000,[],"['digitization', 'futureoftax']",0,9
1068414360178049024,kpmg,2018-11-30,08:00:08,#IFRS16 – the choices that you make now will affect your financial statements for years to come  https://t.co/iUVSG1luUh #leases,267939430,+0000,[],"['ifrs16', 'leases']",0,5
1068263392090234880,kpmg,2018-11-29,22:00:14,56% of #power &amp; #utilities companies have a chief #digital officer or equivalent #CIOSurvey  https://t.co/gdhlyhn2RV,267939430,+0000,[],"['power', 'utilities', 'digital', 'ciosurvey']",1,5
1068248301802262528,kpmg,2018-11-29,21:00:16,Stay up-to-date with our latest #sustainability news and views by registering for the KPMG Global Sustainability Institute here:  https://t.co/PPBVVdyd2t  https://t.co/YkRF7w09ZB,267939430,+0000,[],['sustainability'],0,3
1068233219580051457,kpmg,2018-11-29,20:00:21,In the #FutureofHR will we see more focus on #robotics or rise of the humans? Find out more here:  https://t.co/wUptMR8Ycs,267939430,+0000,[],"['futureofhr', 'robotics']",1,6
1068233191864102918,kpmg,2018-11-29,20:00:14,"Businesses have no time to lose on #Industry40 amid today’s ecosystem of new business models, products and markets  https://t.co/zdsTJhrFuj",267939430,+0000,[],['industry40'],0,3
1068203044620378112,kpmg,2018-11-29,18:00:26,"When prioritizing digital investments, #oil &amp; #gas companies heavily focus on improving business process efficiency #CIOSurvey  https://t.co/l8VrCMAaSa",267939430,+0000,[],"['oil', 'gas', 'ciosurvey']",0,4
1068189756167581696,kpmg,2018-11-29,17:07:38,What is #workforce shaping? Not sure? Watch @robertpbolton and @laurajhay1 discuss workforce shaping and how it will affect businesses #FutureofHR  https://t.co/0wPWXnUw7g,267939430,+0000,"[{'screen_name': 'robertpbolton', 'name': 'robert bolton', 'id': '886591818'}, {'screen_name': 'laurajhay1', 'name': 'laura hay', 'id': '964136692385894400'}]","['workforce', 'futureofhr']",0,9
1068142580423102464,kpmg,2018-11-29,14:00:10,"Learn how businesses are preparing to evaluate existing corporate governance policies and, where necessary, making adjustments to align with leading corporate governance practices.  https://t.co/fbGcSbEFAn",267939430,+0000,[],[],0,4
1067901004656664576,kpmg,2018-11-28,22:00:14,"Business leaders, the way you prepare your workforce for the new era of #AI will define your organization  https://t.co/H5SKa6tNzt",267939430,+0000,[],['ai'],0,4
1067882181823934464,kpmg,2018-11-28,20:45:27,Which country offers the top #businessincentives to #globalmanufacturers investing in i4.0?  https://t.co/mcO3XxLYcX,267939430,+0000,[],"['businessincentives', 'globalmanufacturers']",1,4
1067831765106978816,kpmg,2018-11-28,17:25:06,"The second edition of our Me, my life, my wallet report found that the majority of consumers globally would not trade their data for anything.  https://t.co/YtgCsIsdhg",267939430,+0000,[],[],0,3
1067810396533374977,kpmg,2018-11-28,16:00:12,How are industries shaping their workforce of the future? Stay up-to-date by following #FutureofHR this month  https://t.co/DMOy3UDtmC,267939430,+0000,[],['futureofhr'],1,5
1067795340592640000,kpmg,2018-11-28,15:00:22,Disclosure of expected credit losses – taskforce makes recommendations to help large #banks meet investors’ needs  https://t.co/1mLQU2n3xm #IFRS9,267939430,+0000,[],"['banks', 'ifrs9']",0,2
1067787697828315137,kpmg,2018-11-28,14:30:00,"Disruptive, pivotal and undefined. What does the #FutureofHR look like to you?  https://t.co/WTFXEwUxkt  https://t.co/A9cwR7cblm",267939430,+0000,[],['futureofhr'],0,3
1067540129613574145,kpmg,2018-11-27,22:06:15,Is your organization wired for geopolitical change?  https://t.co/hZBFLA8LaB #futureoftax #geopolitics,267939430,+0000,[],"['futureoftax', 'geopolitics']",0,3
1067508396130254848,kpmg,2018-11-27,20:00:09,"By 2030, alternative R&amp;D funding strategies will be in place. Learn more:  https://t.co/50pGHPDjn2  https://t.co/LnhtKCltvC",267939430,+0000,[],[],0,4
1067493294337376258,kpmg,2018-11-27,19:00:09,Importance of corporate #VC investment is key in Europe  https://t.co/kaupZ8PqEf  https://t.co/ENXUHXU0P1,267939430,+0000,[],['vc'],0,4
1067463172892884992,kpmg,2018-11-27,17:00:27,Is your #GlobalMobility program aligned to your organization's talent management initiative?  https://t.co/OLNF8Pw7q4  https://t.co/AQCdrOXTkM,267939430,+0000,[],['globalmobility'],0,2
1067461930858598400,kpmg,2018-11-27,16:55:31,"Almost one-third of consumers (31%) said yes, according to @KPMG_US's holiday shopping season survey:  https://t.co/aaXz70XtGa",267939430,+0000,"[{'screen_name': 'kpmg_us', 'name': 'kpmg us', 'id': '18341726'}]",[],1,2
1067449482164490240,kpmg,2018-11-27,16:06:03,"Manufacturers, where do you stand compared to #industry40 trailblazers? Our brief quiz may prove to be revealing  https://t.co/TBCF9dDkkL",267939430,+0000,[],['industry40'],1,7
1067441515767619589,kpmg,2018-11-27,15:34:24,What do you think consumers are most willing to trade their data for?  https://t.co/YtgCsIsdhg,267939430,+0000,[],[],4,6
1067417786878750721,kpmg,2018-11-27,14:00:06,"Will Pritchett, KPMG's Global #Insurtech Lead will present the Start-up Insurtech award at @DigitalInsurer's Global LIVEFEST 2018 - register to find out who's transforming #insurance!  https://t.co/6U3kkOBnWu  https://t.co/rCBffXJdq7",267939430,+0000,"[{'screen_name': 'digitalinsurer', 'name': 'the digital insurer', 'id': '877751179'}]","['insurtech', 'insurance']",0,2
1067130948393807873,kpmg,2018-11-26,19:00:19,How will #blockchain affect the #oil and #gas industry?  https://t.co/oeDS8stGYI,267939430,+0000,[],"['blockchain', 'oil', 'gas']",1,7
1067100777255178241,kpmg,2018-11-26,17:00:25,#Bank corporate development teams are growing their skills in:  1) Regulatory change 2) Payment systems 3) Diligence capabilities   https://t.co/Qzt8TBxxkg #workforce #banking,267939430,+0000,[],"['bank', 'workforce', 'banking']",0,6
1067085613185343492,kpmg,2018-11-26,16:00:10,[Webinar] Is Asia the hothouse for #insurance innovation? Join @KPMGSingapore's Paul Brenchley's discussion with a panel of global insurers to find out  https://t.co/6U3kkOBnWu @DigitalInsurer  https://t.co/e4hOQ39DMR,267939430,+0000,"[{'screen_name': 'kpmgsingapore', 'name': 'kpmg singapore', 'id': '402463723'}, {'screen_name': 'digitalinsurer', 'name': 'the digital insurer', 'id': '877751179'}]",['insurance'],0,1
1067069654638575616,kpmg,2018-11-26,14:56:45,Are you going to do any holiday shopping on #CyberMonday?,267939430,+0000,[],['cybermonday'],2,5
1067062826110316545,kpmg,2018-11-26,14:29:37,Most people (74%) who said they were planning to shop on Black Friday said they planned to shop both online and in-store.  https://t.co/aaXz70XtGa,267939430,+0000,[],[],1,7
1067055389009747968,kpmg,2018-11-26,14:00:04,2018 saw interest in #cryptocurrency trading increase as US investors looked to manage volatility  https://t.co/n7XuAAUcKi #fintech #FintechPulse,267939430,+0000,[],"['cryptocurrency', 'fintech', 'fintechpulse']",0,4
1066964795423932416,kpmg,2018-11-26,08:00:05,What are the key #IFRS9 year-end challenges for #banks? This podcast investigates  https://t.co/P0CDgOqMub,267939430,+0000,[],"['ifrs9', 'banks']",0,5
1066092779409879040,kpmg,2018-11-23,22:15:00,Who is the customer of today and how can organizations get closer to the customer of tomorrow?  https://t.co/YtgCsIsdhg #customercentricity #customerinsights  https://t.co/PLEoj8oOoS,267939430,+0000,[],"['customercentricity', 'customerinsights']",0,18
1066009509443686401,kpmg,2018-11-23,16:44:07,How are you shopping on #BlackFriday?,267939430,+0000,[],['blackfriday'],8,18
1065998502902276101,kpmg,2018-11-23,16:00:23,[PODCAST] Listen to @janemccormickuk as she shares her views on what she sees as the most pressing trends for tax leaders and their departments today:  https://t.co/t5dCu1EQxl #futureoftax,267939430,+0000,"[{'screen_name': 'janemccormickuk', 'name': 'jane mccormick', 'id': '3200629323'}]",['futureoftax'],0,6
1065968231133954048,kpmg,2018-11-23,14:00:05,Global median financing size hit a new record during H1 2018  https://t.co/8lUZkbBOFx #fintech #FintechPulse  https://t.co/NEtcXPfLeq,267939430,+0000,[],"['fintech', 'fintechpulse']",0,5
1065711566262362113,kpmg,2018-11-22,21:00:12,Global retailers and new forms of digital transportation chains are threatening the maritime sector. How can the #shipping industry stay relevant?  https://t.co/GVEhrnSfjW,267939430,+0000,[],['shipping'],1,8
1065681369819430912,kpmg,2018-11-22,19:00:12,Autotech #VC investment focuses on islands of autonomy  https://t.co/kaupZ8PqEf  https://t.co/GlEeE4NZUF,267939430,+0000,[],['vc'],0,5
1065651227088826368,kpmg,2018-11-22,17:00:26,What can you do to prepare your R&amp;D organization for  fundamental changes in the R&amp;D landscape?  https://t.co/50pGHPDjn2 #LifeSciences,267939430,+0000,[],['lifesciences'],0,4
1065636293848256512,kpmg,2018-11-22,16:01:05,What should companies prioritize in the last six weeks before #IFRS16 #Leases comes into effect? This podcast investigates  https://t.co/yIExCmNLel,267939430,+0000,[],"['ifrs16', 'leases']",0,8
1065636205453291520,kpmg,2018-11-22,16:00:44,"At the #FundForumESG, it was often repeated that Environmental, Social and Governance (ESG) criteria will produce financial results and minimize risk in the long run.  https://t.co/PRCvvFHKe2",267939430,+0000,[],['fundforumesg'],0,11
1065368025308831744,kpmg,2018-11-21,22:15:05,"With #BlackFriday just around the corner, consumers are researching deals before, during and after online. How are consumers becoming smarter in their use of technology to manage their time and wallet?  https://t.co/YtgCsIaCpI #CustomerInsights",267939430,+0000,[],"['blackfriday', 'customerinsights']",1,12
1065353304970997761,kpmg,2018-11-21,21:16:35,"We're honored to have presented to more than 80,000 students through our Cyber Day initiative. View all the photos from around the world here:  https://t.co/NSxMPwozOV #CyberSafe  https://t.co/JRM2CZz10O",267939430,+0000,[],['cybersafe'],1,9
1065319009078427649,kpmg,2018-11-21,19:00:19,#Power &amp; #utilities CEOs are starting to see the importance of new workforce capabilities in supporting their organizations’ future growth  https://t.co/OMuprryImV #CEOoutlook  https://t.co/1sHYvDy8Q4,267939430,+0000,[],"['power', 'utilities', 'ceooutlook']",0,8
1065258635440340992,kpmg,2018-11-21,15:00:24,#VC deal value reachs $5.2B in Europe in #Q3VC  https://t.co/kaupZ8PqEf  https://t.co/gHn54LwZ7o,267939430,+0000,[],"['vc', 'q3vc']",0,4
1065243449979473920,kpmg,2018-11-21,14:00:04,"VCs are avidly funding #regtech companies, with 2018 on pace to be the most lucrative year ever  https://t.co/n7XuAAUcKi #FintechPulse",267939430,+0000,[],"['regtech', 'fintechpulse']",0,4
1064986819379556353,kpmg,2018-11-20,21:00:18,Fintech #VC investment is strong in UK  https://t.co/kaupZ8PqEf  https://t.co/5qdtV93FVW,267939430,+0000,[],['vc'],0,4
1064971735936716806,kpmg,2018-11-20,20:00:22,Did you know 90% of cargo is transported by sea? Click here to see how the future of the #shipping industry could look  https://t.co/GVEhrnSfjW,267939430,+0000,[],['shipping'],0,11
1064956604590755840,kpmg,2018-11-20,19:00:15,What are the 3 drivers that will likely revamp the approach to R&amp;D by 2030? Click here for the three drivers:  https://t.co/50pGHPDjn2,267939430,+0000,[],[],0,7
1064911385191112704,kpmg,2018-11-20,16:00:33,How can #bank corporate development teams deliver new value in a changing landscape?  https://t.co/Qzt8TBP8bO #MandA,267939430,+0000,[],"['bank', 'manda']",0,3
1064896232856985601,kpmg,2018-11-20,15:00:21,Is technology changing the #power &amp; #utilities industry?  https://t.co/OMuprryImV #CEOoutlook  https://t.co/FDudAjREGW,267939430,+0000,[],"['power', 'utilities', 'ceooutlook']",0,8
1064881083911684097,kpmg,2018-11-20,14:00:09,We have identified the key risk management challenges in #zerobasedbudgeting and ways to address these challenges head-on  https://t.co/ne54lCmN7h,267939430,+0000,[],['zerobasedbudgeting'],0,7
1064865974753595392,kpmg,2018-11-20,13:00:07,66% of people said their administrations auditors’ technological skills are either highly or moderately skilled.  https://t.co/smp5YeEyW9 #digitization #taxreimagined,267939430,+0000,[],"['digitization', 'taxreimagined']",0,5
1064820685237825536,kpmg,2018-11-20,10:00:09,"The more #insurers do to get ready for #IFRS17, the more they realize how big the task is. Keep moving forward.  https://t.co/uCu44Z5Eps  https://t.co/VQfLC0oPA8",267939430,+0000,[],"['insurers', 'ifrs17']",0,10
1064639585307815940,kpmg,2018-11-19,22:00:31,"We surveyed over 25,000 customers in 8 countries and defined six critical areas of focus for organizations who want to attract and keep customers today. Check out our Me, my life, my wallet report for more.  https://t.co/YtgCsIaCpI #customerinsights",267939430,+0000,[],['customerinsights'],0,12
1064631941222285313,kpmg,2018-11-19,21:30:09,Global #VC investment continues to soar in #Q3VC  https://t.co/kaupZ8PqEf  https://t.co/Udsx03zLVM,267939430,+0000,[],"['vc', 'q3vc']",0,10
1064624401583390721,kpmg,2018-11-19,21:00:11,48% of #power &amp; #utilities CEOs showed concern that becoming the victim of a cyber-attack is a matter of “when” and not “if”  https://t.co/OMuprryImV #CEOoutlook,267939430,+0000,[],"['power', 'utilities', 'ceooutlook']",0,5
1064594179454627840,kpmg,2018-11-19,19:00:06,Which #fintech sectors are driving the most interest among investors?  https://t.co/8lUZkbBOFx #FintechPulse  https://t.co/RzNTtN7VXI,267939430,+0000,[],"['fintech', 'fintechpulse']",0,4
1064563989567471616,kpmg,2018-11-19,17:00:08,How are #FamilyBusinesses keeping up with constant changes in the economy?  https://t.co/Ip0LpO4uVX  https://t.co/asxKU2HeW0,267939430,+0000,[],['familybusinesses'],0,6
