id,username,date,time,tweet,user_id,timezone,mentions,hashtags,replies_count,likes_count
1322176699702935553,kpmg,2020-10-30,14:01:04,"What does @Adrian_Poole1, @googlecloud Head of #FinancialServices UKI, expect to see for the future of #fintech? Find out in our #PulseofFintech Q&amp;A:  https://t.co/1U34RhaRur  https://t.co/m4b93C3NIv",267939430,+0000,"[{'screen_name': 'adrian_poole1', 'name': 'adrian poole', 'id': '151447111'}, {'screen_name': 'googlecloud', 'name': 'google cloud', 'id': '19367815'}]","['financialservices', 'fintech', 'pulseoffintech']",3,13
1321917069936500745,kpmg,2020-10-29,20:49:24,Do you know what apps are on your kid’s phone and how they’re used?  https://t.co/ircCQyMLZq,267939430,+0000,[],[],0,8
1321844553146601475,kpmg,2020-10-29,16:01:14,A recent study by @KPMG_NL and @MottMacDonald  evaluates the application of several leading #sustainability standards on existing #infrastructure development projects. View the findings:  https://t.co/zZh1xHAO69 #KPMGIMPACT,267939430,+0000,"[{'screen_name': 'kpmg_nl', 'name': 'kpmg nederland', 'id': '77996268'}, {'screen_name': 'mottmacdonald', 'name': 'mott macdonald', 'id': '40005458'}]","['sustainability', 'infrastructure', 'kpmgimpact']",0,14
1321814253330976778,kpmg,2020-10-29,14:00:50,Private sector pandemic trends. Read more Insights from our #CEOoutlook for government:  https://t.co/npRUMFsrOd,267939430,+0000,[],['ceooutlook'],1,3
1321799108764573697,kpmg,2020-10-29,13:00:40,The Golden Age of #universities is ending. The future is 'customer centric.'  https://t.co/VOafLpC9W0  https://t.co/fLxyrCe4lF,267939430,+0000,[],['universities'],1,9
1321149814072115200,kpmg,2020-10-27,18:00:36,"When downloading apps, make sure you get them from a trusted and secure source. If you don’t, you risk downloading a virus. Learn more:  https://t.co/fZsRh1kWDp  https://t.co/GWraKColP3",267939430,+0000,[],[],0,4
1321116527056375809,kpmg,2020-10-27,15:48:19,Tax planning for the transfer of a #familybusiness needs to be part of an overall planning process. Read our latest report for a blueprint to follow:  https://t.co/RlMdqO15c8  https://t.co/2qaM1RkkxK,267939430,+0000,[],['familybusiness'],0,4
1321074345117102084,kpmg,2020-10-27,13:00:42,Are you looking for key guidance on how to prepare and present consolidated financial statements? Join the webcast on Nov 4 at 12:00 p.m. EST to learn more at  https://t.co/qlgnTRQTCv  #audit #kpmgfrv #consolidation #accounting  https://t.co/t4nodJyuhK,267939430,+0000,[],"['audit', 'kpmgfrv', 'consolidation', 'accounting']",0,14
1319667201587163136,kpmg,2020-10-23,15:49:13,How has the impact of COVID-19 increased the pressure on business families when they look to transition their business to the next generation?  https://t.co/RlMdqO15c8 #familybusiness  https://t.co/Ysw4Dm7T4C,267939430,+0000,[],['familybusiness'],2,11
1319653818888572933,kpmg,2020-10-23,14:56:03,"Battle in Southeast Asia continues: 3 of the top 10 #fintech deals are from India, while the top US$3 billion deal is seen in Indonesia:  https://t.co/MykP7cXgRb  #fintechpulse",267939430,+0000,[],"['fintech', 'fintechpulse']",0,15
1319377961141870592,kpmg,2020-10-22,20:39:53,Cyber criminals are hoping you will take the bait and give them your sensitive personal information. Which of the following is an example of a ‘phishing’ attack?  https://t.co/ircCQyMLZq,267939430,+0000,[],[],0,11
1319217014913798144,kpmg,2020-10-22,10:00:20,KPMG reelects Bill Thomas as Global Chairman &amp; CEO.  https://t.co/CwWhirL7sh,267939430,+0000,[],[],1,70
1318975509951401990,kpmg,2020-10-21,18:00:41,"TSAs usually cover multiple areas, especially administrative functions. Carefully defining all relevant terms is critical to avoid future conflicts and share-price impacts.  https://t.co/9l0gvntmMO  https://t.co/3GbavodMNW",267939430,+0000,[],[],0,11
1318916190245453825,kpmg,2020-10-21,14:04:58,"Read our latest 2020 KPMG Enterprise Global Family Business Tax Monitor report, to learn more about the tax implications of transferring a family business:  https://t.co/RlMdqO15c8  https://t.co/KKYtYCxUPX",267939430,+0000,[],[],0,8
1318660622675042304,kpmg,2020-10-20,21:09:26,Move from cyber uncertainty to cyber serenity. Learn more here:  https://t.co/YlhM5tYxZg #cybersecurity  https://t.co/vL44Sv4FTL,267939430,+0000,[],['cybersecurity'],0,13
1318229572186460160,kpmg,2020-10-19,16:36:36,KPMG #CEO Outlook private sector insights for government from @LizForsythKPMG   https://t.co/npRUMFsrOd,267939430,+0000,"[{'screen_name': 'lizforsythkpmg', 'name': 'liz forsyth', 'id': '4795393112'}]",['ceo'],0,14
1318226312364961804,kpmg,2020-10-19,16:23:38,8 key #cybersecurity considerations to help shape a new approach to security in the new reality.  https://t.co/LggQNuf1Ir  https://t.co/l1EhXASFCN,267939430,+0000,[],['cybersecurity'],0,9
1317193760854495234,kpmg,2020-10-16,20:00:39,"About 60% of CEOs and EVPs say that their organizations consider #HR to be an ""administrator"" rather than a value driver; 74% of CHROs disagree.  https://t.co/IuFtDc5G19  https://t.co/7aMeNw2tXg",267939430,+0000,[],['hr'],0,14
1317163552344559617,kpmg,2020-10-16,18:00:37,Financial statements must often be prepared because historical financial information may not appropriately reflect the economic activities of the carve-out business. Read more:  https://t.co/9l0gvntmMO  https://t.co/HLF2Q6I1S5,267939430,+0000,[],[],0,10
1317148499721572355,kpmg,2020-10-16,17:00:48,The global #pandemic accelerated the pace of change and the finance function finds itself in a unique position to be at the heart of change across an organization.  https://t.co/sdxYhINwf0  https://t.co/xHz6RQuHMo,267939430,+0000,[],['pandemic'],0,12
1317103302610440192,kpmg,2020-10-16,14:01:12,"Despite impacts of COVID-19, Europe recorded second highest quarter of VC #fintech investment in Q2'20, while Middle East sprouting new early stage fintech hubs. Read more in the latest #fintechpulse:  https://t.co/YNJRRhSUo5  https://t.co/ih7QTR44xC",267939430,+0000,[],"['fintech', 'fintechpulse']",1,13
1316841050615537671,kpmg,2020-10-15,20:39:06,5 areas that #realestate companies should focus on in the post-COVID-19 new reality.   https://t.co/Dafw5cd3JB,267939430,+0000,[],['realestate'],1,20
1316721222856716293,kpmg,2020-10-15,12:42:57,Do you know what apps are on your kid’s phone and how they’re used?  https://t.co/ircCQyMLZq,267939430,+0000,[],[],1,5
1316438796016259073,kpmg,2020-10-14,18:00:41,"These transactions' inherent complexities and interdependencies require a comprehensive project management office that steers, monitors, and manages the process.  https://t.co/9l0gvntmMO  https://t.co/gCTzWVjDWm",267939430,+0000,[],[],1,7
1316130298699055104,kpmg,2020-10-13,21:34:50,Do you know your kids online habits? Sit down with your kids and take the short 'How safe are your kids online' quiz to find out how #cybersafe they are.  https://t.co/fZsRh1kWDp  https://t.co/3FRlxVF4tX,267939430,+0000,[],['cybersafe'],1,9
1316115805508165639,kpmg,2020-10-13,20:37:14,COVID-19 has rapidly made people the number one priority in nearly every organization. #HR leaders are now at the forefront of reshaping the way work gets done.  https://t.co/IuFtDc5G19  https://t.co/SchUhb04JF,267939430,+0000,[],['hr'],3,21
1316061293628063744,kpmg,2020-10-13,17:00:38,"Despite causing global #supplychain disruption, the pandemic has given businesses a rare chance to reset. Find out how with #KPMG Powered Enterprise Supply Chain:  https://t.co/mLfrfSOB0c  https://t.co/40NLbTH8K9",267939430,+0000,[],"['supplychain', 'kpmg']",1,12
1316031115161817088,kpmg,2020-10-13,15:00:43,Do you have the same influence on your organization as your CIO peers? Find out in #CIOsurvey  https://t.co/nI6tZRnVS6  https://t.co/h0DJA7pk6s,267939430,+0000,[],['ciosurvey'],1,11
1315045794454605832,kpmg,2020-10-10,21:45:24,"This year it’s more important than ever that we have open conversations around our mental health. #WorldMentalHealthDay is a reminder to regularly check in with yourself and those around you, and seek support if you need it. #futureisinclusive  https://t.co/Yhjqj7zZKb",267939430,+0000,[],"['worldmentalhealthday', 'futureisinclusive']",1,24
1314626870974001152,kpmg,2020-10-09,18:00:45,A time span of one year between first announcing the transaction and listing the carve-out business on a stock exchange is an appropriate rule of thumb. Read more:  https://t.co/9l0gvntmMO  https://t.co/uyNj6tmhLV,267939430,+0000,[],[],1,13
1314611851544727561,kpmg,2020-10-09,17:01:04,Looking to improve your HR cost profile? #DigitalTransformation can improve your HR function with KPMG Powered Enterprise HR today.  https://t.co/l3HQzzjrUd  https://t.co/TdFeLMxXm5,267939430,+0000,[],['digitaltransformation'],3,12
1314575352631562240,kpmg,2020-10-09,14:36:02,"At mid-year, M&amp;A investments in the Americas recorded less than US$3 billion, yet VC fintech investments remains strong at US$9.3 billion. Read more in the latest #fintechpulse report:  https://t.co/RQMeo8rpb2  https://t.co/ejnfj9s05l",267939430,+0000,[],['fintechpulse'],2,12
1314308872631472129,kpmg,2020-10-08,20:57:08,How to integrate cyber into financial crime and fraud? Find out in our latest article:  https://t.co/bdnynpxrp4,267939430,+0000,[],[],1,12
1314308869569613824,kpmg,2020-10-08,20:57:07,Why integrating cyber into financial crime and fraud is needed. Learn more in our latest article:  https://t.co/dSAgfobKD1,267939430,+0000,[],[],0,7
1314278038050344962,kpmg,2020-10-08,18:54:37,"How cyber aware are you? What are the various ways you can be a cyber pro and protect your computer, network and children?  https://t.co/ircCQyMLZq",267939430,+0000,[],[],1,7
1314207180531200005,kpmg,2020-10-08,14:13:03,How has COVID-19 enhanced the perceived value of sustainable #realestate assets? KPMG's real estate leaders from around the world discuss the importance of #ESG:  https://t.co/PyFVgQ9tUo  https://t.co/4lQBUdg4Zw,267939430,+0000,[],"['realestate', 'esg']",1,11
1313928117057212420,kpmg,2020-10-07,19:44:09,The goal of maximizing shareholder value by establishing an independent entity with its own corporate rationale seems to work out well in many cases. Read more from our report:  https://t.co/9l0gvntmMO  https://t.co/z8IxEfiWby,267939430,+0000,[],[],1,7
1313922296076292103,kpmg,2020-10-07,19:21:01,What are the six macro themes that are critical for asset managers to thrive in the new reality?  Learn more:  https://t.co/f2mUda240R,267939430,+0000,[],[],1,12
1313583334312812545,kpmg,2020-10-06,20:54:06,How can fraud controls be exploited for cyber? Find out in our latest article:  https://t.co/iyfWJbkP1a,267939430,+0000,[],[],1,9
1313524593303445506,kpmg,2020-10-06,17:00:41,Meeting the demands of a virtual world requires #digitaltransformation. Find out how one global company successfully transformed with #KPMG Powered Enterprise.  https://t.co/jz08XeJ0gx  https://t.co/16YjDyaDfp,267939430,+0000,[],"['digitaltransformation', 'kpmg']",1,12
1313494399737835520,kpmg,2020-10-06,15:00:43,"COVID-19 changed everything, or did it? Learn what changed, what remains constant, and what you can control. #CIOsurvey  https://t.co/nI6tZRFxgG  https://t.co/be7Cn4w8w7",267939430,+0000,[],['ciosurvey'],1,13
1313464200132521987,kpmg,2020-10-06,13:00:42,"Watch where you click! Generic salutations, fake URLs, urgent action required, spelling errors are all ways in which you can be scammed. Check before you click. Learn more:  https://t.co/fZsRh1kWDp #cybersafe  https://t.co/CkfyF1NpoZ",267939430,+0000,[],['cybersafe'],0,12
1312133256515469312,kpmg,2020-10-02,20:52:01,Creating a reimaged incident management operating model. Learn more in our latest article:  https://t.co/m8eyfEXydE,267939430,+0000,[],[],2,6
1312059954753409026,kpmg,2020-10-02,16:00:44,How is the latest #GeopoliticalFaceOff of Today vs. Tomorrow shaping the #ESG agenda for business? Learn more:  https://t.co/dfFESUMIRa,267939430,+0000,[],"['geopoliticalfaceoff', 'esg']",0,10
1312029738303709184,kpmg,2020-10-02,14:00:40,"Investments in most #fintech segments have slowed in the first 6 months of 2020, yet #wealthtech and #cybersecurity investments remain strong - find out more in our latest #fintechpulse report:  https://t.co/io6UvBZ6pb",267939430,+0000,[],"['fintech', 'wealthtech', 'cybersecurity', 'fintechpulse']",0,8
1311772233841471489,kpmg,2020-10-01,20:57:26,"How cyber aware are you? What does the “ https://” at the beginning of a URL indicate, as opposed to “ http://” (without the “s”)?  https://t.co/ircCQyMLZq",267939430,+0000,[],[],1,5
1311672244905668609,kpmg,2020-10-01,14:20:07,"We're pleased to have been awarded the global Security Competency by @awscloud, reflecting the strong AWS technical knowledge of KPMG teams and a track record of delivering successful client engagements. Read more about our global alliance with AWS.  https://t.co/k02jJwtxQ3  https://t.co/PU0CjksfbE",267939430,+0000,"[{'screen_name': 'awscloud', 'name': 'amazon web services', 'id': '66780587'}]",[],0,26
1311669810900606978,kpmg,2020-10-01,14:10:27,"COVID-19 is a hard hit on physical retail #realestate, but a bright future remains as many retailers level up with data, innovation and enhanced customer experience. Learn more:  https://t.co/LPAKBQwuTn  https://t.co/mn0yfdwcE8",267939430,+0000,[],['realestate'],0,7
1311652296137363458,kpmg,2020-10-01,13:00:51,Talent has risen to be named as the most significant threat to businesses in the wake of the pandemic. Read more in the #CEOoutlook:  https://t.co/4g6wABSpT9  https://t.co/sH8ndOuyl4,267939430,+0000,[],['ceooutlook'],0,18
1311402440227467270,kpmg,2020-09-30,20:28:01,"2020 illustrative disclosures and disclosure checklist, including a supplement on accounting for #COVID19 – out now  https://t.co/jeZPatlGDH #IFRS",267939430,+0000,[],"['covid19', 'ifrs']",0,16
1311289862092468224,kpmg,2020-09-30,13:00:40,What are the challenges of embedding security in agile development?  Find out in our latest article:  https://t.co/lH2DzRtHg1,267939430,+0000,[],[],0,10
1311022691038658562,kpmg,2020-09-29,19:19:01,Asset managers have proven resiliency and must now get fit for the future. Is your organization prepared? Learn more:  https://t.co/f2mUda240R,267939430,+0000,[],[],0,14
1310957708066074629,kpmg,2020-09-29,15:00:48,Cyber-security: The attack surface now includes the kitchen table. Do you know how to keep your company safe? #CIOsurvey  https://t.co/nI6tZRFxgG  https://t.co/sCWJXxUDRp,267939430,+0000,[],['ciosurvey'],1,16
1309223341287501825,kpmg,2020-09-24,20:09:03,COVID-19 is likely to change the demand for office space as employees and employers embrace virtual working - find out more about commercial #realestate in the new reality.  https://t.co/5MzQFWATp0  https://t.co/WmE3ylhptd,267939430,+0000,[],['realestate'],0,22
1309130673429639169,kpmg,2020-09-24,14:00:49,"Big techs and platform companies remained active in the fintech space in the first half of 2020, while corporates double down on fintech investments amid COVID-19. Read more in our #fintechpulse analysis:  https://t.co/OxCkcb8G5Z",267939430,+0000,[],['fintechpulse'],1,10
1309115658576236551,kpmg,2020-09-24,13:01:09,Read more in this year's #CEOoutlook report:  https://t.co/o175T5YuWF  https://t.co/6vzaLTsiy4,267939430,+0000,[],['ceooutlook'],1,12
1308493784397877250,kpmg,2020-09-22,19:50:03,Learn how digital leaders are outpacing their competitors in delivering real business results. #CIOsurvey  https://t.co/nI6tZRFxgG  https://t.co/cLixeTuIyG,267939430,+0000,[],['ciosurvey'],1,5
1308466241435205633,kpmg,2020-09-22,18:00:36,"How are #GeopoliticalFaceOffs transforming purpose, productivity and market economics? Learn more:  https://t.co/dfFESUMIRa",267939430,+0000,[],['geopoliticalfaceoffs'],1,5
1308406988796309504,kpmg,2020-09-22,14:05:09,"The World Economic Forum, working with Bank of America and Big 4 release set of universal #ESG metrics &amp; disclosures to measure stakeholder capitalism regardless of industry or region.  Learn more about KPMG’s support in the initiative:  https://t.co/NvqVwVPyyX",267939430,+0000,[],['esg'],0,14
1308390778608197632,kpmg,2020-09-22,13:00:45,The COVID-19 crisis is asking hard questions of CEOs – testing their personal resilience and the resilience of their organization. Learn more in this year's #CEOoutlook  https://t.co/HrxY7jBunU,267939430,+0000,[],['ceooutlook'],0,6
1307001599160655873,kpmg,2020-09-18,17:00:38,"In the midst of both an economic and humanitarian crisis, CEOs are putting people first: their employees, their customers and society as a whole. Read more in the full #CEOoutlook:  https://t.co/HrxY7jBunU  https://t.co/zmFY634o4C",267939430,+0000,[],['ceooutlook'],1,18
1306986655426007040,kpmg,2020-09-18,16:01:15,“We knew racial injustice was something we needed to talk about because we’re not going to accept it.” Learn more in this year's #CEOoutlook:  https://t.co/chcU5cwF27 @hansvestberg  https://t.co/sNyfrR1g9V,267939430,+0000,"[{'screen_name': 'hansvestberg', 'name': 'hans vestberg', 'id': '126306707'}]",['ceooutlook'],1,25
1306971434556829697,kpmg,2020-09-18,15:00:47,“You cannot ask your people to do something that you yourself are not prepared to do.” Learn more in this year's #CEOoutlook:  https://t.co/gPrtYMbnEY  https://t.co/OamaIR6q7L,267939430,+0000,[],['ceooutlook'],0,26
1306941234930429953,kpmg,2020-09-18,13:00:46,"""CEOs are prioritizing efforts across the ESG agenda as a real business imperative, with Societal actions coming up alongside the Environmental plans."" #CEOoutlook  https://t.co/O7K7ulceLP  https://t.co/CmbF2iHwt3",267939430,+0000,[],['ceooutlook'],0,19
1306941224931262464,kpmg,2020-09-18,13:00:44,"""CEOs are prioritizing efforts across the ESG agenda as a real business imperative, with Societal actions coming up alongside the Environmental plans."" #CEOoutlook  https://t.co/HrxY7jBunU  https://t.co/PIbtxV6zEL",267939430,+0000,[],['ceooutlook'],0,8
1306654317202542594,kpmg,2020-09-17,18:00:40,Cyber risk remains in the top 5 threats to corporate growth. KPMG's Akhilesh Tuteja shares his views on #cybersecurity in the new reality. #CEOoutlook  https://t.co/nAGXhpjzor,267939430,+0000,[],"['cybersecurity', 'ceooutlook']",0,18
1306639255150702594,kpmg,2020-09-17,17:00:49,"""CEOs recognize that losing key employees and attracting specialized talent can have a critical impact on future business performance."" Learn more in our #CEOoutlook:  https://t.co/HrxY7jBunU  https://t.co/P3jWRbEICk",267939430,+0000,[],['ceooutlook'],0,22
1306624348950802434,kpmg,2020-09-17,16:01:35,“We are at a moment in history where leaders need to step up.” Read more in this year's #CEOoutlook:  https://t.co/RbSeIn1gM9 @Salsanogroup  https://t.co/IbkBpwI2wT,267939430,+0000,"[{'screen_name': 'salsanogroup', 'name': 'salsano group', 'id': '914149180213485568'}]",['ceooutlook'],0,11
1306621235367997440,kpmg,2020-09-17,15:49:13,"KPMG International announces Carl Carande to become the Global Head of Advisory effective October 1st, succeeding Mark Goodburn who successfully led the Global Advisory function for nearly 10 years. Read more:  https://t.co/NkXj5eBUHB  https://t.co/30DgByoCAk",267939430,+0000,[],[],0,24
1306609129587384326,kpmg,2020-09-17,15:01:06,Did you know that 71% of CEOs say they want to lock-in climate change gains made as a result of the pandemic? Learn more in the 2020 #CEOoutlook:  https://t.co/B0Y4QVCuYq  https://t.co/PQEi9WLy3o,267939430,+0000,[],['ceooutlook'],0,12
1306578911506161666,kpmg,2020-09-17,13:01:02,Read more in this year's #CEOoutlook:  https://t.co/Dg5nI1HUs3  https://t.co/bB52H9otsy,267939430,+0000,[],['ceooutlook'],0,11
1306291902648668162,kpmg,2020-09-16,18:00:33,"“The pandemic has given CEOs a clear sense of what is possible in the future of work"". Read more in this year's #CEOoutlook:  https://t.co/HrxY7jBunU  https://t.co/i5pMg9eX4Z",267939430,+0000,[],['ceooutlook'],0,32
1306261797066936322,kpmg,2020-09-16,16:00:56,Did you know that only 32% of CEOs feel confident in the growth prospects of the global economy? Read more in this year's #CEOoutlook:  https://t.co/1SJkXepktg  https://t.co/eKO3ZMX6TU,267939430,+0000,[],['ceooutlook'],1,13
1306246760780754944,kpmg,2020-09-16,15:01:11,"“The first decision I made as new CEO was to ask 25,000 people to work from home.” Read more in this year's #CEOoutlook. @sjhasker  https://t.co/KUwGeog6vN  https://t.co/cN9MmVMQEp",267939430,+0000,"[{'screen_name': 'sjhasker', 'name': 'steve hasker', 'id': '285724017'}]",['ceooutlook'],3,34
1305944615636393996,kpmg,2020-09-15,19:00:34,“A company cannot continue to exist without co-existing with society and with nature.” Learn more in this year's #CEOoutlook:  https://t.co/SwgZHzbhbv  https://t.co/ltVBN07N9F,267939430,+0000,[],['ceooutlook'],0,17
1305929582110011392,kpmg,2020-09-15,18:00:50,55% of CEOs changed their strategic response to the pandemic either entirely or to some degree as a result of being personally affected. Read more. #CEOoutlook  https://t.co/Y5H7zDrTuM  https://t.co/GS1QsrvdaG,267939430,+0000,[],['ceooutlook'],0,24
1305914444170629121,kpmg,2020-09-15,17:00:40,"“Organizations are increasing their investment in digital transformation to future proof their businesses."" Read this year's #CEOoutlook:  https://t.co/HrxY7jBunU  https://t.co/dkRjJQ3He8",267939430,+0000,[],['ceooutlook'],0,19
1305908923157934085,kpmg,2020-09-15,16:38:44,"“Today, you need to be a people leader above all else.” Read more in this year's #CEOoutlook:  https://t.co/MuWdjxKFmY  https://t.co/S6Urmwmxbk",267939430,+0000,[],['ceooutlook'],0,17
1305893889782448128,kpmg,2020-09-15,15:39:00,"In January, CEOs ranked talent risk behind 11 other risks to growth. However, since the start of the pandemic, talent has risen to be named as the most significant threat to their businesses. Read more in the #CEOoutlook:  https://t.co/4g6wABSpT9  https://t.co/zb3cBhwa9m",267939430,+0000,[],['ceooutlook'],0,16
1305864408669794305,kpmg,2020-09-15,13:41:51,"“For leaders, there’s a greater obligation to be more visible, empathetic, and engaged.” Read more in this year's #CEOoutlook:  https://t.co/dvr0b1PXsz  https://t.co/O6XCxMfbIt",267939430,+0000,[],['ceooutlook'],0,18
1305652131198832642,kpmg,2020-09-14,23:38:20,"After our initial #CEOoutlook survey early in the year, we conducted a follow-up 'pulse' to understand how the thinking has evolved. Read the KPMG 2020 CEO Outlook now:  https://t.co/HrxY7jBunU  https://t.co/Dsv7eKxWTy",267939430,+0000,[],['ceooutlook'],8,57
1304470171445276673,kpmg,2020-09-11,17:21:39,Congratulations to Al-Azhar University from Egypt on being named the Enactus World Champion! #EnactusWorldCup #WeAllWin,267939430,+0000,[],"['enactusworldcup', 'weallwin']",0,21
1304434803564052480,kpmg,2020-09-11,15:01:07,#COVID-19 has changed the required skillsets for both employees and leaders. #HR new reality  https://t.co/L9lqwgHpcI  https://t.co/o3RHiRbwZx,267939430,+0000,[],"['covid', 'hr']",0,18
1304408378102423552,kpmg,2020-09-11,13:16:06,The new edition of Insights into #IFRS is now out – our practical guide to help you tell your company's story  https://t.co/n7qz3V9eiy  https://t.co/y4KJ2dQVmT,267939430,+0000,[],['ifrs'],0,18
1304173264982421510,kpmg,2020-09-10,21:41:51,KPMG and @AIMA_org Global #HedgeFund survey highlights 8 key areas defining fund managers’ agenda in the new reality shaped by COVID-19. Learn more:  https://t.co/S9jYXKPR8b,267939430,+0000,"[{'screen_name': 'aima_org', 'name': 'aima', 'id': '388932692'}]",['hedgefund'],1,9
1304149902860193792,kpmg,2020-09-10,20:09:01,COVID-19 has caused pressure in #fintech investments as well as changes in consumer and business behaviors – here are the top fintech trends as we look into the post-pandemic new reality:  https://t.co/zgtTQa70jO #fintechpulse,267939430,+0000,[],"['fintech', 'fintechpulse']",0,16
1304146136119246854,kpmg,2020-09-10,19:54:03,What can we expect for #realestate in the post-COVID-19 new reality? Learn more:  https://t.co/Dafw5cd3JB  https://t.co/6grvwiQ4d2,267939430,+0000,[],['realestate'],0,11
1304072332995178496,kpmg,2020-09-10,15:00:47,You could put your customers and your employees first with a digital #HR mindset. Find out how to power cultural change in this blog.  https://t.co/72eL4KS6qR  https://t.co/xdNKDBTd4o,267939430,+0000,[],['hr'],2,12
1303749245032378369,kpmg,2020-09-09,17:36:57,Explore what #HR Pathfinders are doing differently that sets them apart from the crowd.  https://t.co/L9lqwgHpcI  https://t.co/nHi6oYPQR6,267939430,+0000,[],['hr'],0,11
1303732283120193537,kpmg,2020-09-09,16:29:33,We're proud to work with @Enactus and our commitment to lifelong learning. Watch the #EnactusWorldCup Opening Ceremony message from KPMG Global Chairman and CEO @BillThomas_KPMG. #WeAllWin  https://t.co/VcJHbxn4JK,267939430,+0000,"[{'screen_name': 'enactus', 'name': 'enactus', 'id': '821516286'}, {'screen_name': 'billthomas_kpmg', 'name': 'bill thomas', 'id': '841710853309132801'}]","['enactusworldcup', 'weallwin']",0,35
1303347542344847361,kpmg,2020-09-08,15:00:43,"In an age of upheaval, this blog shows how a digital mindset can help you redefine your #HR for now and the future. Read more:  https://t.co/72eL4KS6qR  https://t.co/Nbv9ENpKXz",267939430,+0000,[],['hr'],0,12
1303037324356390915,kpmg,2020-09-07,18:28:02,Banks must re-evaluate their operating models and embrace the digital economy to emerge from COVID-19 stronger than before. Register for our webcast to explore the New Reality for Banks.  https://t.co/v6upt5Kvdp  https://t.co/Vqa0XPWNtk,267939430,+0000,[],[],0,24
1301535603360772097,kpmg,2020-09-03,15:00:43,"How you can connect your #HR from end to end, make everyone an innovator, adopt a growth mindset and more. Find out how in this new blog.  https://t.co/72eL4KS6qR  https://t.co/OZfCaxtcBy",267939430,+0000,[],['hr'],1,18
