id,username,date,time,tweet,user_id,timezone,mentions,hashtags,replies_count,likes_count,retweets_count,replies_count.1,cleaned_review,sentiment_polarity,sentiment,sentiment_int
1115692484401745921,mark_weinberger,2019-04-10,00:36:31,"Welcome to #InnovationRealized 19, which is about giving space to make way for creative thinking and collaboration. This is where innovation is happening.",1018795410,530,[],['InnovationRealized'],0,16,4,0,welcome to innovationrealized 19 which is about giving space to make way for creative thinking and collaboration this is where innovation is happening,0.65,Positive,1
1115357791814914052,mark_weinberger,2019-04-09,02:26:34,No company stands apart from the big issues we face across society. How we engage with these issues will shape the future for every one of us. Great to discuss this at #InnovationRealized in Boston today.  https://t.co/ogckjwrtsM,1018795410,530,[],['InnovationRealized'],1,42,14,1,no company stands apart from the big issues we face across society how we engage with these issues will shape the future for every one of us great to discuss this at innovationrealized in boston today,0.26666666666666666,Positive,1
1114150696700583936,mark_weinberger,2019-04-05,18:30:00,"Technology will not just replace jobs, it will create new jobs too - often in unpredictable ways. It's time for technological optimism; many of the most transformative technologies still require a human element.  https://t.co/MUi0hpszOG #FutureOfWork #tech",1018795410,530,[],"['FutureOfWork', 'tech']",0,20,12,0,technology will not just replace jobs it will create new jobs too often in unpredictable ways its time for technological optimism many of the most transformative technologies still require a human element futureofwork tech,0.19393939393939394,Positive,1
1113878909727256577,mark_weinberger,2019-04-05,00:30:01,"Last week I had the pleasure of visiting Japan and meeting many of our APAC colleagues. Great to see our leadership team and the new Chairwoman &amp; CEO of EY Japan Assurance firm, Masami Katakura. Thank you for a larger than normal lunch and good discussion. #BetterWorkingWorld  https://t.co/muXJpvsEzJ",1018795410,530,[],['BetterWorkingWorld'],2,83,10,2,last week i had the pleasure of visiting japan and meeting many of our apac colleagues great to see our leadership team and the new chairwoman amp ceo of ey japan assurance firm masami katakura thank you for a larger than normal lunch and good discussion betterworkingworld,0.26079545454545455,Positive,1
1113788310013513729,mark_weinberger,2019-04-04,18:30:00,"We are expanding our global legal services, through the acquisition of @Pangea3 - the original pioneer in the alternative legal services space. I'm proud that we continuously work to provide clients with holistic solutions enabled by technology.  https://t.co/VjqlsOGcbW",1018795410,530,['Pangea3'],[],0,13,6,0,we are expanding our global legal services through the acquisition of pangea3 the original pioneer in the alternative legal services space im proud that we continuously work to provide clients with holistic solutions enabled by technology,0.315,Positive,1
1113616281327013889,mark_weinberger,2019-04-04,07:06:26,"For a long time in the history of business, it was enough to make a profit. But not anymore. Today, biz leaders need to generate prosperity far into the future. I couldn't agree more: you need to be bold in order to create long term value.  https://t.co/UVIryWIJqK #InclusiveGrowth",1018795410,530,[],['InclusiveGrowth'],0,26,9,0,for a long time in the history of business it was enough to make a profit but not anymore today biz leaders need to generate prosperity far into the future i couldnt agree more you need to be bold in order to create long term value inclusivegrowth,0.11904761904761904,Positive,1
1112053836418551810,mark_weinberger,2019-03-30,23:37:50,"Earlier this week, I had the opportunity to attend the @MilkenInstitute’s first Japan Symposium. To reflect its leadership position today, we must create opportunities for Japan to make positive contributions to the global dialogue. #MIGlobal  https://t.co/bZrm8xb0q1",1018795410,530,['MilkenInstitute'],['MIGlobal'],1,30,2,1,earlier this week i had the opportunity to attend the milkeninstitutes first japan symposium to reflect its leadership position today we must create opportunities for japan to make positive contributions to the global dialogue miglobal,0.11931818181818182,Positive,1
1111659285782630402,mark_weinberger,2019-03-29,21:30:02,"Great article on #InclusiveGrowth. “Leaders should view diversity and inclusion as more than a nice-to-have, if they want to survive in the long term.” I couldn’t agree more – it’s a business imperative.  https://t.co/DMuGdYdE7w #inclusion",1018795410,530,[],"['InclusiveGrowth', 'inclusion']",1,13,5,1,great article on inclusivegrowth leaders should view diversity and inclusion as more than a nicetohave if they want to survive in the long term i couldnt agree more its a business imperative inclusion,0.4375,Positive,1
1111266695941890048,mark_weinberger,2019-03-28,19:30:01,"CEOs are expected to have the answers, but one of the biggest jobs as CEO is actually to ask the questions. Great #BetterQuestions podcast featuring @johnrudaizky and @HalGregersen.  https://t.co/3BFuY1iI87 #BetterAnswers",1018795410,530,"['johnrudaizky', 'HalGregersen']","['BetterQuestions', 'BetterAnswers']",0,19,5,0,ceos are expected to have the answers but one of the biggest jobs as ceo is actually to ask the questions great betterquestions podcast featuring johnrudaizky and halgregersen betteranswers,0.23333333333333336,Positive,1
1110921775112769536,mark_weinberger,2019-03-27,20:39:25,"Thanks for the discussion Tak Nilnami, President and CEO, @SuntoryGlobal, @nishy03, Deputy Chief Cabinet Secretary, Cabinet Office of Japan and Kevin Lu, Partner and Chairman Asia, Partners Group.",1018795410,530,"['SuntoryGlobal', 'nishy03']",[],0,1,0,0,thanks for the discussion tak nilnami president and ceo suntoryglobal nishy03 deputy chief cabinet secretary cabinet office of japan and kevin lu partner and chairman asia partners group,0.2,Positive,1
1110921394467020800,mark_weinberger,2019-03-27,20:37:55,We can’t understate the tremendous growth opportunities that exist in Asia. The OECD predicts Asia will remain the world’s fastest growing region until at least 2030. A great discussion at The @MilkenInstitute first Japan Symposium. #MIGlobal #BetterWorkingWorld  https://t.co/ppgjHO8Dug,1018795410,530,['MilkenInstitute'],"['MIGlobal', 'BetterWorkingWorld']",2,14,6,2,we cant understate the tremendous growth opportunities that exist in asia the oecd predicts asia will remain the worlds fastest growing region until at least 2030 a great discussion at the milkeninstitute first japan symposium miglobal betterworkingworld,0.27083333333333337,Positive,1
1109168808411971587,mark_weinberger,2019-03-23,00:33:45,Congratulations to @AndyBaldwin_ on being appointed our new Global Managing Partner – Client Service! Andy has done a great job on executing our global strategy and bringing together diverse groups and regions to work cohesively towards our strategic priorities.,1018795410,530,['AndyBaldwin_'],[],2,53,12,2,congratulations to andybaldwin on being appointed our new global managing partner client service andy has done a great job on executing our global strategy and bringing together diverse groups and regions to work cohesively towards our strategic priorities,0.2340909090909091,Positive,1
1109078524193894400,mark_weinberger,2019-03-22,18:35:00,"Inclusive capitalism means a stronger society. If we get this right, it won’t just be a boon for businesses — it will benefit our entire society. #BetterWorkingWorld  https://t.co/3K3gSF1fdT",1018795410,530,[],['BetterWorkingWorld'],0,25,13,0,inclusive capitalism means a stronger society if we get this right it wont just be a boon for businesses it will benefit our entire society betterworkingworld,0.14285714285714285,Positive,1
1108732998550208513,mark_weinberger,2019-03-21,19:42:00,"Never underestimate your impact and do not forget that your contribution, no matter how small, can always contribute to something bigger.   https://t.co/vVsvIua3KX",1018795410,530,[],[],1,14,1,1,never underestimate your impact and do not forget that your contribution no matter how small can always contribute to something bigger,-0.125,Negative,-1
1108419189969178624,mark_weinberger,2019-03-20,22:55:02,"@TonyFratto @ey @GW_Partnership @BizRoundtable Tony, thanks for being here and your great support for the region.",1018795410,530,"['TonyFratto', 'ey', 'GW_Partnership', 'BizRoundtable']",[],0,4,1,0,tonyfratto ey gwpartnership bizroundtable tony thanks for being here and your great support for the region,0.5,Positive,1
1108412891974287360,mark_weinberger,2019-03-20,22:30:01,Looking at challenges from every angle is fundamental for businesses in today’s #TransformativeAge.  https://t.co/Odu8n2sJcb,1018795410,530,[],['TransformativeAge'],0,14,2,0,looking at challenges from every angle is fundamental for businesses in todays transformativeage,0.0,Neutral,0
1107995386990473216,mark_weinberger,2019-03-19,18:51:00,"The cornerstone of a successful business is one led by purpose, strategy, and culture. Great blog looking at the value of culture and social impact in today’s world. #BetterWorkingWorld  https://t.co/8CEqvFIw6d",1018795410,530,[],['BetterWorkingWorld'],1,23,5,1,the cornerstone of a successful business is one led by purpose strategy and culture great blog looking at the value of culture and social impact in todays world betterworkingworld,0.5277777777777778,Positive,1
1106223463696683008,mark_weinberger,2019-03-14,21:30:01,The best leaders are those who lead with a sense of purpose. A great case study on how to create a purpose centered leadership program #BetterWorkingWorld  https://t.co/vbkjJTgvlu,1018795410,530,[],['BetterWorkingWorld'],0,26,3,0,the best leaders are those who lead with a sense of purpose a great case study on how to create a purpose centered leadership program betterworkingworld,0.9,Positive,1
1105859211492294656,mark_weinberger,2019-03-13,21:22:36,Such a warm and energetic welcome from our #EYGDS colleagues. It is great to be here in Bangalore discussing our vision and how they contribute. #BetterWorkingWorld,1018795410,530,[],"['EYGDS', 'BetterWorkingWorld']",4,74,17,4,such a warm and energetic welcome from our eygds colleagues it is great to be here in bangalore discussing our vision and how they contribute betterworkingworld,0.54,Positive,1
1105815779851882496,mark_weinberger,2019-03-13,18:30:01,"The divide in trust has never been bigger. A 16-point gap between the more trusting informed public and the far-more-skeptical mass population shows we need work on inclusive growth and building trust between business, government and the public.  https://t.co/naxIDRyoo2",1018795410,530,[],[],0,12,1,0,the divide in trust has never been bigger a 16point gap between the more trusting informed public and the farmoreskeptical mass population shows we need work on inclusive growth and building trust between business government and the public,0.125,Positive,1
1105535031076966401,mark_weinberger,2019-03-12,23:54:25,"#Entrepreneurs are essential to the global economy. They ask tough questions, drive innovation and compete with big business. Congratulations. #WinningWomen #BetterWorkingWorld",1018795410,530,[],"['Entrepreneurs', 'WinningWomen', 'BetterWorkingWorld']",1,25,4,1,entrepreneurs are essential to the global economy they ask tough questions drive innovation and compete with big business congratulations winningwomen betterworkingworld,-0.09722222222222222,Neutral,0
1104034037360979969,mark_weinberger,2019-03-08,20:30:01,#SheBelongs in leadership. Businesses rely on the diversity of thought to continue success. Let’s take a moment to celebrate the fantastic women that build a #BetterWorkingWorld and also look at how we need to accelerate gender equality. #WomenFastForward #IWD2019,1018795410,530,[],"['SheBelongs', 'BetterWorkingWorld', 'WomenFastForward', 'IWD2019']",0,80,20,0,shebelongs in leadership businesses rely on the diversity of thought to continue success lets take a moment to celebrate the fantastic women that build a betterworkingworld and also look at how we need to accelerate gender equality womenfastforward iwd2019,0.35,Positive,1
1103671648807464962,mark_weinberger,2019-03-07,20:30:00,Biz today need to focus on creating long-term value to build trust. Some of the ways to do this is to make the most out of new technologies and equip talent with the skills to use it. #BetterWorkingWorld  https://t.co/Icu9bZlWDQ,1018795410,530,[],['BetterWorkingWorld'],0,8,2,0,biz today need to focus on creating longterm value to build trust some of the ways to do this is to make the most out of new technologies and equip talent with the skills to use it betterworkingworld,0.3181818181818182,Positive,1
1103326482301112320,mark_weinberger,2019-03-06,21:38:26,"We're seeing a very strong US economy right now with a lot of opportunities. In a few more quarters, we will start to experience the real benefits of #TaxReform. Great to talk with you yesterday @MariaBartiromo @morningsMaria @FoxBusiness  https://t.co/uFJdI4kDk0",1018795410,530,"['MariaBartiromo', 'morningsMaria', 'FoxBusiness']",['TaxReform'],0,17,4,0,were seeing a very strong us economy right now with a lot of opportunities in a few more quarters we will start to experience the real benefits of taxreform great to talk with you yesterday mariabartiromo morningsmaria foxbusiness,0.35817460317460315,Positive,1
1102932778310664192,mark_weinberger,2019-03-05,19:34:00,"As banks step up to the challenge of financial crime, they need to act fast in building #trust. It’s critical to invest in risk management for the long term – to change perceptions and be fully prepared for tomorrow.  https://t.co/GmufqvCsSC #BetterWorkingWorld",1018795410,530,[],"['trust', 'BetterWorkingWorld']",0,10,1,0,as banks step up to the challenge of financial crime they need to act fast in building trust its critical to invest in risk management for the long term to change perceptions and be fully prepared for tomorrow betterworkingworld,0.037500000000000006,Neutral,0
1101516929758621696,mark_weinberger,2019-03-01,21:47:55,"Congratulations to Masami Katakura for being named as the first Chairman &amp; CEO of EY ShinNihon, and becoming the 1st female senior leader within a Japan Big Four organization. A historic moment in our journey towards gender equality. #IWD2019 #WomenFastForward #SheBelongs",1018795410,530,[],"['IWD2019', 'WomenFastForward', 'SheBelongs']",1,215,46,1,congratulations to masami katakura for being named as the first chairman amp ceo of ey shinnihon and becoming the 1st female senior leader within a japan big four organization a historic moment in our journey towards gender equality iwd2019 womenfastforward shebelongs,0.13999999999999999,Positive,1
1101515690098507777,mark_weinberger,2019-03-01,21:43:00,The percentage of women on public company boards globally is disappointingly low at 16.7%. As leaders we all have a responsibility. Some good actions listed here. #GenderDiversity  https://t.co/pvNTzI2l5O,1018795410,530,[],['GenderDiversity'],0,3,0,0,the percentage of women on public company boards globally is disappointingly low at 167 as leaders we all have a responsibility some good actions listed here genderdiversity,0.2333333333333333,Positive,1
1101146255701487616,mark_weinberger,2019-02-28,21:15:00,"Two great points in this article: first, we can’t measure the future with yesterday’s metrics, the world is changing. Secondly, investment in human capital and your education is never a bad investment. #Millennials  https://t.co/XbNHTSQgHi",1018795410,530,[],['Millennials'],1,23,3,1,two great points in this article first we cant measure the future with yesterdays metrics the world is changing secondly investment in human capital and your education is never a bad investment millennials,0.2333333333333333,Positive,1
1100759205282304000,mark_weinberger,2019-02-27,19:37:00,Very good point raised by @GAtalla_EY on trust as we build our #SmartCities. They need their citizens to believe in the value exchange for providing the #data and most of all they need to safeguard that data #MWC19 #NextWave,1018795410,530,['GAtalla_EY'],"['SmartCities', 'data', 'MWC19', 'NextWave']",0,2,3,0,very good point raised by gatallaey on trust as we build our smartcities they need their citizens to believe in the value exchange for providing the data and most of all they need to safeguard that data mwc19 nextwave,0.705,Positive,1
1100755808185393161,mark_weinberger,2019-02-27,19:23:30,"What it means to be a global CEO has changed. It was great to attend @CECPTweets and chat about purpose led growth with Dinesh C. Paliwal, President &amp; CEO of @Harman #BOB2019",1018795410,530,"['CECPTweets', 'Harman']",['BOB2019'],0,12,4,0,what it means to be a global ceo has changed it was great to attend cecptweets and chat about purpose led growth with dinesh c paliwal president amp ceo of harman bob2019,0.4,Positive,1
1098997446821244933,mark_weinberger,2019-02-22,22:56:24,A great example from @EY_UKI of creating a positive environment where everyone can thrive. Congratulations and the special award to recognize 10 years of commitment to making the world a better place is well deserved. @thesundaytimes #BestCompanies2019 #BetterWorkingWorld,1018795410,530,"['EY_UKI', 'thesundaytimes']","['BestCompanies2019', 'BetterWorkingWorld']",0,55,10,0,a great example from eyuki of creating a positive environment where everyone can thrive congratulations and the special award to recognize 10 years of commitment to making the world a better place is well deserved thesundaytimes bestcompanies2019 betterworkingworld,0.47110389610389614,Positive,1
1098768336769478656,mark_weinberger,2019-02-22,07:46:00,"If we are going to be more inclusive we need to tackle the low levels of women in #STEM. It’s more than just test scores, getting exposure in a lab stimulates desire and curiosity. Summer programs are a great way to achieve this. #WomenFastForward  https://t.co/PipSMrNwiF",1018795410,530,[],"['STEM', 'WomenFastForward']",2,21,7,2,if we are going to be more inclusive we need to tackle the low levels of women in stem its more than just test scores getting exposure in a lab stimulates desire and curiosity summer programs are a great way to achieve this womenfastforward,0.45,Positive,1
1098576069999898624,mark_weinberger,2019-02-21,19:02:00,Great to see the growth of this program to include all these countries. Good luck to all involved. #WomenFastForward #EYCorporateFinanceWomanOfTheYear,1018795410,530,[],"['WomenFastForward', 'EYCorporateFinanceWomanOfTheYear']",0,8,2,0,great to see the growth of this program to include all these countries good luck to all involved womenfastforward eycorporatefinancewomanoftheyear,0.75,Positive,1
1098260238954909713,mark_weinberger,2019-02-20,22:07:00,#Entrepreneurs are essential to the global economy and there’s no set path to becoming one. Faith’s experience and #BetterQuestions asking led to creation of the EY Business Accelerator program to drive inclusive growth in Zimbabwe. #BetterWorkingWorld  https://t.co/sesNwsHrXB,1018795410,530,[],"['Entrepreneurs', 'BetterQuestions', 'BetterWorkingWorld']",1,24,11,1,entrepreneurs are essential to the global economy and theres no set path to becoming one faiths experience and betterquestions asking led to creation of the ey business accelerator program to drive inclusive growth in zimbabwe betterworkingworld,0.15,Positive,1
1097858592445812736,mark_weinberger,2019-02-19,19:31:00,To achieve this status for this length of time is a fantastic achievement. Well done to the whole @EY_US team for your dedication and commitment. #BetterWorkingWorld,1018795410,530,['EY_US'],['BetterWorkingWorld'],1,43,12,1,to achieve this status for this length of time is a fantastic achievement well done to the whole eyus team for your dedication and commitment betterworkingworld,0.30000000000000004,Positive,1
1097529174850441217,mark_weinberger,2019-02-18,21:42:01,"As we look to AI to help us make more decisions, and decisions with larger impacts we need to ensure the relationship is built on trust. #BetterWorkingWorld  https://t.co/CvBX0b1yfN",1018795410,530,[],['BetterWorkingWorld'],1,21,7,1,as we look to ai to help us make more decisions and decisions with larger impacts we need to ensure the relationship is built on trust betterworkingworld,0.25,Positive,1
1096436220555595777,mark_weinberger,2019-02-15,21:19:00,"Some great points on the future of work.  As work becomes more complex, mindsets trump skillsets and everything we do must be inclusive. #BetterWorkingWorld  https://t.co/9Wto5Q2e3B",1018795410,530,[],['BetterWorkingWorld'],3,13,5,3,some great points on the future of work as work becomes more complex mindsets trump skillsets and everything we do must be inclusive betterworkingworld,0.25,Positive,1
1095699157073956864,mark_weinberger,2019-02-13,20:30:10,#Diversity and #inclusivity are crucial for organizational success. Sponsorships like this are a great way to make sure that we make sure technology is not only disruptive but is also inclusive. #BetterWorkingWorld,1018795410,530,[],"['Diversity', 'inclusivity', 'BetterWorkingWorld']",1,40,11,1,diversity and inclusivity are crucial for organizational success sponsorships like this are a great way to make sure that we make sure technology is not only disruptive but is also inclusive betterworkingworld,0.35000000000000003,Positive,1
1094959490569515008,mark_weinberger,2019-02-11,19:31:00,A great article that really highlights the power of digital technologies and some practical applications in governments that are helping create a #BetterWorkingWorld.  https://t.co/gKp9VqTHAI,1018795410,530,[],['BetterWorkingWorld'],6,10,5,6,a great article that really highlights the power of digital technologies and some practical applications in governments that are helping create a betterworkingworld,0.3333333333333333,Positive,1
1094674667691012098,mark_weinberger,2019-02-11,00:39:13,@TerpsMLax You go Steven!,1018795410,530,['TerpsMLax'],[],0,0,0,0,terpsmlax you go steven,0.0,Neutral,0
1093911333127536641,mark_weinberger,2019-02-08,22:06:00,"#Diversity &amp; #Inclusion are essential elements of culture, which is the lifeblood of organizations. Proud to support #valuable, @CarolineBinc, &amp; the effort to bring workforce inclusion of those with diverse abilities to the C-Suite agenda where it belongs  https://t.co/bNXWXtUCj2",1018795410,530,['CarolineBinc'],"['Diversity', 'Inclusion', 'valuable']",8,52,20,8,diversity amp inclusion are essential elements of culture which is the lifeblood of organizations proud to support valuable carolinebinc amp the effort to bring workforce inclusion of those with diverse abilities to the csuite agenda where it belongs,0.4,Positive,1
1093872076379906048,mark_weinberger,2019-02-08,19:30:00,"Couldn’t agree more, trust underpins any actions to improve #inclusiveness. Along with focusing on the big questions, education and long-term as highlighted @AlisonKayEY. #BetterWorkingWorld   https://t.co/crZBzO1N7L",1018795410,530,['AlisonKayEY'],"['inclusiveness', 'BetterWorkingWorld']",2,10,3,2,couldnt agree more trust underpins any actions to improve inclusiveness along with focusing on the big questions education and longterm as highlighted alisonkayey betterworkingworld,0.25,Positive,1
1093585184224673793,mark_weinberger,2019-02-08,00:30:00,"Great highlight by @JonasPrising, @ManpowerGroup. Innovation is a great enabler throughout the whole organization, the success is determined by how we build digital trust. #BetterWorkingWorld",1018795410,530,"['JonasPrising', 'ManpowerGroup']",['BetterWorkingWorld'],0,13,3,0,great highlight by jonasprising manpowergroup innovation is a great enabler throughout the whole organization the success is determined by how we build digital trust betterworkingworld,0.42000000000000004,Positive,1
1093539888035753985,mark_weinberger,2019-02-07,21:30:00,This recognition shows our teams are focused on helping clients use digital and other technologies to increase connectivity and improve their performance. #BetterWorkingWorld  https://t.co/cXfERAe4h3,1018795410,530,[],['BetterWorkingWorld'],0,18,3,0,this recognition shows our teams are focused on helping clients use digital and other technologies to increase connectivity and improve their performance betterworkingworld,-0.0625,Neutral,0
1091148883319771137,mark_weinberger,2019-02-01,07:09:01,@MariaBartiromo @MorningsMaria @FoxBusiness @dagenmcdowell Wow.,1018795410,530,"['MariaBartiromo', 'MorningsMaria', 'FoxBusiness', 'dagenmcdowell']",[],0,0,0,0,mariabartiromo morningsmaria foxbusiness dagenmcdowell wow,0.1,Positive,1
1091018271544016899,mark_weinberger,2019-01-31,22:30:00,"In her latest blog, @BethBrooke_EY announces the partnership we’ve formed with 6 other organizations that will help drive inclusive growth and advance social &amp; economic inclusion for the #LGBTI community. #BetterWorkingWorld  https://t.co/w3GtuUzDnE",1018795410,530,['BethBrooke_EY'],"['LGBTI', 'BetterWorkingWorld']",1,18,7,1,in her latest blog bethbrookeey announces the partnership weve formed with 6 other organizations that will help drive inclusive growth and advance social amp economic inclusion for the lgbti community betterworkingworld,0.15208333333333335,Positive,1
1090350704982720513,mark_weinberger,2019-01-30,02:17:20,"Some great discussions at #WEF19, thanks to all that participated on our panels. #BetterWorkingWorld",1018795410,530,[],"['WEF19', 'BetterWorkingWorld']",0,9,2,0,some great discussions at wef19 thanks to all that participated on our panels betterworkingworld,0.5,Positive,1
