id,username,date,time,tweet,user_id,timezone,mentions,hashtags,replies_count,likes_count,retweets_count,replies_count.1,cleaned_review,sentiment_polarity,sentiment,sentiment_int
1162008543572189185,mark_weinberger,2019-08-15,20:00:00,"While #AI is transforming industries, biz leaders should make sure their AI investments are seen through the lens of #longterm value rather than short term cost.  https://t.co/iZb9dE9o64 #BetterWorkingWorld",1018795410,530,[],"['AI', 'longterm', 'BetterWorkingWorld']",0,13,8,0,while ai is transforming industries biz leaders should make sure their ai investments are seen through the lens of longterm value rather than short term cost betterworkingworld,0.25,Positive,1
1154806087415140352,mark_weinberger,2019-07-26,23:00:01,Yesterday @Carmine_DiSibio hosted the very first live all-partners video - streamed to EY partners across the world. Great to be an audience member to see the exciting plans ahead of us. #BetterWorkingWorld  https://t.co/XGmzG7TBL4,1018795410,530,['Carmine_DiSibio'],['BetterWorkingWorld'],1,51,6,1,yesterday carminedisibio hosted the very first live allpartners video streamed to ey partners across the world great to be an audience member to see the exciting plans ahead of us betterworkingworld,0.3903409090909091,Positive,1
1152239941000163334,mark_weinberger,2019-07-19,21:03:04,@KTwaronite_EY Was a great meeting with great people!  EY in great hands.,1018795410,530,['KTwaronite_EY'],[],0,3,0,0,ktwaroniteey was a great meeting with great people ey in great hands,0.8000000000000002,Positive,1
1151839037201797121,mark_weinberger,2019-07-18,18:30:01,"“The greatest gear shift of all is recognizing when it is time, in fact, to stop being CEO.” Interesting read - now that I’ve stepped down as @EYnews’ Global Chairman and CEO this month.  https://t.co/ikzgcdkqbp",1018795410,530,['EYnews'],[],0,21,6,0,the greatest gear shift of all is recognizing when it is time in fact to stop being ceo interesting read now that ive stepped down as eynews global chairman and ceo this month,0.3361111111111111,Positive,1
1151143594465669121,mark_weinberger,2019-07-16,20:26:34,"Do you want to be successful? Be passionate. “When you do what you love, you don’t only ensure success, but also go home with a smile on your face every night.” Couldn’t agree more.  https://t.co/CIzQImQKyr #BetterWorkingWorld",1018795410,530,[],['BetterWorkingWorld'],4,30,7,4,do you want to be successful be passionate when you do what you love you dont only ensure success but also go home with a smile on your face every night couldnt agree more betterworkingworld,0.32857142857142857,Positive,1
1149664708003131393,mark_weinberger,2019-07-12,18:30:00,I’m an optimist and a big believer in the power of biz working together with governments to collectively solve issues. Honored to take part in the @TheBushCenter ‘Five Questions With…’ to reflect upon my role as EY’s Global Chairman and CEO.  https://t.co/Uv2HKnUayG,1018795410,530,['TheBushCenter'],[],1,15,0,1,im an optimist and a big believer in the power of biz working together with governments to collectively solve issues honored to take part in the thebushcenter five questions with to reflect upon my role as eys global chairman and ceo,0.0,Neutral,0
1148971891975172096,mark_weinberger,2019-07-10,20:37:00,Congratulations to the 733 new EY Partners this year. Proud to have you as the next generation of EY leaders. #BetterWorkingWorld,1018795410,530,[],['BetterWorkingWorld'],0,32,4,0,congratulations to the 733 new ey partners this year proud to have you as the next generation of ey leaders betterworkingworld,0.31212121212121213,Positive,1
1147127991513878534,mark_weinberger,2019-07-05,18:30:00,"In the US alone, nearly six million young people, aged 16 to 24, are disconnected from both work and school. We must focus on mentoring to help young #talent achieve their potential.  https://t.co/uh26XqiMHV",1018795410,530,[],['talent'],1,10,1,1,in the us alone nearly six million young people aged 16 to 24 are disconnected from both work and school we must focus on mentoring to help young talent achieve their potential,0.04,Neutral,0
1146403215275102208,mark_weinberger,2019-07-03,18:30:00,"Through tech we’re becoming a more globally connected biz world. No matter where we are in the world, #AI will eventually become the thread that links us together, resulting in better #collaboration.  https://t.co/jU2O7qXuHN",1018795410,530,[],"['AI', 'collaboration']",0,11,4,0,through tech were becoming a more globally connected biz world no matter where we are in the world ai will eventually become the thread that links us together resulting in better collaboration,0.3625,Positive,1
1145690627453136896,mark_weinberger,2019-07-01,19:18:26,"Congratulations to @Carmine_DiSibio; my colleague, dear friend — and as of today the new @EYnews Global Chairman and CEO! I have great confidence in his leadership. #BetterWorkingWorld  https://t.co/zBOolNEVmK",1018795410,530,"['Carmine_DiSibio', 'EYnews']",['BetterWorkingWorld'],5,203,35,5,congratulations to carminedisibio my colleague dear friend and as of today the new eynews global chairman and ceo i have great confidence in his leadership betterworkingworld,0.31212121212121213,Positive,1
1144295643340562439,mark_weinberger,2019-06-27,22:55:16,@mkovalchuk @EY_US Sweet!  Thx.  Continue to be you!,1018795410,530,"['mkovalchuk', 'EY_US']",[],0,1,0,0,mkovalchuk eyus sweet thx continue to be you,0.35,Positive,1
1144168491701932033,mark_weinberger,2019-06-27,14:30:00,"How can biz make progress for equal LGBT+ rights, when they could be in direct conflict with local laws? Proud that we’ve participated in a @BelongingNYU research which explores 3 models for balancing inclusion with local considerations.  https://t.co/yAH39jsn6v #ProudToBelong",1018795410,530,['BelongingNYU'],['ProudToBelong'],0,4,2,0,how can biz make progress for equal lgbt rights when they could be in direct conflict with local laws proud that weve participated in a belongingnyu research which explores 3 models for balancing inclusion with local considerations proudtobelong,0.18,Positive,1
1143926900290740224,mark_weinberger,2019-06-26,22:30:00,Change causes biz leaders to rethink ideas and plans - for which you need determination. Great article with key personality traits that make an effective biz #leader.  https://t.co/2kTxZG6o0o,1018795410,530,[],['leader'],0,7,2,0,change causes biz leaders to rethink ideas and plans for which you need determination great article with key personality traits that make an effective biz leader,0.4666666666666666,Positive,1
1143339415907000322,mark_weinberger,2019-06-25,07:35:33,@monaandrews Thank you Mona!,1018795410,530,['monaandrews'],[],0,0,0,0,monaandrews thank you mona,0.0,Neutral,0
1143141726393180160,mark_weinberger,2019-06-24,18:30:00,Investing in growth has always been seen as the best way to create jobs. But it's time for biz leaders to turn this perspective around: investing in people can boost economic #growth &amp; development.  https://t.co/AjgcU4sqWP #BetterWorkingWorld,1018795410,530,[],"['growth', 'BetterWorkingWorld']",0,13,2,0,investing in growth has always been seen as the best way to create jobs but its time for biz leaders to turn this perspective around investing in people can boost economic growth amp development betterworkingworld,0.6,Positive,1
1142054562288865280,mark_weinberger,2019-06-21,18:30:00,You can’t implement a brilliant business #strategy without the right culture. Listening to and engaging with people is crucial.  https://t.co/X8RsP9Uygm,1018795410,530,[],['strategy'],1,23,5,1,you cant implement a brilliant business strategy without the right culture listening to and engaging with people is crucial,0.39642857142857146,Positive,1
1141729244751511552,mark_weinberger,2019-06-20,20:57:18,"In my last weeks as Global Chairman and CEO I’m incredibly honored to be named on this list - and grateful to each and every one of the 270,000 EY people for their ongoing support. The success of EY has always come down to our people. #BetterWorkingWorld",1018795410,530,[],['BetterWorkingWorld'],8,126,25,8,in my last weeks as global chairman and ceo im incredibly honored to be named on this list and grateful to each and every one of the 270000 ey people for their ongoing support the success of ey has always come down to our people betterworkingworld,0.20888888888888885,Positive,1
1139517846357192704,mark_weinberger,2019-06-14,18:30:00,"Like our pioneering leader Arthur Young, leaders in every business &amp; community need to embody the right traits and be inclusive: be collaborative, aware of bias, resilient, and show commitment. #BetterWorkingWorld  https://t.co/iktiEbYod7",1018795410,530,[],['BetterWorkingWorld'],2,13,4,2,like our pioneering leader arthur young leaders in every business amp community need to embody the right traits and be inclusive be collaborative aware of bias resilient and show commitment betterworkingworld,0.2119047619047619,Positive,1
1138793076233777152,mark_weinberger,2019-06-12,18:30:01,"How can biz leaders keep up with all new technologies? The successful #WEOY entrepreneurs we met last week showed how: living, leading &amp; working as if the future is happening now. Great article by @Jeff__Wong.  https://t.co/7kEeZIcWuT",1018795410,530,['Jeff__Wong'],['WEOY'],1,15,5,1,how can biz leaders keep up with all new technologies the successful weoy entrepreneurs we met last week showed how living leading amp working as if the future is happening now great article by jeffwong,0.3372727272727273,Positive,1
1137877599437369344,mark_weinberger,2019-06-10,05:52:15,@AllyAsh @_BryanPearce @Yvonne__Diaz @zakajam @_MCurtis @Raffa_Santa @EY_EOY @Alan_Duerden @aparnas012 Excellent team and another outstanding job! Thank you!,1018795410,530,"['AllyAsh', '_BryanPearce', 'Yvonne__Diaz', 'zakajam', '_MCurtis', 'Raffa_Santa', 'EY_EOY', 'Alan_Duerden', 'aparnas012']",[],0,4,0,0,allyash bryanpearce yvonnediaz zakajam mcurtis raffasanta eyeoy alanduerden aparnas012 excellent team and another outstanding job thank you,0.75,Positive,1
1137458650677727238,mark_weinberger,2019-06-09,02:07:29,Congratulations @bradkeywell. Your leadership is exemplified by your desire to positively impact the world around you and overcome challenges that would stop most others in their tracks. You are an extremely worthy EY World Entrepreneur Of The Year winner. #WEOY,1018795410,530,['bradkeywell'],['WEOY'],1,81,30,1,congratulations bradkeywell your leadership is exemplified by your desire to positively impact the world around you and overcome challenges that would stop most others in their tracks you are an extremely worthy ey world entrepreneur of the year winner weoy,0.35353535353535354,Positive,1
1136662282820378624,mark_weinberger,2019-06-06,21:23:01,"An incredible honor to talk to @NataSupernova, one of the most successful supermodels of all time. She has made giving back her mission in life, becoming one of the most influential philanthropists in the world. She truly is a global role model. @Elbi #WEOY #BetterWorkingWorld  https://t.co/N7yN85yieJ",1018795410,530,"['NataSupernova', 'Elbi']","['WEOY', 'BetterWorkingWorld']",1,36,13,1,an incredible honor to talk to natasupernova one of the most successful supermodels of all time she has made giving back her mission in life becoming one of the most influential philanthropists in the world she truly is a global role model elbi weoy betterworkingworld,0.4428571428571429,Positive,1
1136534920472535041,mark_weinberger,2019-06-06,12:56:55,2/3 of our geographic areas today are led by women. We are incredibly proud of this achievement and it’s great to honor all the #WinningWomen here in Monaco who are inspiring the next generation of mold-breakers. #WEOY #WomenFastForward @KellyGrierEY @Julie_Teigland,1018795410,530,"['KellyGrierEY', 'Julie_Teigland']","['WinningWomen', 'WEOY', 'WomenFastForward']",0,8,0,0,23 of our geographic areas today are led by women we are incredibly proud of this achievement and its great to honor all the winningwomen here in monaco who are inspiring the next generation of moldbreakers weoy womenfastforward kellygrierey julieteigland,0.525,Positive,1
1135546678768017409,mark_weinberger,2019-06-03,19:30:00,People are increasingly choosing companies based on social impact. Leaders must act now to better align their strategies to build a more inclusive and sustainable world. #InclusiveGrowth  https://t.co/ZBnqEKBC2x,1018795410,530,[],['InclusiveGrowth'],0,12,5,0,people are increasingly choosing companies based on social impact leaders must act now to better align their strategies to build a more inclusive and sustainable world inclusivegrowth,0.3444444444444444,Positive,1
1134459517524152322,mark_weinberger,2019-05-31,19:30:00,"“As you get into less familiar situations, expect the unexpected.” Great learnings that can help all leaders in their own journeys, both in business and in life.  https://t.co/2iJmWp1083",1018795410,530,[],[],0,4,0,0,as you get into less familiar situations expect the unexpected great learnings that can help all leaders in their own journeys both in business and in life,0.3416666666666667,Positive,1
1133731317777149953,mark_weinberger,2019-05-29,19:16:24,"It is an incredible honor to be EY’s Global Chairman and CEO. Not because of what I do, but because of all the people that I represent. I’m going to miss that - but exciting times are ahead for my successor @Carmine_DiSibio. Great chat! #BetterWorkingWorld",1018795410,530,['Carmine_DiSibio'],['BetterWorkingWorld'],1,72,20,1,it is an incredible honor to be eys global chairman and ceo not because of what i do but because of all the people that i represent im going to miss that but exciting times are ahead for my successor carminedisibio great chat betterworkingworld,0.5,Positive,1
1131922802477588480,mark_weinberger,2019-05-24,19:30:00,Ask questions &amp; show curiosity. Great @Forbes article with advice for the workforce of today.  https://t.co/EnKEp0uKvo,1018795410,530,['Forbes'],[],0,11,4,0,ask questions amp show curiosity great forbes article with advice for the workforce of today,0.8,Positive,1
1131575512151801856,mark_weinberger,2019-05-23,20:30:00,Last year’s #WEOY winner Rubens Menin demonstrates why it’s so important to establish &amp; follow your #purpose. Set your values to drive transformation - not just in business but also in society. #BetterWorkingWorld  https://t.co/SAvKxDRPiO,1018795410,530,[],"['WEOY', 'purpose', 'BetterWorkingWorld']",0,6,0,0,last years weoy winner rubens menin demonstrates why its so important to establish amp follow your purpose set your values to drive transformation not just in business but also in society betterworkingworld,0.2,Positive,1
1131198028344434694,mark_weinberger,2019-05-22,19:30:01,"The #tax professional of today is solving problems and interacting with tax authorities in a whole new way. That’s why I’m very excited about our alliance with @thomsonreuters. Together we will provide our clients with new, leading-edge digital tax services. #BetterWorkingWorld",1018795410,530,['thomsonreuters'],"['tax', 'BetterWorkingWorld']",0,10,1,0,the tax professional of today is solving problems and interacting with tax authorities in a whole new way thats why im very excited about our alliance with thomsonreuters together we will provide our clients with new leadingedge digital tax services betterworkingworld,0.17670454545454548,Positive,1
1130488352619356160,mark_weinberger,2019-05-20,20:30:01,"""Great leaders don't just make happy followers — they inspire more leaders with their examples."" Nice article on the qualities #leaders should possess.  https://t.co/oZq8udkpgN",1018795410,530,[],['leaders'],0,35,13,0,great leaders dont just make happy followers they inspire more leaders with their examples nice article on the qualities leaders should possess,0.675,Positive,1
1129461582747062276,mark_weinberger,2019-05-18,00:30:00,"Trust in data has been impacted by data breaches and ethical issues. For businesses looking to drive consumer #trust, it’s key to not only provide the value of data but also instill a strong sense of #purpose.  https://t.co/Lv3zJlpZon #BetterWorkingWorld",1018795410,530,[],"['trust', 'purpose', 'BetterWorkingWorld']",0,10,4,0,trust in data has been impacted by data breaches and ethical issues for businesses looking to drive consumer trust its key to not only provide the value of data but also instill a strong sense of purpose betterworkingworld,0.15833333333333333,Positive,1
1129411624757006338,mark_weinberger,2019-05-17,21:11:29,"Today, 17 May, is International Day Against Homophobia, Transphobia and Biphobia - a great opportunity to reaffirm our commitment to creating an environment where all of our people can feel like they belong while celebrating uniqueness &amp; individuality. #LGBT #ProudToBelong",1018795410,530,[],"['LGBT', 'ProudToBelong']",0,25,9,0,today 17 may is international day against homophobia transphobia and biphobia a great opportunity to reaffirm our commitment to creating an environment where all of our people can feel like they belong while celebrating uniqueness amp individuality lgbt proudtobelong,0.4,Positive,1
1129055908967997441,mark_weinberger,2019-05-16,21:38:00,We can’t be successful unless our workforce is made up of diverse talent. Our differences make us better. That’s why I’m very proud that we join the #Valuable500 and commit to putting disability inclusion on our agenda.  https://t.co/6sGHOVStsf @500Valuable,1018795410,530,['500Valuable'],['Valuable500'],1,20,2,1,we cant be successful unless our workforce is made up of diverse talent our differences make us better thats why im very proud that we join the valuable500 and commit to putting disability inclusion on our agenda 500valuable,0.75,Positive,1
1128676412125274112,mark_weinberger,2019-05-15,20:30:01,"This week is a special one for me - it's our alumni week. I left EY 3 times, but never left our people. Which is why I ended up joining 4 times. This week, let’s take a moment to celebrate our colleagues, past &amp; present, and connect to the #EYAlumni network.",1018795410,530,[],['EYAlumni'],1,81,20,1,this week is a special one for me its our alumni week i left ey 3 times but never left our people which is why i ended up joining 4 times this week lets take a moment to celebrate our colleagues past amp present and connect to the eyalumni network,0.02142857142857143,Neutral,0
1127936534953508866,mark_weinberger,2019-05-13,19:30:00,"Interesting @Forbes article; vulnerability is a cornerstone for great #leadership. “The courage to be #vulnerable is not about winning or losing, it’s about the courage to show up when you can’t predict or control the outcome.”  https://t.co/JtJS6ChUlh",1018795410,530,['Forbes'],"['leadership', 'vulnerable']",1,13,3,1,interesting forbes article vulnerability is a cornerstone for great leadership the courage to be vulnerable is not about winning or losing its about the courage to show up when you cant predict or control the outcome,0.325,Positive,1
1126864473128689664,mark_weinberger,2019-05-10,20:30:01,There’s a great opportunity for biz leaders to use innovation to build #InclusiveGrowth: by extending benefits &amp; opportunities of innovation to other members of society. Watch more in this video interview with @Jeff__Wong.  https://t.co/lgUiGRElZp #innovation,1018795410,530,['Jeff__Wong'],"['InclusiveGrowth', 'innovation']",0,7,0,0,theres a great opportunity for biz leaders to use innovation to build inclusivegrowth by extending benefits amp opportunities of innovation to other members of society watch more in this video interview with jeffwong innovation,0.39166666666666666,Positive,1
1124331705421172738,mark_weinberger,2019-05-03,20:45:42,"Great to talk with @FoxBusiness at the Milken Global Conference about shared prosperity, trade and tax. Thank you @MariaBartiromo for hosting me and looking forward to our next conversation. #MIGlobal  https://t.co/Sr7MS2AxN6",1018795410,530,"['FoxBusiness', 'MariaBartiromo']",['MIGlobal'],0,11,3,0,great to talk with foxbusiness at the milken global conference about shared prosperity trade and tax thank you mariabartiromo for hosting me and looking forward to our next conversation miglobal,0.26666666666666666,Positive,1
1123260830718537728,mark_weinberger,2019-04-30,21:50:25,Congratulations to @Julie_Teigland - the first woman to lead the EMEIA area. I am very confident that EMEIA will continue to grow and transform with her leadership.  https://t.co/jcNMUMqzhj #BetterWorkingWorld  https://t.co/bOaSxoYxZG,1018795410,530,['Julie_Teigland'],['BetterWorkingWorld'],1,66,16,1,congratulations to julieteigland the first woman to lead the emeia area i am very confident that emeia will continue to grow and transform with her leadership betterworkingworld,0.45,Positive,1
1122913358426939392,mark_weinberger,2019-04-29,22:49:42,Thank you @CFair1 for the great discussion - honored to open the @LinkedInEditors live stream today at #MIGlobal.,1018795410,530,"['CFair1', 'LinkedInEditors']",['MIGlobal'],0,9,2,0,thank you cfair1 for the great discussion honored to open the linkedineditors live stream today at miglobal,0.31212121212121213,Positive,1
1122622502893772807,mark_weinberger,2019-04-29,03:33:56,Look forward to discussing the most promising initiatives to drive shared prosperity tomorrow at the @MilkenInstitute Global Conference. #BetterWorkingWorld #MIGlobal,1018795410,530,['MilkenInstitute'],"['BetterWorkingWorld', 'MIGlobal']",1,23,3,1,look forward to discussing the most promising initiatives to drive shared prosperity tomorrow at the milkeninstitute global conference betterworkingworld miglobal,0.2333333333333333,Positive,1
1121478373128265728,mark_weinberger,2019-04-25,23:47:34,"Great to talk with @BloombergTV about repatriation of money, tax policy and how the role of the auditor is changing. Thank you @DavidWestin for always having a great conversation.  https://t.co/biS693LCfT",1018795410,530,"['BloombergTV', 'DavidWestin']",[],2,18,5,2,great to talk with bloombergtv about repatriation of money tax policy and how the role of the auditor is changing thank you davidwestin for always having a great conversation,0.8,Positive,1
1119273450311507968,mark_weinberger,2019-04-19,21:46:00,"The US economy performance in the face of a challenging global economic &amp; geopolitical climate is just the beginning. If we follow through, Americans will see the economic benefits of the Cuts and Jobs Act's passage for many years to come. #TaxReform  https://t.co/9mpBWRDSgW",1018795410,530,[],['TaxReform'],3,19,4,3,the us economy performance in the face of a challenging global economic amp geopolitical climate is just the beginning if we follow through americans will see the economic benefits of the cuts and jobs acts passage for many years to come taxreform,0.27999999999999997,Positive,1
1118891936876769280,mark_weinberger,2019-04-18,20:30:00,Interesting article on two important traits for biz looking to grow: boldness and consistency. Boldness to help break from the status quo and consistency to ensure strong customer experiences. @Forbes #BetterWorkingWorld  https://t.co/pruTjeqzwN,1018795410,530,['Forbes'],['BetterWorkingWorld'],1,11,6,1,interesting article on two important traits for biz looking to grow boldness and consistency boldness to help break from the status quo and consistency to ensure strong customer experiences forbes betterworkingworld,0.4444444444444444,Positive,1
1118191476855443462,mark_weinberger,2019-04-16,22:06:37,The boardroom of 2019 is concentrating on proactively managing risks and seizing the upside opportunities of disruption. Great article from @SteveKrouskos on how M&amp;A strategies should safeguard growth for tomorrow and beyond. #EYCCB  https://t.co/FG4w9Wi8Ns,1018795410,530,['SteveKrouskos'],['EYCCB'],0,7,1,0,the boardroom of 2019 is concentrating on proactively managing risks and seizing the upside opportunities of disruption great article from stevekrouskos on how mampa strategies should safeguard growth for tomorrow and beyond eyccb,0.8,Positive,1
1117789676675399682,mark_weinberger,2019-04-15,19:30:01,"Biz leaders have to be prepared for what comes next, even though they might not know what that will be. Companies need to be agile. Great discussion at the #EYAnalystSummit.",1018795410,530,[],['EYAnalystSummit'],0,14,3,0,biz leaders have to be prepared for what comes next even though they might not know what that will be companies need to be agile great discussion at the eyanalystsummit,0.43333333333333335,Positive,1
1116800657032400896,mark_weinberger,2019-04-13,02:00:00,Proud to be part of @GW_Partnership and work together with leaders in academia and business to strengthen the Capital Region through the #CapitalCoLAB.  https://t.co/uaRiyFmBhB,1018795410,530,['GW_Partnership'],['CapitalCoLAB'],0,7,0,0,proud to be part of gwpartnership and work together with leaders in academia and business to strengthen the capital region through the capitalcolab,0.8,Positive,1
1116764921029480449,mark_weinberger,2019-04-12,23:38:00,"Trust is critical for all business leaders - not only to seize the upside of disruption, but also to drive inclusive growth. #InnovationRealized #InclusiveGrowth",1018795410,530,[],"['InnovationRealized', 'InclusiveGrowth']",0,17,5,0,trust is critical for all business leaders not only to seize the upside of disruption but also to drive inclusive growth innovationrealized inclusivegrowth,0.0,Neutral,0
